{
  "project_key": "nivki",
  "project_name": "Нивки",
  "apartment": "Квартира 2 350 000 грн (кредит 20 років, 7% річних)",
  "source_pdf": "",
  "exchange_source": "НБУ офіційний курс USD (середньомісячний), API: https://bank.gov.ua/NBU_Exchange/exchange_site",
  "latest_rate_date": "2026-02-21",
  "latest_rate_uah_per_usd": 43.27,
  "generated_at": "2026-02-21T18:12:30",
  "summary": {
    "total": {
      "schedule_usd": 95090.22,
      "fact_uah": 3754310.31,
      "fact_usd": 95090.22,
      "meters": null
    },
    "paid": {
      "schedule_usd": 37365.89,
      "fact_uah": 1256535.23,
      "fact_usd": 37365.89,
      "meters": null
    },
    "remaining": {
      "schedule_usd": 57724.33,
      "fact_uah": 2497775.08,
      "fact_usd": 57724.33,
      "meters": null
    }
  },
  "payments": [
    {
      "id": 0,
      "title": "Перший внесок 15%",
      "due_label": "листопад 2021",
      "due_date": "2021-11-01",
      "payment_date": "2021-11-01",
      "period_year": 2021,
      "period_month": 11,
      "schedule_usd": 13328.94,
      "fact_usd": 13328.94,
      "fact_uah": 352500.0,
      "rate": 26.45,
      "meters": null,
      "percent_increase": "",
      "raw_fact_uah": null,
      "raw_fact_usd": null,
      "status": "paid",
      "flags": {
        "early": false,
        "initial": true
      },
      "base_paid_usd": 13328.94,
      "base_paid_uah": 352500.0,
      "month_index": 1,
      "exclude_from_summary": false
    },
    {
      "id": 1,
      "title": "Кредит 12.2021",
      "due_label": "12.2021",
      "due_date": "2021-12-01",
      "payment_date": "2021-12-01",
      "period_year": 2021,
      "period_month": 12,
      "schedule_usd": 734.01,
      "fact_usd": 734.01,
      "fact_uah": 19975.0,
      "rate": 27.21,
      "meters": null,
      "percent_increase": "",
      "raw_fact_uah": "",
      "raw_fact_usd": null,
      "status": "paid",
      "flags": {
        "early": false,
        "initial": false,
        "holiday": false
      },
      "base_paid_usd": 734.01,
      "base_paid_uah": 19975.0,
      "month_index": 2,
      "exclude_from_summary": false
    },
    {
      "id": 2,
      "title": "Кредит 01.2022",
      "due_label": "01.2022",
      "due_date": "2022-01-01",
      "payment_date": "2022-01-01",
      "period_year": 2022,
      "period_month": 1,
      "schedule_usd": 712.14,
      "fact_usd": 712.14,
      "fact_uah": 19926.45,
      "rate": 27.98,
      "meters": null,
      "percent_increase": "",
      "raw_fact_uah": "",
      "raw_fact_usd": null,
      "status": "paid",
      "flags": {
        "early": false,
        "initial": false,
        "holiday": false
      },
      "base_paid_usd": 712.14,
      "base_paid_uah": 19926.45,
      "month_index": 3,
      "exclude_from_summary": false
    },
    {
      "id": 3,
      "title": "Кредит 02.2022",
      "due_label": "02.2022",
      "due_date": "2022-02-01",
      "payment_date": "2022-02-01",
      "period_year": 2022,
      "period_month": 2,
      "schedule_usd": 699.59,
      "fact_usd": 699.59,
      "fact_uah": 19877.9,
      "rate": 28.41,
      "meters": null,
      "percent_increase": "",
      "raw_fact_uah": "",
      "raw_fact_usd": null,
      "status": "paid",
      "flags": {
        "early": false,
        "initial": false,
        "holiday": false
      },
      "base_paid_usd": 699.59,
      "base_paid_uah": 19877.9,
      "month_index": 4,
      "exclude_from_summary": false
    },
    {
      "id": 4,
      "title": "Кредит 03.2022",
      "due_label": "03.2022",
      "due_date": "2022-03-01",
      "payment_date": "2022-03-01",
      "period_year": 2022,
      "period_month": 3,
      "schedule_usd": 0.0,
      "fact_usd": 0.0,
      "fact_uah": 0.0,
      "rate": 29.25,
      "meters": null,
      "percent_increase": "",
      "raw_fact_uah": "Відстрочка (0 грн)",
      "raw_fact_usd": null,
      "status": "paid",
      "flags": {
        "early": false,
        "initial": false,
        "holiday": true
      },
      "base_paid_usd": 0.0,
      "base_paid_uah": 0.0,
      "month_index": 5,
      "exclude_from_summary": false
    },
    {
      "id": 5,
      "title": "Кредит 04.2022",
      "due_label": "04.2022",
      "due_date": "2022-04-01",
      "payment_date": "2022-04-01",
      "period_year": 2022,
      "period_month": 4,
      "schedule_usd": 0.0,
      "fact_usd": 0.0,
      "fact_uah": 0.0,
      "rate": 29.25,
      "meters": null,
      "percent_increase": "",
      "raw_fact_uah": "Відстрочка (0 грн)",
      "raw_fact_usd": null,
      "status": "paid",
      "flags": {
        "early": false,
        "initial": false,
        "holiday": true
      },
      "base_paid_usd": 0.0,
      "base_paid_uah": 0.0,
      "month_index": 6,
      "exclude_from_summary": false
    },
    {
      "id": 6,
      "title": "Кредит 05.2022",
      "due_label": "05.2022",
      "due_date": "2022-05-01",
      "payment_date": "2022-05-01",
      "period_year": 2022,
      "period_month": 5,
      "schedule_usd": 0.0,
      "fact_usd": 0.0,
      "fact_uah": 0.0,
      "rate": 29.25,
      "meters": null,
      "percent_increase": "",
      "raw_fact_uah": "Відстрочка (0 грн)",
      "raw_fact_usd": null,
      "status": "paid",
      "flags": {
        "early": false,
        "initial": false,
        "holiday": true
      },
      "base_paid_usd": 0.0,
      "base_paid_uah": 0.0,
      "month_index": 7,
      "exclude_from_summary": false
    },
    {
      "id": 7,
      "title": "Кредит 06.2022",
      "due_label": "06.2022",
      "due_date": "2022-06-01",
      "payment_date": "2022-06-01",
      "period_year": 2022,
      "period_month": 6,
      "schedule_usd": 677.81,
      "fact_usd": 677.81,
      "fact_uah": 19829.35,
      "rate": 29.25,
      "meters": null,
      "percent_increase": "",
      "raw_fact_uah": "",
      "raw_fact_usd": null,
      "status": "paid",
      "flags": {
        "early": false,
        "initial": false,
        "holiday": false
      },
      "base_paid_usd": 677.81,
      "base_paid_uah": 19829.35,
      "month_index": 8,
      "exclude_from_summary": false
    },
    {
      "id": 8,
      "title": "Кредит 07.2022",
      "due_label": "07.2022",
      "due_date": "2022-07-01",
      "payment_date": "2022-07-01",
      "period_year": 2022,
      "period_month": 7,
      "schedule_usd": 621.06,
      "fact_usd": 621.06,
      "fact_uah": 19780.8,
      "rate": 31.85,
      "meters": null,
      "percent_increase": "",
      "raw_fact_uah": "",
      "raw_fact_usd": null,
      "status": "paid",
      "flags": {
        "early": false,
        "initial": false,
        "holiday": false
      },
      "base_paid_usd": 621.06,
      "base_paid_uah": 19780.8,
      "month_index": 9,
      "exclude_from_summary": false
    },
    {
      "id": 9,
      "title": "Кредит 08.2022",
      "due_label": "08.2022",
      "due_date": "2022-08-01",
      "payment_date": "2022-08-01",
      "period_year": 2022,
      "period_month": 8,
      "schedule_usd": 539.6,
      "fact_usd": 539.6,
      "fact_uah": 19732.25,
      "rate": 36.57,
      "meters": null,
      "percent_increase": "",
      "raw_fact_uah": "",
      "raw_fact_usd": null,
      "status": "paid",
      "flags": {
        "early": false,
        "initial": false,
        "holiday": false
      },
      "base_paid_usd": 539.6,
      "base_paid_uah": 19732.25,
      "month_index": 10,
      "exclude_from_summary": false
    },
    {
      "id": 10,
      "title": "Кредит 09.2022",
      "due_label": "09.2022",
      "due_date": "2022-09-01",
      "payment_date": "2022-09-01",
      "period_year": 2022,
      "period_month": 9,
      "schedule_usd": 538.27,
      "fact_usd": 538.27,
      "fact_uah": 19683.7,
      "rate": 36.57,
      "meters": null,
      "percent_increase": "",
      "raw_fact_uah": "",
      "raw_fact_usd": null,
      "status": "paid",
      "flags": {
        "early": false,
        "initial": false,
        "holiday": false
      },
      "base_paid_usd": 538.27,
      "base_paid_uah": 19683.7,
      "month_index": 11,
      "exclude_from_summary": false
    },
    {
      "id": 11,
      "title": "Кредит 10.2022",
      "due_label": "10.2022",
      "due_date": "2022-10-01",
      "payment_date": "2022-10-01",
      "period_year": 2022,
      "period_month": 10,
      "schedule_usd": 536.94,
      "fact_usd": 536.94,
      "fact_uah": 19635.15,
      "rate": 36.57,
      "meters": null,
      "percent_increase": "",
      "raw_fact_uah": "",
      "raw_fact_usd": null,
      "status": "paid",
      "flags": {
        "early": false,
        "initial": false,
        "holiday": false
      },
      "base_paid_usd": 536.94,
      "base_paid_uah": 19635.15,
      "month_index": 12,
      "exclude_from_summary": false
    },
    {
      "id": 12,
      "title": "Кредит 11.2022",
      "due_label": "11.2022",
      "due_date": "2022-11-01",
      "payment_date": "2022-11-01",
      "period_year": 2022,
      "period_month": 11,
      "schedule_usd": 535.61,
      "fact_usd": 535.61,
      "fact_uah": 19586.6,
      "rate": 36.57,
      "meters": null,
      "percent_increase": "",
      "raw_fact_uah": "",
      "raw_fact_usd": null,
      "status": "paid",
      "flags": {
        "early": false,
        "initial": false,
        "holiday": false
      },
      "base_paid_usd": 535.61,
      "base_paid_uah": 19586.6,
      "month_index": 13,
      "exclude_from_summary": false
    },
    {
      "id": 13,
      "title": "Кредит 12.2022",
      "due_label": "12.2022",
      "due_date": "2022-12-01",
      "payment_date": "2022-12-01",
      "period_year": 2022,
      "period_month": 12,
      "schedule_usd": 534.28,
      "fact_usd": 534.28,
      "fact_uah": 19538.05,
      "rate": 36.57,
      "meters": null,
      "percent_increase": "",
      "raw_fact_uah": "",
      "raw_fact_usd": null,
      "status": "paid",
      "flags": {
        "early": false,
        "initial": false,
        "holiday": false
      },
      "base_paid_usd": 534.28,
      "base_paid_uah": 19538.05,
      "month_index": 14,
      "exclude_from_summary": false
    },
    {
      "id": 14,
      "title": "Кредит 01.2023",
      "due_label": "01.2023",
      "due_date": "2023-01-01",
      "payment_date": "2023-01-01",
      "period_year": 2023,
      "period_month": 1,
      "schedule_usd": 532.96,
      "fact_usd": 532.96,
      "fact_uah": 19489.5,
      "rate": 36.57,
      "meters": null,
      "percent_increase": "",
      "raw_fact_uah": "",
      "raw_fact_usd": null,
      "status": "paid",
      "flags": {
        "early": false,
        "initial": false,
        "holiday": false
      },
      "base_paid_usd": 532.96,
      "base_paid_uah": 19489.5,
      "month_index": 15,
      "exclude_from_summary": false
    },
    {
      "id": 15,
      "title": "Кредит 02.2023",
      "due_label": "02.2023",
      "due_date": "2023-02-01",
      "payment_date": "2023-02-01",
      "period_year": 2023,
      "period_month": 2,
      "schedule_usd": 531.63,
      "fact_usd": 531.63,
      "fact_uah": 19440.95,
      "rate": 36.57,
      "meters": null,
      "percent_increase": "",
      "raw_fact_uah": "",
      "raw_fact_usd": null,
      "status": "paid",
      "flags": {
        "early": false,
        "initial": false,
        "holiday": false
      },
      "base_paid_usd": 531.63,
      "base_paid_uah": 19440.95,
      "month_index": 16,
      "exclude_from_summary": false
    },
    {
      "id": 16,
      "title": "Кредит 03.2023",
      "due_label": "03.2023",
      "due_date": "2023-03-01",
      "payment_date": "2023-03-01",
      "period_year": 2023,
      "period_month": 3,
      "schedule_usd": 530.3,
      "fact_usd": 530.3,
      "fact_uah": 19392.4,
      "rate": 36.57,
      "meters": null,
      "percent_increase": "",
      "raw_fact_uah": "",
      "raw_fact_usd": null,
      "status": "paid",
      "flags": {
        "early": false,
        "initial": false,
        "holiday": false
      },
      "base_paid_usd": 530.3,
      "base_paid_uah": 19392.4,
      "month_index": 17,
      "exclude_from_summary": false
    },
    {
      "id": 17,
      "title": "Кредит 04.2023",
      "due_label": "04.2023",
      "due_date": "2023-04-01",
      "payment_date": "2023-04-01",
      "period_year": 2023,
      "period_month": 4,
      "schedule_usd": 528.97,
      "fact_usd": 528.97,
      "fact_uah": 19343.85,
      "rate": 36.57,
      "meters": null,
      "percent_increase": "",
      "raw_fact_uah": "",
      "raw_fact_usd": null,
      "status": "paid",
      "flags": {
        "early": false,
        "initial": false,
        "holiday": false
      },
      "base_paid_usd": 528.97,
      "base_paid_uah": 19343.85,
      "month_index": 18,
      "exclude_from_summary": false
    },
    {
      "id": 18,
      "title": "Кредит 05.2023",
      "due_label": "05.2023",
      "due_date": "2023-05-01",
      "payment_date": "2023-05-01",
      "period_year": 2023,
      "period_month": 5,
      "schedule_usd": 527.65,
      "fact_usd": 527.65,
      "fact_uah": 19295.3,
      "rate": 36.57,
      "meters": null,
      "percent_increase": "",
      "raw_fact_uah": "",
      "raw_fact_usd": null,
      "status": "paid",
      "flags": {
        "early": false,
        "initial": false,
        "holiday": false
      },
      "base_paid_usd": 527.65,
      "base_paid_uah": 19295.3,
      "month_index": 19,
      "exclude_from_summary": false
    },
    {
      "id": 19,
      "title": "Кредит 06.2023",
      "due_label": "06.2023",
      "due_date": "2023-06-01",
      "payment_date": "2023-06-01",
      "period_year": 2023,
      "period_month": 6,
      "schedule_usd": 526.32,
      "fact_usd": 526.32,
      "fact_uah": 19246.74,
      "rate": 36.57,
      "meters": null,
      "percent_increase": "",
      "raw_fact_uah": "",
      "raw_fact_usd": null,
      "status": "paid",
      "flags": {
        "early": false,
        "initial": false,
        "holiday": false
      },
      "base_paid_usd": 526.32,
      "base_paid_uah": 19246.74,
      "month_index": 20,
      "exclude_from_summary": false
    },
    {
      "id": 20,
      "title": "Кредит 07.2023",
      "due_label": "07.2023",
      "due_date": "2023-07-01",
      "payment_date": "2023-07-01",
      "period_year": 2023,
      "period_month": 7,
      "schedule_usd": 524.99,
      "fact_usd": 524.99,
      "fact_uah": 19198.19,
      "rate": 36.57,
      "meters": null,
      "percent_increase": "",
      "raw_fact_uah": "",
      "raw_fact_usd": null,
      "status": "paid",
      "flags": {
        "early": false,
        "initial": false,
        "holiday": false
      },
      "base_paid_usd": 524.99,
      "base_paid_uah": 19198.19,
      "month_index": 21,
      "exclude_from_summary": false
    },
    {
      "id": 21,
      "title": "Кредит 08.2023",
      "due_label": "08.2023",
      "due_date": "2023-08-01",
      "payment_date": "2023-08-01",
      "period_year": 2023,
      "period_month": 8,
      "schedule_usd": 523.66,
      "fact_usd": 523.66,
      "fact_uah": 19149.64,
      "rate": 36.57,
      "meters": null,
      "percent_increase": "",
      "raw_fact_uah": "",
      "raw_fact_usd": null,
      "status": "paid",
      "flags": {
        "early": false,
        "initial": false,
        "holiday": false
      },
      "base_paid_usd": 523.66,
      "base_paid_uah": 19149.64,
      "month_index": 22,
      "exclude_from_summary": false
    },
    {
      "id": 22,
      "title": "Кредит 09.2023",
      "due_label": "09.2023",
      "due_date": "2023-09-01",
      "payment_date": "2023-09-01",
      "period_year": 2023,
      "period_month": 9,
      "schedule_usd": 522.34,
      "fact_usd": 522.34,
      "fact_uah": 19101.09,
      "rate": 36.57,
      "meters": null,
      "percent_increase": "",
      "raw_fact_uah": "",
      "raw_fact_usd": null,
      "status": "paid",
      "flags": {
        "early": false,
        "initial": false,
        "holiday": false
      },
      "base_paid_usd": 522.34,
      "base_paid_uah": 19101.09,
      "month_index": 23,
      "exclude_from_summary": false
    },
    {
      "id": 23,
      "title": "Кредит 10.2023",
      "due_label": "10.2023",
      "due_date": "2023-10-01",
      "payment_date": "2023-10-01",
      "period_year": 2023,
      "period_month": 10,
      "schedule_usd": 521.72,
      "fact_usd": 521.72,
      "fact_uah": 19052.54,
      "rate": 36.52,
      "meters": null,
      "percent_increase": "",
      "raw_fact_uah": "",
      "raw_fact_usd": null,
      "status": "paid",
      "flags": {
        "early": false,
        "initial": false,
        "holiday": false
      },
      "base_paid_usd": 521.72,
      "base_paid_uah": 19052.54,
      "month_index": 24,
      "exclude_from_summary": false
    },
    {
      "id": 24,
      "title": "Кредит 11.2023",
      "due_label": "11.2023",
      "due_date": "2023-11-01",
      "payment_date": "2023-11-01",
      "period_year": 2023,
      "period_month": 11,
      "schedule_usd": 525.62,
      "fact_usd": 525.62,
      "fact_uah": 19003.99,
      "rate": 36.16,
      "meters": null,
      "percent_increase": "",
      "raw_fact_uah": "",
      "raw_fact_usd": null,
      "status": "paid",
      "flags": {
        "early": false,
        "initial": false,
        "holiday": false
      },
      "base_paid_usd": 525.62,
      "base_paid_uah": 19003.99,
      "month_index": 25,
      "exclude_from_summary": false
    },
    {
      "id": 25,
      "title": "Кредит 12.2023",
      "due_label": "12.2023",
      "due_date": "2023-12-01",
      "payment_date": "2023-12-01",
      "period_year": 2023,
      "period_month": 12,
      "schedule_usd": 511.01,
      "fact_usd": 511.01,
      "fact_uah": 18955.44,
      "rate": 37.09,
      "meters": null,
      "percent_increase": "",
      "raw_fact_uah": "",
      "raw_fact_usd": null,
      "status": "paid",
      "flags": {
        "early": false,
        "initial": false,
        "holiday": false
      },
      "base_paid_usd": 511.01,
      "base_paid_uah": 18955.44,
      "month_index": 26,
      "exclude_from_summary": false
    },
    {
      "id": 26,
      "title": "Кредит 01.2024",
      "due_label": "01.2024",
      "due_date": "2024-01-01",
      "payment_date": "2024-01-01",
      "period_year": 2024,
      "period_month": 1,
      "schedule_usd": 499.28,
      "fact_usd": 499.28,
      "fact_uah": 18906.89,
      "rate": 37.87,
      "meters": null,
      "percent_increase": "",
      "raw_fact_uah": "",
      "raw_fact_usd": null,
      "status": "paid",
      "flags": {
        "early": false,
        "initial": false,
        "holiday": false
      },
      "base_paid_usd": 499.28,
      "base_paid_uah": 18906.89,
      "month_index": 27,
      "exclude_from_summary": false
    },
    {
      "id": 27,
      "title": "Кредит 02.2024",
      "due_label": "02.2024",
      "due_date": "2024-02-01",
      "payment_date": "2024-02-01",
      "period_year": 2024,
      "period_month": 2,
      "schedule_usd": 496.63,
      "fact_usd": 496.63,
      "fact_uah": 18858.34,
      "rate": 37.97,
      "meters": null,
      "percent_increase": "",
      "raw_fact_uah": "",
      "raw_fact_usd": null,
      "status": "paid",
      "flags": {
        "early": false,
        "initial": false,
        "holiday": false
      },
      "base_paid_usd": 496.63,
      "base_paid_uah": 18858.34,
      "month_index": 28,
      "exclude_from_summary": false
    },
    {
      "id": 28,
      "title": "Кредит 03.2024",
      "due_label": "03.2024",
      "due_date": "2024-03-01",
      "payment_date": "2024-03-01",
      "period_year": 2024,
      "period_month": 3,
      "schedule_usd": 486.5,
      "fact_usd": 486.5,
      "fact_uah": 18809.79,
      "rate": 38.66,
      "meters": null,
      "percent_increase": "",
      "raw_fact_uah": "",
      "raw_fact_usd": null,
      "status": "paid",
      "flags": {
        "early": false,
        "initial": false,
        "holiday": false
      },
      "base_paid_usd": 486.5,
      "base_paid_uah": 18809.79,
      "month_index": 29,
      "exclude_from_summary": false
    },
    {
      "id": 29,
      "title": "Кредит 04.2024",
      "due_label": "04.2024",
      "due_date": "2024-04-01",
      "payment_date": "2024-04-01",
      "period_year": 2024,
      "period_month": 4,
      "schedule_usd": 476.65,
      "fact_usd": 476.65,
      "fact_uah": 18761.24,
      "rate": 39.36,
      "meters": null,
      "percent_increase": "",
      "raw_fact_uah": "",
      "raw_fact_usd": null,
      "status": "paid",
      "flags": {
        "early": false,
        "initial": false,
        "holiday": false
      },
      "base_paid_usd": 476.65,
      "base_paid_uah": 18761.24,
      "month_index": 30,
      "exclude_from_summary": false
    },
    {
      "title": "Доходи",
      "due_label": "01.04.2024",
      "due_date": "2024-04-01",
      "payment_date": "2024-04-01",
      "period_year": 2024,
      "period_month": 4,
      "schedule_usd": 482.72,
      "fact_usd": 482.72,
      "fact_uah": 19000.0,
      "rate": 39.36,
      "meters": null,
      "percent_increase": null,
      "raw_fact_uah": null,
      "raw_fact_usd": null,
      "status": "paid",
      "flags": {
        "early": false,
        "initial": false,
        "source": "manual-category"
      },
      "base_paid_usd": 482.72,
      "base_paid_uah": 19000.0,
      "exclude_from_summary": false,
      "category_key": "income",
      "category_name": "Доходи",
      "id": "extra-income-nivki-2024-04"
    },
    {
      "title": "Ремонт (додаткові витрати)",
      "due_label": "01.04.2024",
      "due_date": "2024-04-01",
      "payment_date": "2024-04-01",
      "period_year": 2024,
      "period_month": 4,
      "schedule_usd": 5000.0,
      "fact_usd": 5000.0,
      "fact_uah": 196800.0,
      "rate": 39.36,
      "meters": null,
      "percent_increase": null,
      "raw_fact_uah": null,
      "raw_fact_usd": null,
      "status": "paid",
      "flags": {
        "early": false,
        "initial": false,
        "source": "manual-category"
      },
      "base_paid_usd": 5000.0,
      "base_paid_uah": 196800.0,
      "exclude_from_summary": false,
      "category_key": "repair",
      "category_name": "Ремонт",
      "id": "extra-repair-nivki-2024-04"
    },
    {
      "title": "Податки і нотаріус",
      "due_label": "01.04.2024",
      "due_date": "2024-04-01",
      "payment_date": "2024-04-01",
      "period_year": 2024,
      "period_month": 4,
      "schedule_usd": 203.25,
      "fact_usd": 203.25,
      "fact_uah": 8000.0,
      "rate": 39.36,
      "meters": null,
      "percent_increase": null,
      "raw_fact_uah": null,
      "raw_fact_usd": null,
      "status": "paid",
      "flags": {
        "early": false,
        "initial": false,
        "source": "manual-category"
      },
      "base_paid_usd": 203.25,
      "base_paid_uah": 8000.0,
      "exclude_from_summary": false,
      "category_key": "tax_notary",
      "category_name": "Податки і нотаріус",
      "id": "extra-tax-nivki-2024-04"
    },
    {
      "id": 30,
      "title": "Кредит 05.2024",
      "due_label": "05.2024",
      "due_date": "2024-05-01",
      "payment_date": "2024-05-01",
      "period_year": 2024,
      "period_month": 5,
      "schedule_usd": 471.23,
      "fact_usd": 471.23,
      "fact_uah": 18712.69,
      "rate": 39.71,
      "meters": null,
      "percent_increase": "",
      "raw_fact_uah": "",
      "raw_fact_usd": null,
      "status": "paid",
      "flags": {
        "early": false,
        "initial": false,
        "holiday": false
      },
      "base_paid_usd": 471.23,
      "base_paid_uah": 18712.69,
      "month_index": 31,
      "exclude_from_summary": false
    },
    {
      "title": "Доходи",
      "due_label": "01.05.2024",
      "due_date": "2024-05-01",
      "payment_date": "2024-05-01",
      "period_year": 2024,
      "period_month": 5,
      "schedule_usd": 478.47,
      "fact_usd": 478.47,
      "fact_uah": 19000.0,
      "rate": 39.71,
      "meters": null,
      "percent_increase": null,
      "raw_fact_uah": null,
      "raw_fact_usd": null,
      "status": "paid",
      "flags": {
        "early": false,
        "initial": false,
        "source": "manual-category"
      },
      "base_paid_usd": 478.47,
      "base_paid_uah": 19000.0,
      "exclude_from_summary": false,
      "category_key": "income",
      "category_name": "Доходи",
      "id": "extra-income-nivki-2024-05"
    },
    {
      "title": "Податки і нотаріус",
      "due_label": "01.05.2024",
      "due_date": "2024-05-01",
      "payment_date": "2024-05-01",
      "period_year": 2024,
      "period_month": 5,
      "schedule_usd": 201.46,
      "fact_usd": 201.46,
      "fact_uah": 8000.0,
      "rate": 39.71,
      "meters": null,
      "percent_increase": null,
      "raw_fact_uah": null,
      "raw_fact_usd": null,
      "status": "paid",
      "flags": {
        "early": false,
        "initial": false,
        "source": "manual-category"
      },
      "base_paid_usd": 201.46,
      "base_paid_uah": 8000.0,
      "exclude_from_summary": false,
      "category_key": "tax_notary",
      "category_name": "Податки і нотаріус",
      "id": "extra-tax-nivki-2024-05"
    },
    {
      "id": 31,
      "title": "Кредит 06.2024",
      "due_label": "06.2024",
      "due_date": "2024-06-01",
      "payment_date": "2024-06-01",
      "period_year": 2024,
      "period_month": 6,
      "schedule_usd": 461.1,
      "fact_usd": 461.1,
      "fact_uah": 18664.14,
      "rate": 40.48,
      "meters": null,
      "percent_increase": "",
      "raw_fact_uah": "",
      "raw_fact_usd": null,
      "status": "paid",
      "flags": {
        "early": false,
        "initial": false,
        "holiday": false
      },
      "base_paid_usd": 461.1,
      "base_paid_uah": 18664.14,
      "month_index": 32,
      "exclude_from_summary": false
    },
    {
      "title": "Доходи",
      "due_label": "01.06.2024",
      "due_date": "2024-06-01",
      "payment_date": "2024-06-01",
      "period_year": 2024,
      "period_month": 6,
      "schedule_usd": 469.37,
      "fact_usd": 469.37,
      "fact_uah": 19000.0,
      "rate": 40.48,
      "meters": null,
      "percent_increase": null,
      "raw_fact_uah": null,
      "raw_fact_usd": null,
      "status": "paid",
      "flags": {
        "early": false,
        "initial": false,
        "source": "manual-category"
      },
      "base_paid_usd": 469.37,
      "base_paid_uah": 19000.0,
      "exclude_from_summary": false,
      "category_key": "income",
      "category_name": "Доходи",
      "id": "extra-income-nivki-2024-06"
    },
    {
      "title": "Податки і нотаріус",
      "due_label": "01.06.2024",
      "due_date": "2024-06-01",
      "payment_date": "2024-06-01",
      "period_year": 2024,
      "period_month": 6,
      "schedule_usd": 197.63,
      "fact_usd": 197.63,
      "fact_uah": 8000.0,
      "rate": 40.48,
      "meters": null,
      "percent_increase": null,
      "raw_fact_uah": null,
      "raw_fact_usd": null,
      "status": "paid",
      "flags": {
        "early": false,
        "initial": false,
        "source": "manual-category"
      },
      "base_paid_usd": 197.63,
      "base_paid_uah": 8000.0,
      "exclude_from_summary": false,
      "category_key": "tax_notary",
      "category_name": "Податки і нотаріус",
      "id": "extra-tax-nivki-2024-06"
    },
    {
      "id": 32,
      "title": "Кредит 07.2024",
      "due_label": "07.2024",
      "due_date": "2024-07-01",
      "payment_date": "2024-07-01",
      "period_year": 2024,
      "period_month": 7,
      "schedule_usd": 454.15,
      "fact_usd": 454.15,
      "fact_uah": 18615.59,
      "rate": 40.99,
      "meters": null,
      "percent_increase": "",
      "raw_fact_uah": "",
      "raw_fact_usd": null,
      "status": "paid",
      "flags": {
        "early": false,
        "initial": false,
        "holiday": false
      },
      "base_paid_usd": 454.15,
      "base_paid_uah": 18615.59,
      "month_index": 33,
      "exclude_from_summary": false
    },
    {
      "title": "Доходи",
      "due_label": "01.07.2024",
      "due_date": "2024-07-01",
      "payment_date": "2024-07-01",
      "period_year": 2024,
      "period_month": 7,
      "schedule_usd": 463.53,
      "fact_usd": 463.53,
      "fact_uah": 19000.0,
      "rate": 40.99,
      "meters": null,
      "percent_increase": null,
      "raw_fact_uah": null,
      "raw_fact_usd": null,
      "status": "paid",
      "flags": {
        "early": false,
        "initial": false,
        "source": "manual-category"
      },
      "base_paid_usd": 463.53,
      "base_paid_uah": 19000.0,
      "exclude_from_summary": false,
      "category_key": "income",
      "category_name": "Доходи",
      "id": "extra-income-nivki-2024-07"
    },
    {
      "title": "Податки і нотаріус",
      "due_label": "01.07.2024",
      "due_date": "2024-07-01",
      "payment_date": "2024-07-01",
      "period_year": 2024,
      "period_month": 7,
      "schedule_usd": 195.17,
      "fact_usd": 195.17,
      "fact_uah": 8000.0,
      "rate": 40.99,
      "meters": null,
      "percent_increase": null,
      "raw_fact_uah": null,
      "raw_fact_usd": null,
      "status": "paid",
      "flags": {
        "early": false,
        "initial": false,
        "source": "manual-category"
      },
      "base_paid_usd": 195.17,
      "base_paid_uah": 8000.0,
      "exclude_from_summary": false,
      "category_key": "tax_notary",
      "category_name": "Податки і нотаріус",
      "id": "extra-tax-nivki-2024-07"
    },
    {
      "id": 33,
      "title": "Кредит 08.2024",
      "due_label": "08.2024",
      "due_date": "2024-08-01",
      "payment_date": "2024-08-01",
      "period_year": 2024,
      "period_month": 8,
      "schedule_usd": 450.77,
      "fact_usd": 450.77,
      "fact_uah": 18567.04,
      "rate": 41.19,
      "meters": null,
      "percent_increase": "",
      "raw_fact_uah": "",
      "raw_fact_usd": null,
      "status": "paid",
      "flags": {
        "early": false,
        "initial": false,
        "holiday": false
      },
      "base_paid_usd": 450.77,
      "base_paid_uah": 18567.04,
      "month_index": 34,
      "exclude_from_summary": false
    },
    {
      "title": "Доходи",
      "due_label": "01.08.2024",
      "due_date": "2024-08-01",
      "payment_date": "2024-08-01",
      "period_year": 2024,
      "period_month": 8,
      "schedule_usd": 461.28,
      "fact_usd": 461.28,
      "fact_uah": 19000.0,
      "rate": 41.19,
      "meters": null,
      "percent_increase": null,
      "raw_fact_uah": null,
      "raw_fact_usd": null,
      "status": "paid",
      "flags": {
        "early": false,
        "initial": false,
        "source": "manual-category"
      },
      "base_paid_usd": 461.28,
      "base_paid_uah": 19000.0,
      "exclude_from_summary": false,
      "category_key": "income",
      "category_name": "Доходи",
      "id": "extra-income-nivki-2024-08"
    },
    {
      "title": "Податки і нотаріус",
      "due_label": "01.08.2024",
      "due_date": "2024-08-01",
      "payment_date": "2024-08-01",
      "period_year": 2024,
      "period_month": 8,
      "schedule_usd": 194.22,
      "fact_usd": 194.22,
      "fact_uah": 8000.0,
      "rate": 41.19,
      "meters": null,
      "percent_increase": null,
      "raw_fact_uah": null,
      "raw_fact_usd": null,
      "status": "paid",
      "flags": {
        "early": false,
        "initial": false,
        "source": "manual-category"
      },
      "base_paid_usd": 194.22,
      "base_paid_uah": 8000.0,
      "exclude_from_summary": false,
      "category_key": "tax_notary",
      "category_name": "Податки і нотаріус",
      "id": "extra-tax-nivki-2024-08"
    },
    {
      "id": 34,
      "title": "Кредит 09.2024",
      "due_label": "09.2024",
      "due_date": "2024-09-01",
      "payment_date": "2024-09-01",
      "period_year": 2024,
      "period_month": 9,
      "schedule_usd": 448.96,
      "fact_usd": 448.96,
      "fact_uah": 18518.49,
      "rate": 41.25,
      "meters": null,
      "percent_increase": "",
      "raw_fact_uah": "",
      "raw_fact_usd": null,
      "status": "paid",
      "flags": {
        "early": false,
        "initial": false,
        "holiday": false
      },
      "base_paid_usd": 448.96,
      "base_paid_uah": 18518.49,
      "month_index": 35,
      "exclude_from_summary": false
    },
    {
      "title": "Доходи",
      "due_label": "01.09.2024",
      "due_date": "2024-09-01",
      "payment_date": "2024-09-01",
      "period_year": 2024,
      "period_month": 9,
      "schedule_usd": 460.61,
      "fact_usd": 460.61,
      "fact_uah": 19000.0,
      "rate": 41.25,
      "meters": null,
      "percent_increase": null,
      "raw_fact_uah": null,
      "raw_fact_usd": null,
      "status": "paid",
      "flags": {
        "early": false,
        "initial": false,
        "source": "manual-category"
      },
      "base_paid_usd": 460.61,
      "base_paid_uah": 19000.0,
      "exclude_from_summary": false,
      "category_key": "income",
      "category_name": "Доходи",
      "id": "extra-income-nivki-2024-09"
    },
    {
      "title": "Податки і нотаріус",
      "due_label": "01.09.2024",
      "due_date": "2024-09-01",
      "payment_date": "2024-09-01",
      "period_year": 2024,
      "period_month": 9,
      "schedule_usd": 193.94,
      "fact_usd": 193.94,
      "fact_uah": 8000.0,
      "rate": 41.25,
      "meters": null,
      "percent_increase": null,
      "raw_fact_uah": null,
      "raw_fact_usd": null,
      "status": "paid",
      "flags": {
        "early": false,
        "initial": false,
        "source": "manual-category"
      },
      "base_paid_usd": 193.94,
      "base_paid_uah": 8000.0,
      "exclude_from_summary": false,
      "category_key": "tax_notary",
      "category_name": "Податки і нотаріус",
      "id": "extra-tax-nivki-2024-09"
    },
    {
      "id": 35,
      "title": "Кредит 10.2024",
      "due_label": "10.2024",
      "due_date": "2024-10-01",
      "payment_date": "2024-10-01",
      "period_year": 2024,
      "period_month": 10,
      "schedule_usd": 447.84,
      "fact_usd": 447.84,
      "fact_uah": 18469.94,
      "rate": 41.24,
      "meters": null,
      "percent_increase": "",
      "raw_fact_uah": "",
      "raw_fact_usd": null,
      "status": "paid",
      "flags": {
        "early": false,
        "initial": false,
        "holiday": false
      },
      "base_paid_usd": 447.84,
      "base_paid_uah": 18469.94,
      "month_index": 36,
      "exclude_from_summary": false
    },
    {
      "title": "Доходи",
      "due_label": "01.10.2024",
      "due_date": "2024-10-01",
      "payment_date": "2024-10-01",
      "period_year": 2024,
      "period_month": 10,
      "schedule_usd": 460.72,
      "fact_usd": 460.72,
      "fact_uah": 19000.0,
      "rate": 41.24,
      "meters": null,
      "percent_increase": null,
      "raw_fact_uah": null,
      "raw_fact_usd": null,
      "status": "paid",
      "flags": {
        "early": false,
        "initial": false,
        "source": "manual-category"
      },
      "base_paid_usd": 460.72,
      "base_paid_uah": 19000.0,
      "exclude_from_summary": false,
      "category_key": "income",
      "category_name": "Доходи",
      "id": "extra-income-nivki-2024-10"
    },
    {
      "title": "Податки і нотаріус",
      "due_label": "01.10.2024",
      "due_date": "2024-10-01",
      "payment_date": "2024-10-01",
      "period_year": 2024,
      "period_month": 10,
      "schedule_usd": 193.99,
      "fact_usd": 193.99,
      "fact_uah": 8000.0,
      "rate": 41.24,
      "meters": null,
      "percent_increase": null,
      "raw_fact_uah": null,
      "raw_fact_usd": null,
      "status": "paid",
      "flags": {
        "early": false,
        "initial": false,
        "source": "manual-category"
      },
      "base_paid_usd": 193.99,
      "base_paid_uah": 8000.0,
      "exclude_from_summary": false,
      "category_key": "tax_notary",
      "category_name": "Податки і нотаріус",
      "id": "extra-tax-nivki-2024-10"
    },
    {
      "id": 36,
      "title": "Кредит 11.2024",
      "due_label": "11.2024",
      "due_date": "2024-11-01",
      "payment_date": "2024-11-01",
      "period_year": 2024,
      "period_month": 11,
      "schedule_usd": 445.5,
      "fact_usd": 445.5,
      "fact_uah": 18421.39,
      "rate": 41.35,
      "meters": null,
      "percent_increase": "",
      "raw_fact_uah": "",
      "raw_fact_usd": null,
      "status": "paid",
      "flags": {
        "early": false,
        "initial": false,
        "holiday": false
      },
      "base_paid_usd": 445.5,
      "base_paid_uah": 18421.39,
      "month_index": 37,
      "exclude_from_summary": false
    },
    {
      "title": "Доходи",
      "due_label": "01.11.2024",
      "due_date": "2024-11-01",
      "payment_date": "2024-11-01",
      "period_year": 2024,
      "period_month": 11,
      "schedule_usd": 459.49,
      "fact_usd": 459.49,
      "fact_uah": 19000.0,
      "rate": 41.35,
      "meters": null,
      "percent_increase": null,
      "raw_fact_uah": null,
      "raw_fact_usd": null,
      "status": "paid",
      "flags": {
        "early": false,
        "initial": false,
        "source": "manual-category"
      },
      "base_paid_usd": 459.49,
      "base_paid_uah": 19000.0,
      "exclude_from_summary": false,
      "category_key": "income",
      "category_name": "Доходи",
      "id": "extra-income-nivki-2024-11"
    },
    {
      "title": "Податки і нотаріус",
      "due_label": "01.11.2024",
      "due_date": "2024-11-01",
      "payment_date": "2024-11-01",
      "period_year": 2024,
      "period_month": 11,
      "schedule_usd": 193.47,
      "fact_usd": 193.47,
      "fact_uah": 8000.0,
      "rate": 41.35,
      "meters": null,
      "percent_increase": null,
      "raw_fact_uah": null,
      "raw_fact_usd": null,
      "status": "paid",
      "flags": {
        "early": false,
        "initial": false,
        "source": "manual-category"
      },
      "base_paid_usd": 193.47,
      "base_paid_uah": 8000.0,
      "exclude_from_summary": false,
      "category_key": "tax_notary",
      "category_name": "Податки і нотаріус",
      "id": "extra-tax-nivki-2024-11"
    },
    {
      "id": 37,
      "title": "Кредит 12.2024",
      "due_label": "12.2024",
      "due_date": "2024-12-01",
      "payment_date": "2024-12-01",
      "period_year": 2024,
      "period_month": 12,
      "schedule_usd": 440.05,
      "fact_usd": 440.05,
      "fact_uah": 18372.84,
      "rate": 41.75,
      "meters": null,
      "percent_increase": "",
      "raw_fact_uah": "",
      "raw_fact_usd": null,
      "status": "paid",
      "flags": {
        "early": false,
        "initial": false,
        "holiday": false
      },
      "base_paid_usd": 440.05,
      "base_paid_uah": 18372.84,
      "month_index": 38,
      "exclude_from_summary": false
    },
    {
      "title": "Доходи",
      "due_label": "01.12.2024",
      "due_date": "2024-12-01",
      "payment_date": "2024-12-01",
      "period_year": 2024,
      "period_month": 12,
      "schedule_usd": 455.09,
      "fact_usd": 455.09,
      "fact_uah": 19000.0,
      "rate": 41.75,
      "meters": null,
      "percent_increase": null,
      "raw_fact_uah": null,
      "raw_fact_usd": null,
      "status": "paid",
      "flags": {
        "early": false,
        "initial": false,
        "source": "manual-category"
      },
      "base_paid_usd": 455.09,
      "base_paid_uah": 19000.0,
      "exclude_from_summary": false,
      "category_key": "income",
      "category_name": "Доходи",
      "id": "extra-income-nivki-2024-12"
    },
    {
      "title": "Податки і нотаріус",
      "due_label": "01.12.2024",
      "due_date": "2024-12-01",
      "payment_date": "2024-12-01",
      "period_year": 2024,
      "period_month": 12,
      "schedule_usd": 191.62,
      "fact_usd": 191.62,
      "fact_uah": 8000.0,
      "rate": 41.75,
      "meters": null,
      "percent_increase": null,
      "raw_fact_uah": null,
      "raw_fact_usd": null,
      "status": "paid",
      "flags": {
        "early": false,
        "initial": false,
        "source": "manual-category"
      },
      "base_paid_usd": 191.62,
      "base_paid_uah": 8000.0,
      "exclude_from_summary": false,
      "category_key": "tax_notary",
      "category_name": "Податки і нотаріус",
      "id": "extra-tax-nivki-2024-12"
    },
    {
      "id": 38,
      "title": "Кредит 01.2025",
      "due_label": "01.2025",
      "due_date": "2025-01-01",
      "payment_date": "2025-01-01",
      "period_year": 2025,
      "period_month": 1,
      "schedule_usd": 435.16,
      "fact_usd": 435.16,
      "fact_uah": 18324.29,
      "rate": 42.11,
      "meters": null,
      "percent_increase": "",
      "raw_fact_uah": "",
      "raw_fact_usd": null,
      "status": "paid",
      "flags": {
        "early": false,
        "initial": false,
        "holiday": false
      },
      "base_paid_usd": 435.16,
      "base_paid_uah": 18324.29,
      "month_index": 39,
      "exclude_from_summary": false
    },
    {
      "title": "Доходи",
      "due_label": "01.01.2025",
      "due_date": "2025-01-01",
      "payment_date": "2025-01-01",
      "period_year": 2025,
      "period_month": 1,
      "schedule_usd": 451.2,
      "fact_usd": 451.2,
      "fact_uah": 19000.0,
      "rate": 42.11,
      "meters": null,
      "percent_increase": null,
      "raw_fact_uah": null,
      "raw_fact_usd": null,
      "status": "paid",
      "flags": {
        "early": false,
        "initial": false,
        "source": "manual-category"
      },
      "base_paid_usd": 451.2,
      "base_paid_uah": 19000.0,
      "exclude_from_summary": false,
      "category_key": "income",
      "category_name": "Доходи",
      "id": "extra-income-nivki-2025-01"
    },
    {
      "title": "Податки і нотаріус",
      "due_label": "01.01.2025",
      "due_date": "2025-01-01",
      "payment_date": "2025-01-01",
      "period_year": 2025,
      "period_month": 1,
      "schedule_usd": 189.98,
      "fact_usd": 189.98,
      "fact_uah": 8000.0,
      "rate": 42.11,
      "meters": null,
      "percent_increase": null,
      "raw_fact_uah": null,
      "raw_fact_usd": null,
      "status": "paid",
      "flags": {
        "early": false,
        "initial": false,
        "source": "manual-category"
      },
      "base_paid_usd": 189.98,
      "base_paid_uah": 8000.0,
      "exclude_from_summary": false,
      "category_key": "tax_notary",
      "category_name": "Податки і нотаріус",
      "id": "extra-tax-nivki-2025-01"
    },
    {
      "id": 39,
      "title": "Кредит 02.2025",
      "due_label": "02.2025",
      "due_date": "2025-02-01",
      "payment_date": "2025-02-01",
      "period_year": 2025,
      "period_month": 2,
      "schedule_usd": 438.57,
      "fact_usd": 438.57,
      "fact_uah": 18275.74,
      "rate": 41.67,
      "meters": null,
      "percent_increase": "",
      "raw_fact_uah": "",
      "raw_fact_usd": null,
      "status": "paid",
      "flags": {
        "early": false,
        "initial": false,
        "holiday": false
      },
      "base_paid_usd": 438.57,
      "base_paid_uah": 18275.74,
      "month_index": 40,
      "exclude_from_summary": false
    },
    {
      "title": "Доходи",
      "due_label": "01.02.2025",
      "due_date": "2025-02-01",
      "payment_date": "2025-02-01",
      "period_year": 2025,
      "period_month": 2,
      "schedule_usd": 455.96,
      "fact_usd": 455.96,
      "fact_uah": 19000.0,
      "rate": 41.67,
      "meters": null,
      "percent_increase": null,
      "raw_fact_uah": null,
      "raw_fact_usd": null,
      "status": "paid",
      "flags": {
        "early": false,
        "initial": false,
        "source": "manual-category"
      },
      "base_paid_usd": 455.96,
      "base_paid_uah": 19000.0,
      "exclude_from_summary": false,
      "category_key": "income",
      "category_name": "Доходи",
      "id": "extra-income-nivki-2025-02"
    },
    {
      "title": "Податки і нотаріус",
      "due_label": "01.02.2025",
      "due_date": "2025-02-01",
      "payment_date": "2025-02-01",
      "period_year": 2025,
      "period_month": 2,
      "schedule_usd": 191.98,
      "fact_usd": 191.98,
      "fact_uah": 8000.0,
      "rate": 41.67,
      "meters": null,
      "percent_increase": null,
      "raw_fact_uah": null,
      "raw_fact_usd": null,
      "status": "paid",
      "flags": {
        "early": false,
        "initial": false,
        "source": "manual-category"
      },
      "base_paid_usd": 191.98,
      "base_paid_uah": 8000.0,
      "exclude_from_summary": false,
      "category_key": "tax_notary",
      "category_name": "Податки і нотаріус",
      "id": "extra-tax-nivki-2025-02"
    },
    {
      "id": 40,
      "title": "Кредит 03.2025",
      "due_label": "03.2025",
      "due_date": "2025-03-01",
      "payment_date": "2025-03-01",
      "period_year": 2025,
      "period_month": 3,
      "schedule_usd": 439.41,
      "fact_usd": 439.41,
      "fact_uah": 18227.19,
      "rate": 41.48,
      "meters": null,
      "percent_increase": "",
      "raw_fact_uah": "",
      "raw_fact_usd": null,
      "status": "paid",
      "flags": {
        "early": false,
        "initial": false,
        "holiday": false
      },
      "base_paid_usd": 439.41,
      "base_paid_uah": 18227.19,
      "month_index": 41,
      "exclude_from_summary": false
    },
    {
      "title": "Доходи",
      "due_label": "01.03.2025",
      "due_date": "2025-03-01",
      "payment_date": "2025-03-01",
      "period_year": 2025,
      "period_month": 3,
      "schedule_usd": 458.05,
      "fact_usd": 458.05,
      "fact_uah": 19000.0,
      "rate": 41.48,
      "meters": null,
      "percent_increase": null,
      "raw_fact_uah": null,
      "raw_fact_usd": null,
      "status": "paid",
      "flags": {
        "early": false,
        "initial": false,
        "source": "manual-category"
      },
      "base_paid_usd": 458.05,
      "base_paid_uah": 19000.0,
      "exclude_from_summary": false,
      "category_key": "income",
      "category_name": "Доходи",
      "id": "extra-income-nivki-2025-03"
    },
    {
      "title": "Податки і нотаріус",
      "due_label": "01.03.2025",
      "due_date": "2025-03-01",
      "payment_date": "2025-03-01",
      "period_year": 2025,
      "period_month": 3,
      "schedule_usd": 192.86,
      "fact_usd": 192.86,
      "fact_uah": 8000.0,
      "rate": 41.48,
      "meters": null,
      "percent_increase": null,
      "raw_fact_uah": null,
      "raw_fact_usd": null,
      "status": "paid",
      "flags": {
        "early": false,
        "initial": false,
        "source": "manual-category"
      },
      "base_paid_usd": 192.86,
      "base_paid_uah": 8000.0,
      "exclude_from_summary": false,
      "category_key": "tax_notary",
      "category_name": "Податки і нотаріус",
      "id": "extra-tax-nivki-2025-03"
    },
    {
      "id": 41,
      "title": "Кредит 04.2025",
      "due_label": "04.2025",
      "due_date": "2025-04-01",
      "payment_date": "2025-04-01",
      "period_year": 2025,
      "period_month": 4,
      "schedule_usd": 438.95,
      "fact_usd": 438.95,
      "fact_uah": 18178.64,
      "rate": 41.41,
      "meters": null,
      "percent_increase": "",
      "raw_fact_uah": "",
      "raw_fact_usd": null,
      "status": "paid",
      "flags": {
        "early": false,
        "initial": false,
        "holiday": false
      },
      "base_paid_usd": 438.95,
      "base_paid_uah": 18178.64,
      "month_index": 42,
      "exclude_from_summary": false
    },
    {
      "title": "Доходи",
      "due_label": "01.04.2025",
      "due_date": "2025-04-01",
      "payment_date": "2025-04-01",
      "period_year": 2025,
      "period_month": 4,
      "schedule_usd": 458.83,
      "fact_usd": 458.83,
      "fact_uah": 19000.0,
      "rate": 41.41,
      "meters": null,
      "percent_increase": null,
      "raw_fact_uah": null,
      "raw_fact_usd": null,
      "status": "paid",
      "flags": {
        "early": false,
        "initial": false,
        "source": "manual-category"
      },
      "base_paid_usd": 458.83,
      "base_paid_uah": 19000.0,
      "exclude_from_summary": false,
      "category_key": "income",
      "category_name": "Доходи",
      "id": "extra-income-nivki-2025-04"
    },
    {
      "title": "Податки і нотаріус",
      "due_label": "01.04.2025",
      "due_date": "2025-04-01",
      "payment_date": "2025-04-01",
      "period_year": 2025,
      "period_month": 4,
      "schedule_usd": 193.19,
      "fact_usd": 193.19,
      "fact_uah": 8000.0,
      "rate": 41.41,
      "meters": null,
      "percent_increase": null,
      "raw_fact_uah": null,
      "raw_fact_usd": null,
      "status": "paid",
      "flags": {
        "early": false,
        "initial": false,
        "source": "manual-category"
      },
      "base_paid_usd": 193.19,
      "base_paid_uah": 8000.0,
      "exclude_from_summary": false,
      "category_key": "tax_notary",
      "category_name": "Податки і нотаріус",
      "id": "extra-tax-nivki-2025-04"
    },
    {
      "id": 42,
      "title": "Кредит 05.2025",
      "due_label": "05.2025",
      "due_date": "2025-05-01",
      "payment_date": "2025-05-01",
      "period_year": 2025,
      "period_month": 5,
      "schedule_usd": 436.55,
      "fact_usd": 436.55,
      "fact_uah": 18130.09,
      "rate": 41.53,
      "meters": null,
      "percent_increase": "",
      "raw_fact_uah": "",
      "raw_fact_usd": null,
      "status": "paid",
      "flags": {
        "early": false,
        "initial": false,
        "holiday": false
      },
      "base_paid_usd": 436.55,
      "base_paid_uah": 18130.09,
      "month_index": 43,
      "exclude_from_summary": false
    },
    {
      "title": "Доходи",
      "due_label": "01.05.2025",
      "due_date": "2025-05-01",
      "payment_date": "2025-05-01",
      "period_year": 2025,
      "period_month": 5,
      "schedule_usd": 457.5,
      "fact_usd": 457.5,
      "fact_uah": 19000.0,
      "rate": 41.53,
      "meters": null,
      "percent_increase": null,
      "raw_fact_uah": null,
      "raw_fact_usd": null,
      "status": "paid",
      "flags": {
        "early": false,
        "initial": false,
        "source": "manual-category"
      },
      "base_paid_usd": 457.5,
      "base_paid_uah": 19000.0,
      "exclude_from_summary": false,
      "category_key": "income",
      "category_name": "Доходи",
      "id": "extra-income-nivki-2025-05"
    },
    {
      "title": "Податки і нотаріус",
      "due_label": "01.05.2025",
      "due_date": "2025-05-01",
      "payment_date": "2025-05-01",
      "period_year": 2025,
      "period_month": 5,
      "schedule_usd": 192.63,
      "fact_usd": 192.63,
      "fact_uah": 8000.0,
      "rate": 41.53,
      "meters": null,
      "percent_increase": null,
      "raw_fact_uah": null,
      "raw_fact_usd": null,
      "status": "paid",
      "flags": {
        "early": false,
        "initial": false,
        "source": "manual-category"
      },
      "base_paid_usd": 192.63,
      "base_paid_uah": 8000.0,
      "exclude_from_summary": false,
      "category_key": "tax_notary",
      "category_name": "Податки і нотаріус",
      "id": "extra-tax-nivki-2025-05"
    },
    {
      "id": 43,
      "title": "Кредит 06.2025",
      "due_label": "06.2025",
      "due_date": "2025-06-01",
      "payment_date": "2025-06-01",
      "period_year": 2025,
      "period_month": 6,
      "schedule_usd": 434.87,
      "fact_usd": 434.87,
      "fact_uah": 18081.54,
      "rate": 41.58,
      "meters": null,
      "percent_increase": "",
      "raw_fact_uah": "",
      "raw_fact_usd": null,
      "status": "paid",
      "flags": {
        "early": false,
        "initial": false,
        "holiday": false
      },
      "base_paid_usd": 434.87,
      "base_paid_uah": 18081.54,
      "month_index": 44,
      "exclude_from_summary": false
    },
    {
      "title": "Доходи",
      "due_label": "01.06.2025",
      "due_date": "2025-06-01",
      "payment_date": "2025-06-01",
      "period_year": 2025,
      "period_month": 6,
      "schedule_usd": 456.95,
      "fact_usd": 456.95,
      "fact_uah": 19000.0,
      "rate": 41.58,
      "meters": null,
      "percent_increase": null,
      "raw_fact_uah": null,
      "raw_fact_usd": null,
      "status": "paid",
      "flags": {
        "early": false,
        "initial": false,
        "source": "manual-category"
      },
      "base_paid_usd": 456.95,
      "base_paid_uah": 19000.0,
      "exclude_from_summary": false,
      "category_key": "income",
      "category_name": "Доходи",
      "id": "extra-income-nivki-2025-06"
    },
    {
      "title": "Податки і нотаріус",
      "due_label": "01.06.2025",
      "due_date": "2025-06-01",
      "payment_date": "2025-06-01",
      "period_year": 2025,
      "period_month": 6,
      "schedule_usd": 192.4,
      "fact_usd": 192.4,
      "fact_uah": 8000.0,
      "rate": 41.58,
      "meters": null,
      "percent_increase": null,
      "raw_fact_uah": null,
      "raw_fact_usd": null,
      "status": "paid",
      "flags": {
        "early": false,
        "initial": false,
        "source": "manual-category"
      },
      "base_paid_usd": 192.4,
      "base_paid_uah": 8000.0,
      "exclude_from_summary": false,
      "category_key": "tax_notary",
      "category_name": "Податки і нотаріус",
      "id": "extra-tax-nivki-2025-06"
    },
    {
      "id": 44,
      "title": "Кредит 07.2025",
      "due_label": "07.2025",
      "due_date": "2025-07-01",
      "payment_date": "2025-07-01",
      "period_year": 2025,
      "period_month": 7,
      "schedule_usd": 431.47,
      "fact_usd": 431.47,
      "fact_uah": 18032.99,
      "rate": 41.79,
      "meters": null,
      "percent_increase": "",
      "raw_fact_uah": "",
      "raw_fact_usd": null,
      "status": "paid",
      "flags": {
        "early": false,
        "initial": false,
        "holiday": false
      },
      "base_paid_usd": 431.47,
      "base_paid_uah": 18032.99,
      "month_index": 45,
      "exclude_from_summary": false
    },
    {
      "title": "Доходи",
      "due_label": "01.07.2025",
      "due_date": "2025-07-01",
      "payment_date": "2025-07-01",
      "period_year": 2025,
      "period_month": 7,
      "schedule_usd": 454.65,
      "fact_usd": 454.65,
      "fact_uah": 19000.0,
      "rate": 41.79,
      "meters": null,
      "percent_increase": null,
      "raw_fact_uah": null,
      "raw_fact_usd": null,
      "status": "paid",
      "flags": {
        "early": false,
        "initial": false,
        "source": "manual-category"
      },
      "base_paid_usd": 454.65,
      "base_paid_uah": 19000.0,
      "exclude_from_summary": false,
      "category_key": "income",
      "category_name": "Доходи",
      "id": "extra-income-nivki-2025-07"
    },
    {
      "title": "Податки і нотаріус",
      "due_label": "01.07.2025",
      "due_date": "2025-07-01",
      "payment_date": "2025-07-01",
      "period_year": 2025,
      "period_month": 7,
      "schedule_usd": 191.43,
      "fact_usd": 191.43,
      "fact_uah": 8000.0,
      "rate": 41.79,
      "meters": null,
      "percent_increase": null,
      "raw_fact_uah": null,
      "raw_fact_usd": null,
      "status": "paid",
      "flags": {
        "early": false,
        "initial": false,
        "source": "manual-category"
      },
      "base_paid_usd": 191.43,
      "base_paid_uah": 8000.0,
      "exclude_from_summary": false,
      "category_key": "tax_notary",
      "category_name": "Податки і нотаріус",
      "id": "extra-tax-nivki-2025-07"
    },
    {
      "id": 45,
      "title": "Кредит 08.2025",
      "due_label": "08.2025",
      "due_date": "2025-08-01",
      "payment_date": "2025-08-01",
      "period_year": 2025,
      "period_month": 8,
      "schedule_usd": 433.97,
      "fact_usd": 433.97,
      "fact_uah": 17984.44,
      "rate": 41.44,
      "meters": null,
      "percent_increase": "",
      "raw_fact_uah": "",
      "raw_fact_usd": null,
      "status": "paid",
      "flags": {
        "early": false,
        "initial": false,
        "holiday": false
      },
      "base_paid_usd": 433.97,
      "base_paid_uah": 17984.44,
      "month_index": 46,
      "exclude_from_summary": false
    },
    {
      "title": "Доходи",
      "due_label": "01.08.2025",
      "due_date": "2025-08-01",
      "payment_date": "2025-08-01",
      "period_year": 2025,
      "period_month": 8,
      "schedule_usd": 458.49,
      "fact_usd": 458.49,
      "fact_uah": 19000.0,
      "rate": 41.44,
      "meters": null,
      "percent_increase": null,
      "raw_fact_uah": null,
      "raw_fact_usd": null,
      "status": "paid",
      "flags": {
        "early": false,
        "initial": false,
        "source": "manual-category"
      },
      "base_paid_usd": 458.49,
      "base_paid_uah": 19000.0,
      "exclude_from_summary": false,
      "category_key": "income",
      "category_name": "Доходи",
      "id": "extra-income-nivki-2025-08"
    },
    {
      "title": "Податки і нотаріус",
      "due_label": "01.08.2025",
      "due_date": "2025-08-01",
      "payment_date": "2025-08-01",
      "period_year": 2025,
      "period_month": 8,
      "schedule_usd": 193.05,
      "fact_usd": 193.05,
      "fact_uah": 8000.0,
      "rate": 41.44,
      "meters": null,
      "percent_increase": null,
      "raw_fact_uah": null,
      "raw_fact_usd": null,
      "status": "paid",
      "flags": {
        "early": false,
        "initial": false,
        "source": "manual-category"
      },
      "base_paid_usd": 193.05,
      "base_paid_uah": 8000.0,
      "exclude_from_summary": false,
      "category_key": "tax_notary",
      "category_name": "Податки і нотаріус",
      "id": "extra-tax-nivki-2025-08"
    },
    {
      "id": 46,
      "title": "Кредит 09.2025",
      "due_label": "09.2025",
      "due_date": "2025-09-01",
      "payment_date": "2025-09-01",
      "period_year": 2025,
      "period_month": 9,
      "schedule_usd": 434.09,
      "fact_usd": 434.09,
      "fact_uah": 17935.89,
      "rate": 41.32,
      "meters": null,
      "percent_increase": "",
      "raw_fact_uah": "",
      "raw_fact_usd": null,
      "status": "paid",
      "flags": {
        "early": false,
        "initial": false,
        "holiday": false
      },
      "base_paid_usd": 434.09,
      "base_paid_uah": 17935.89,
      "month_index": 47,
      "exclude_from_summary": false
    },
    {
      "title": "Доходи",
      "due_label": "01.09.2025",
      "due_date": "2025-09-01",
      "payment_date": "2025-09-01",
      "period_year": 2025,
      "period_month": 9,
      "schedule_usd": 459.83,
      "fact_usd": 459.83,
      "fact_uah": 19000.0,
      "rate": 41.32,
      "meters": null,
      "percent_increase": null,
      "raw_fact_uah": null,
      "raw_fact_usd": null,
      "status": "paid",
      "flags": {
        "early": false,
        "initial": false,
        "source": "manual-category"
      },
      "base_paid_usd": 459.83,
      "base_paid_uah": 19000.0,
      "exclude_from_summary": false,
      "category_key": "income",
      "category_name": "Доходи",
      "id": "extra-income-nivki-2025-09"
    },
    {
      "title": "Податки і нотаріус",
      "due_label": "01.09.2025",
      "due_date": "2025-09-01",
      "payment_date": "2025-09-01",
      "period_year": 2025,
      "period_month": 9,
      "schedule_usd": 193.61,
      "fact_usd": 193.61,
      "fact_uah": 8000.0,
      "rate": 41.32,
      "meters": null,
      "percent_increase": null,
      "raw_fact_uah": null,
      "raw_fact_usd": null,
      "status": "paid",
      "flags": {
        "early": false,
        "initial": false,
        "source": "manual-category"
      },
      "base_paid_usd": 193.61,
      "base_paid_uah": 8000.0,
      "exclude_from_summary": false,
      "category_key": "tax_notary",
      "category_name": "Податки і нотаріус",
      "id": "extra-tax-nivki-2025-09"
    },
    {
      "id": 47,
      "title": "Кредит 10.2025",
      "due_label": "10.2025",
      "due_date": "2025-10-01",
      "payment_date": "2025-10-01",
      "period_year": 2025,
      "period_month": 10,
      "schedule_usd": 429.7,
      "fact_usd": 429.7,
      "fact_uah": 17887.34,
      "rate": 41.63,
      "meters": null,
      "percent_increase": "",
      "raw_fact_uah": "",
      "raw_fact_usd": null,
      "status": "paid",
      "flags": {
        "early": false,
        "initial": false,
        "holiday": false
      },
      "base_paid_usd": 429.7,
      "base_paid_uah": 17887.34,
      "month_index": 48,
      "exclude_from_summary": false
    },
    {
      "title": "Доходи",
      "due_label": "01.10.2025",
      "due_date": "2025-10-01",
      "payment_date": "2025-10-01",
      "period_year": 2025,
      "period_month": 10,
      "schedule_usd": 456.4,
      "fact_usd": 456.4,
      "fact_uah": 19000.0,
      "rate": 41.63,
      "meters": null,
      "percent_increase": null,
      "raw_fact_uah": null,
      "raw_fact_usd": null,
      "status": "paid",
      "flags": {
        "early": false,
        "initial": false,
        "source": "manual-category"
      },
      "base_paid_usd": 456.4,
      "base_paid_uah": 19000.0,
      "exclude_from_summary": false,
      "category_key": "income",
      "category_name": "Доходи",
      "id": "extra-income-nivki-2025-10"
    },
    {
      "title": "Податки і нотаріус",
      "due_label": "01.10.2025",
      "due_date": "2025-10-01",
      "payment_date": "2025-10-01",
      "period_year": 2025,
      "period_month": 10,
      "schedule_usd": 192.17,
      "fact_usd": 192.17,
      "fact_uah": 8000.0,
      "rate": 41.63,
      "meters": null,
      "percent_increase": null,
      "raw_fact_uah": null,
      "raw_fact_usd": null,
      "status": "paid",
      "flags": {
        "early": false,
        "initial": false,
        "source": "manual-category"
      },
      "base_paid_usd": 192.17,
      "base_paid_uah": 8000.0,
      "exclude_from_summary": false,
      "category_key": "tax_notary",
      "category_name": "Податки і нотаріус",
      "id": "extra-tax-nivki-2025-10"
    },
    {
      "id": 48,
      "title": "Кредит 11.2025",
      "due_label": "11.2025",
      "due_date": "2025-11-01",
      "payment_date": "2025-11-01",
      "period_year": 2025,
      "period_month": 11,
      "schedule_usd": 423.68,
      "fact_usd": 423.68,
      "fact_uah": 17838.78,
      "rate": 42.1,
      "meters": null,
      "percent_increase": "",
      "raw_fact_uah": "",
      "raw_fact_usd": null,
      "status": "paid",
      "flags": {
        "early": false,
        "initial": false,
        "holiday": false
      },
      "base_paid_usd": 423.68,
      "base_paid_uah": 17838.78,
      "month_index": 49,
      "exclude_from_summary": false
    },
    {
      "title": "Доходи",
      "due_label": "01.11.2025",
      "due_date": "2025-11-01",
      "payment_date": "2025-11-01",
      "period_year": 2025,
      "period_month": 11,
      "schedule_usd": 451.31,
      "fact_usd": 451.31,
      "fact_uah": 19000.0,
      "rate": 42.1,
      "meters": null,
      "percent_increase": null,
      "raw_fact_uah": null,
      "raw_fact_usd": null,
      "status": "paid",
      "flags": {
        "early": false,
        "initial": false,
        "source": "manual-category"
      },
      "base_paid_usd": 451.31,
      "base_paid_uah": 19000.0,
      "exclude_from_summary": false,
      "category_key": "income",
      "category_name": "Доходи",
      "id": "extra-income-nivki-2025-11"
    },
    {
      "title": "Податки і нотаріус",
      "due_label": "01.11.2025",
      "due_date": "2025-11-01",
      "payment_date": "2025-11-01",
      "period_year": 2025,
      "period_month": 11,
      "schedule_usd": 190.02,
      "fact_usd": 190.02,
      "fact_uah": 8000.0,
      "rate": 42.1,
      "meters": null,
      "percent_increase": null,
      "raw_fact_uah": null,
      "raw_fact_usd": null,
      "status": "paid",
      "flags": {
        "early": false,
        "initial": false,
        "source": "manual-category"
      },
      "base_paid_usd": 190.02,
      "base_paid_uah": 8000.0,
      "exclude_from_summary": false,
      "category_key": "tax_notary",
      "category_name": "Податки і нотаріус",
      "id": "extra-tax-nivki-2025-11"
    },
    {
      "id": 49,
      "title": "Кредит 12.2025",
      "due_label": "12.2025",
      "due_date": "2025-12-01",
      "payment_date": "2025-12-01",
      "period_year": 2025,
      "period_month": 12,
      "schedule_usd": 421.57,
      "fact_usd": 421.57,
      "fact_uah": 17790.23,
      "rate": 42.2,
      "meters": null,
      "percent_increase": "",
      "raw_fact_uah": "",
      "raw_fact_usd": null,
      "status": "paid",
      "flags": {
        "early": false,
        "initial": false,
        "holiday": false
      },
      "base_paid_usd": 421.57,
      "base_paid_uah": 17790.23,
      "month_index": 50,
      "exclude_from_summary": false
    },
    {
      "title": "Доходи",
      "due_label": "01.12.2025",
      "due_date": "2025-12-01",
      "payment_date": "2025-12-01",
      "period_year": 2025,
      "period_month": 12,
      "schedule_usd": 450.24,
      "fact_usd": 450.24,
      "fact_uah": 19000.0,
      "rate": 42.2,
      "meters": null,
      "percent_increase": null,
      "raw_fact_uah": null,
      "raw_fact_usd": null,
      "status": "paid",
      "flags": {
        "early": false,
        "initial": false,
        "source": "manual-category"
      },
      "base_paid_usd": 450.24,
      "base_paid_uah": 19000.0,
      "exclude_from_summary": false,
      "category_key": "income",
      "category_name": "Доходи",
      "id": "extra-income-nivki-2025-12"
    },
    {
      "title": "Податки і нотаріус",
      "due_label": "01.12.2025",
      "due_date": "2025-12-01",
      "payment_date": "2025-12-01",
      "period_year": 2025,
      "period_month": 12,
      "schedule_usd": 189.57,
      "fact_usd": 189.57,
      "fact_uah": 8000.0,
      "rate": 42.2,
      "meters": null,
      "percent_increase": null,
      "raw_fact_uah": null,
      "raw_fact_usd": null,
      "status": "paid",
      "flags": {
        "early": false,
        "initial": false,
        "source": "manual-category"
      },
      "base_paid_usd": 189.57,
      "base_paid_uah": 8000.0,
      "exclude_from_summary": false,
      "category_key": "tax_notary",
      "category_name": "Податки і нотаріус",
      "id": "extra-tax-nivki-2025-12"
    },
    {
      "id": 50,
      "title": "Кредит 01.2026",
      "due_label": "01.2026",
      "due_date": "2026-01-01",
      "payment_date": "2026-01-01",
      "period_year": 2026,
      "period_month": 1,
      "schedule_usd": 413.24,
      "fact_usd": 413.24,
      "fact_uah": 17741.68,
      "rate": 42.93,
      "meters": null,
      "percent_increase": "",
      "raw_fact_uah": "",
      "raw_fact_usd": null,
      "status": "paid",
      "flags": {
        "early": false,
        "initial": false,
        "holiday": false
      },
      "base_paid_usd": 413.24,
      "base_paid_uah": 17741.68,
      "month_index": 51,
      "exclude_from_summary": false
    },
    {
      "title": "Доходи",
      "due_label": "01.01.2026",
      "due_date": "2026-01-01",
      "payment_date": "2026-01-01",
      "period_year": 2026,
      "period_month": 1,
      "schedule_usd": 442.58,
      "fact_usd": 442.58,
      "fact_uah": 19000.0,
      "rate": 42.93,
      "meters": null,
      "percent_increase": null,
      "raw_fact_uah": null,
      "raw_fact_usd": null,
      "status": "paid",
      "flags": {
        "early": false,
        "initial": false,
        "source": "manual-category"
      },
      "base_paid_usd": 442.58,
      "base_paid_uah": 19000.0,
      "exclude_from_summary": false,
      "category_key": "income",
      "category_name": "Доходи",
      "id": "extra-income-nivki-2026-01"
    },
    {
      "title": "Податки і нотаріус",
      "due_label": "01.01.2026",
      "due_date": "2026-01-01",
      "payment_date": "2026-01-01",
      "period_year": 2026,
      "period_month": 1,
      "schedule_usd": 186.35,
      "fact_usd": 186.35,
      "fact_uah": 8000.0,
      "rate": 42.93,
      "meters": null,
      "percent_increase": null,
      "raw_fact_uah": null,
      "raw_fact_usd": null,
      "status": "paid",
      "flags": {
        "early": false,
        "initial": false,
        "source": "manual-category"
      },
      "base_paid_usd": 186.35,
      "base_paid_uah": 8000.0,
      "exclude_from_summary": false,
      "category_key": "tax_notary",
      "category_name": "Податки і нотаріус",
      "id": "extra-tax-nivki-2026-01"
    },
    {
      "id": 51,
      "title": "Кредит 02.2026",
      "due_label": "02.2026",
      "due_date": "2026-02-01",
      "payment_date": "2026-02-01",
      "period_year": 2026,
      "period_month": 2,
      "schedule_usd": 410.58,
      "fact_usd": 410.58,
      "fact_uah": 17693.13,
      "rate": 43.09,
      "meters": null,
      "percent_increase": "",
      "raw_fact_uah": "",
      "raw_fact_usd": null,
      "status": "paid",
      "flags": {
        "early": false,
        "initial": false,
        "holiday": false
      },
      "base_paid_usd": 410.58,
      "base_paid_uah": 17693.13,
      "month_index": 52,
      "exclude_from_summary": false
    },
    {
      "title": "Доходи",
      "due_label": "01.02.2026",
      "due_date": "2026-02-01",
      "payment_date": "2026-02-01",
      "period_year": 2026,
      "period_month": 2,
      "schedule_usd": 440.94,
      "fact_usd": 440.94,
      "fact_uah": 19000.0,
      "rate": 43.09,
      "meters": null,
      "percent_increase": null,
      "raw_fact_uah": null,
      "raw_fact_usd": null,
      "status": "paid",
      "flags": {
        "early": false,
        "initial": false,
        "source": "manual-category"
      },
      "base_paid_usd": 440.94,
      "base_paid_uah": 19000.0,
      "exclude_from_summary": false,
      "category_key": "income",
      "category_name": "Доходи",
      "id": "extra-income-nivki-2026-02"
    },
    {
      "title": "Податки і нотаріус",
      "due_label": "01.02.2026",
      "due_date": "2026-02-01",
      "payment_date": "2026-02-01",
      "period_year": 2026,
      "period_month": 2,
      "schedule_usd": 185.66,
      "fact_usd": 185.66,
      "fact_uah": 8000.0,
      "rate": 43.09,
      "meters": null,
      "percent_increase": null,
      "raw_fact_uah": null,
      "raw_fact_usd": null,
      "status": "paid",
      "flags": {
        "early": false,
        "initial": false,
        "source": "manual-category"
      },
      "base_paid_usd": 185.66,
      "base_paid_uah": 8000.0,
      "exclude_from_summary": false,
      "category_key": "tax_notary",
      "category_name": "Податки і нотаріус",
      "id": "extra-tax-nivki-2026-02"
    },
    {
      "id": 52,
      "title": "Кредит 03.2026",
      "due_label": "03.2026",
      "due_date": "2026-03-01",
      "payment_date": null,
      "period_year": 2026,
      "period_month": 3,
      "schedule_usd": 407.81,
      "fact_usd": null,
      "fact_uah": null,
      "rate": 43.27,
      "meters": null,
      "percent_increase": "",
      "raw_fact_uah": "",
      "raw_fact_usd": null,
      "status": "unpaid",
      "flags": {
        "early": false,
        "initial": false,
        "holiday": false
      },
      "base_paid_usd": 0.0,
      "base_paid_uah": 0.0,
      "month_index": 53,
      "exclude_from_summary": false
    },
    {
      "id": 53,
      "title": "Кредит 04.2026",
      "due_label": "04.2026",
      "due_date": "2026-04-01",
      "payment_date": null,
      "period_year": 2026,
      "period_month": 4,
      "schedule_usd": 406.69,
      "fact_usd": null,
      "fact_uah": null,
      "rate": 43.27,
      "meters": null,
      "percent_increase": "",
      "raw_fact_uah": "",
      "raw_fact_usd": null,
      "status": "unpaid",
      "flags": {
        "early": false,
        "initial": false,
        "holiday": false
      },
      "base_paid_usd": 0.0,
      "base_paid_uah": 0.0,
      "month_index": 54,
      "exclude_from_summary": false
    },
    {
      "id": 54,
      "title": "Кредит 05.2026",
      "due_label": "05.2026",
      "due_date": "2026-05-01",
      "payment_date": null,
      "period_year": 2026,
      "period_month": 5,
      "schedule_usd": 405.57,
      "fact_usd": null,
      "fact_uah": null,
      "rate": 43.27,
      "meters": null,
      "percent_increase": "",
      "raw_fact_uah": "",
      "raw_fact_usd": null,
      "status": "unpaid",
      "flags": {
        "early": false,
        "initial": false,
        "holiday": false
      },
      "base_paid_usd": 0.0,
      "base_paid_uah": 0.0,
      "month_index": 55,
      "exclude_from_summary": false
    },
    {
      "id": 55,
      "title": "Кредит 06.2026",
      "due_label": "06.2026",
      "due_date": "2026-06-01",
      "payment_date": null,
      "period_year": 2026,
      "period_month": 6,
      "schedule_usd": 404.44,
      "fact_usd": null,
      "fact_uah": null,
      "rate": 43.27,
      "meters": null,
      "percent_increase": "",
      "raw_fact_uah": "",
      "raw_fact_usd": null,
      "status": "unpaid",
      "flags": {
        "early": false,
        "initial": false,
        "holiday": false
      },
      "base_paid_usd": 0.0,
      "base_paid_uah": 0.0,
      "month_index": 56,
      "exclude_from_summary": false
    },
    {
      "id": 56,
      "title": "Кредит 07.2026",
      "due_label": "07.2026",
      "due_date": "2026-07-01",
      "payment_date": null,
      "period_year": 2026,
      "period_month": 7,
      "schedule_usd": 403.32,
      "fact_usd": null,
      "fact_uah": null,
      "rate": 43.27,
      "meters": null,
      "percent_increase": "",
      "raw_fact_uah": "",
      "raw_fact_usd": null,
      "status": "unpaid",
      "flags": {
        "early": false,
        "initial": false,
        "holiday": false
      },
      "base_paid_usd": 0.0,
      "base_paid_uah": 0.0,
      "month_index": 57,
      "exclude_from_summary": false
    },
    {
      "id": 57,
      "title": "Кредит 08.2026",
      "due_label": "08.2026",
      "due_date": "2026-08-01",
      "payment_date": null,
      "period_year": 2026,
      "period_month": 8,
      "schedule_usd": 402.2,
      "fact_usd": null,
      "fact_uah": null,
      "rate": 43.27,
      "meters": null,
      "percent_increase": "",
      "raw_fact_uah": "",
      "raw_fact_usd": null,
      "status": "unpaid",
      "flags": {
        "early": false,
        "initial": false,
        "holiday": false
      },
      "base_paid_usd": 0.0,
      "base_paid_uah": 0.0,
      "month_index": 58,
      "exclude_from_summary": false
    },
    {
      "id": 58,
      "title": "Кредит 09.2026",
      "due_label": "09.2026",
      "due_date": "2026-09-01",
      "payment_date": null,
      "period_year": 2026,
      "period_month": 9,
      "schedule_usd": 401.08,
      "fact_usd": null,
      "fact_uah": null,
      "rate": 43.27,
      "meters": null,
      "percent_increase": "",
      "raw_fact_uah": "",
      "raw_fact_usd": null,
      "status": "unpaid",
      "flags": {
        "early": false,
        "initial": false,
        "holiday": false
      },
      "base_paid_usd": 0.0,
      "base_paid_uah": 0.0,
      "month_index": 59,
      "exclude_from_summary": false
    },
    {
      "id": 59,
      "title": "Кредит 10.2026",
      "due_label": "10.2026",
      "due_date": "2026-10-01",
      "payment_date": null,
      "period_year": 2026,
      "period_month": 10,
      "schedule_usd": 399.95,
      "fact_usd": null,
      "fact_uah": null,
      "rate": 43.27,
      "meters": null,
      "percent_increase": "",
      "raw_fact_uah": "",
      "raw_fact_usd": null,
      "status": "unpaid",
      "flags": {
        "early": false,
        "initial": false,
        "holiday": false
      },
      "base_paid_usd": 0.0,
      "base_paid_uah": 0.0,
      "month_index": 60,
      "exclude_from_summary": false
    },
    {
      "id": 60,
      "title": "Кредит 11.2026",
      "due_label": "11.2026",
      "due_date": "2026-11-01",
      "payment_date": null,
      "period_year": 2026,
      "period_month": 11,
      "schedule_usd": 398.83,
      "fact_usd": null,
      "fact_uah": null,
      "rate": 43.27,
      "meters": null,
      "percent_increase": "",
      "raw_fact_uah": "",
      "raw_fact_usd": null,
      "status": "unpaid",
      "flags": {
        "early": false,
        "initial": false,
        "holiday": false
      },
      "base_paid_usd": 0.0,
      "base_paid_uah": 0.0,
      "month_index": 61,
      "exclude_from_summary": false
    },
    {
      "id": 61,
      "title": "Кредит 12.2026",
      "due_label": "12.2026",
      "due_date": "2026-12-01",
      "payment_date": null,
      "period_year": 2026,
      "period_month": 12,
      "schedule_usd": 397.71,
      "fact_usd": null,
      "fact_uah": null,
      "rate": 43.27,
      "meters": null,
      "percent_increase": "",
      "raw_fact_uah": "",
      "raw_fact_usd": null,
      "status": "unpaid",
      "flags": {
        "early": false,
        "initial": false,
        "holiday": false
      },
      "base_paid_usd": 0.0,
      "base_paid_uah": 0.0,
      "month_index": 62,
      "exclude_from_summary": false
    },
    {
      "id": 62,
      "title": "Кредит 01.2027",
      "due_label": "01.2027",
      "due_date": "2027-01-01",
      "payment_date": null,
      "period_year": 2027,
      "period_month": 1,
      "schedule_usd": 396.59,
      "fact_usd": null,
      "fact_uah": null,
      "rate": 43.27,
      "meters": null,
      "percent_increase": "",
      "raw_fact_uah": "",
      "raw_fact_usd": null,
      "status": "unpaid",
      "flags": {
        "early": false,
        "initial": false,
        "holiday": false
      },
      "base_paid_usd": 0.0,
      "base_paid_uah": 0.0,
      "month_index": 63,
      "exclude_from_summary": false
    },
    {
      "id": 63,
      "title": "Кредит 02.2027",
      "due_label": "02.2027",
      "due_date": "2027-02-01",
      "payment_date": null,
      "period_year": 2027,
      "period_month": 2,
      "schedule_usd": 395.47,
      "fact_usd": null,
      "fact_uah": null,
      "rate": 43.27,
      "meters": null,
      "percent_increase": "",
      "raw_fact_uah": "",
      "raw_fact_usd": null,
      "status": "unpaid",
      "flags": {
        "early": false,
        "initial": false,
        "holiday": false
      },
      "base_paid_usd": 0.0,
      "base_paid_uah": 0.0,
      "month_index": 64,
      "exclude_from_summary": false
    },
    {
      "id": 64,
      "title": "Кредит 03.2027",
      "due_label": "03.2027",
      "due_date": "2027-03-01",
      "payment_date": null,
      "period_year": 2027,
      "period_month": 3,
      "schedule_usd": 394.34,
      "fact_usd": null,
      "fact_uah": null,
      "rate": 43.27,
      "meters": null,
      "percent_increase": "",
      "raw_fact_uah": "",
      "raw_fact_usd": null,
      "status": "unpaid",
      "flags": {
        "early": false,
        "initial": false,
        "holiday": false
      },
      "base_paid_usd": 0.0,
      "base_paid_uah": 0.0,
      "month_index": 65,
      "exclude_from_summary": false
    },
    {
      "id": 65,
      "title": "Кредит 04.2027",
      "due_label": "04.2027",
      "due_date": "2027-04-01",
      "payment_date": null,
      "period_year": 2027,
      "period_month": 4,
      "schedule_usd": 393.22,
      "fact_usd": null,
      "fact_uah": null,
      "rate": 43.27,
      "meters": null,
      "percent_increase": "",
      "raw_fact_uah": "",
      "raw_fact_usd": null,
      "status": "unpaid",
      "flags": {
        "early": false,
        "initial": false,
        "holiday": false
      },
      "base_paid_usd": 0.0,
      "base_paid_uah": 0.0,
      "month_index": 66,
      "exclude_from_summary": false
    },
    {
      "id": 66,
      "title": "Кредит 05.2027",
      "due_label": "05.2027",
      "due_date": "2027-05-01",
      "payment_date": null,
      "period_year": 2027,
      "period_month": 5,
      "schedule_usd": 392.1,
      "fact_usd": null,
      "fact_uah": null,
      "rate": 43.27,
      "meters": null,
      "percent_increase": "",
      "raw_fact_uah": "",
      "raw_fact_usd": null,
      "status": "unpaid",
      "flags": {
        "early": false,
        "initial": false,
        "holiday": false
      },
      "base_paid_usd": 0.0,
      "base_paid_uah": 0.0,
      "month_index": 67,
      "exclude_from_summary": false
    },
    {
      "id": 67,
      "title": "Кредит 06.2027",
      "due_label": "06.2027",
      "due_date": "2027-06-01",
      "payment_date": null,
      "period_year": 2027,
      "period_month": 6,
      "schedule_usd": 390.98,
      "fact_usd": null,
      "fact_uah": null,
      "rate": 43.27,
      "meters": null,
      "percent_increase": "",
      "raw_fact_uah": "",
      "raw_fact_usd": null,
      "status": "unpaid",
      "flags": {
        "early": false,
        "initial": false,
        "holiday": false
      },
      "base_paid_usd": 0.0,
      "base_paid_uah": 0.0,
      "month_index": 68,
      "exclude_from_summary": false
    },
    {
      "id": 68,
      "title": "Кредит 07.2027",
      "due_label": "07.2027",
      "due_date": "2027-07-01",
      "payment_date": null,
      "period_year": 2027,
      "period_month": 7,
      "schedule_usd": 389.86,
      "fact_usd": null,
      "fact_uah": null,
      "rate": 43.27,
      "meters": null,
      "percent_increase": "",
      "raw_fact_uah": "",
      "raw_fact_usd": null,
      "status": "unpaid",
      "flags": {
        "early": false,
        "initial": false,
        "holiday": false
      },
      "base_paid_usd": 0.0,
      "base_paid_uah": 0.0,
      "month_index": 69,
      "exclude_from_summary": false
    },
    {
      "id": 69,
      "title": "Кредит 08.2027",
      "due_label": "08.2027",
      "due_date": "2027-08-01",
      "payment_date": null,
      "period_year": 2027,
      "period_month": 8,
      "schedule_usd": 388.73,
      "fact_usd": null,
      "fact_uah": null,
      "rate": 43.27,
      "meters": null,
      "percent_increase": "",
      "raw_fact_uah": "",
      "raw_fact_usd": null,
      "status": "unpaid",
      "flags": {
        "early": false,
        "initial": false,
        "holiday": false
      },
      "base_paid_usd": 0.0,
      "base_paid_uah": 0.0,
      "month_index": 70,
      "exclude_from_summary": false
    },
    {
      "id": 70,
      "title": "Кредит 09.2027",
      "due_label": "09.2027",
      "due_date": "2027-09-01",
      "payment_date": null,
      "period_year": 2027,
      "period_month": 9,
      "schedule_usd": 387.61,
      "fact_usd": null,
      "fact_uah": null,
      "rate": 43.27,
      "meters": null,
      "percent_increase": "",
      "raw_fact_uah": "",
      "raw_fact_usd": null,
      "status": "unpaid",
      "flags": {
        "early": false,
        "initial": false,
        "holiday": false
      },
      "base_paid_usd": 0.0,
      "base_paid_uah": 0.0,
      "month_index": 71,
      "exclude_from_summary": false
    },
    {
      "id": 71,
      "title": "Кредит 10.2027",
      "due_label": "10.2027",
      "due_date": "2027-10-01",
      "payment_date": null,
      "period_year": 2027,
      "period_month": 10,
      "schedule_usd": 386.49,
      "fact_usd": null,
      "fact_uah": null,
      "rate": 43.27,
      "meters": null,
      "percent_increase": "",
      "raw_fact_uah": "",
      "raw_fact_usd": null,
      "status": "unpaid",
      "flags": {
        "early": false,
        "initial": false,
        "holiday": false
      },
      "base_paid_usd": 0.0,
      "base_paid_uah": 0.0,
      "month_index": 72,
      "exclude_from_summary": false
    },
    {
      "id": 72,
      "title": "Кредит 11.2027",
      "due_label": "11.2027",
      "due_date": "2027-11-01",
      "payment_date": null,
      "period_year": 2027,
      "period_month": 11,
      "schedule_usd": 385.37,
      "fact_usd": null,
      "fact_uah": null,
      "rate": 43.27,
      "meters": null,
      "percent_increase": "",
      "raw_fact_uah": "",
      "raw_fact_usd": null,
      "status": "unpaid",
      "flags": {
        "early": false,
        "initial": false,
        "holiday": false
      },
      "base_paid_usd": 0.0,
      "base_paid_uah": 0.0,
      "month_index": 73,
      "exclude_from_summary": false
    },
    {
      "id": 73,
      "title": "Кредит 12.2027",
      "due_label": "12.2027",
      "due_date": "2027-12-01",
      "payment_date": null,
      "period_year": 2027,
      "period_month": 12,
      "schedule_usd": 384.25,
      "fact_usd": null,
      "fact_uah": null,
      "rate": 43.27,
      "meters": null,
      "percent_increase": "",
      "raw_fact_uah": "",
      "raw_fact_usd": null,
      "status": "unpaid",
      "flags": {
        "early": false,
        "initial": false,
        "holiday": false
      },
      "base_paid_usd": 0.0,
      "base_paid_uah": 0.0,
      "month_index": 74,
      "exclude_from_summary": false
    },
    {
      "id": 74,
      "title": "Кредит 01.2028",
      "due_label": "01.2028",
      "due_date": "2028-01-01",
      "payment_date": null,
      "period_year": 2028,
      "period_month": 1,
      "schedule_usd": 383.12,
      "fact_usd": null,
      "fact_uah": null,
      "rate": 43.27,
      "meters": null,
      "percent_increase": "",
      "raw_fact_uah": "",
      "raw_fact_usd": null,
      "status": "unpaid",
      "flags": {
        "early": false,
        "initial": false,
        "holiday": false
      },
      "base_paid_usd": 0.0,
      "base_paid_uah": 0.0,
      "month_index": 75,
      "exclude_from_summary": false
    },
    {
      "id": 75,
      "title": "Кредит 02.2028",
      "due_label": "02.2028",
      "due_date": "2028-02-01",
      "payment_date": null,
      "period_year": 2028,
      "period_month": 2,
      "schedule_usd": 382.0,
      "fact_usd": null,
      "fact_uah": null,
      "rate": 43.27,
      "meters": null,
      "percent_increase": "",
      "raw_fact_uah": "",
      "raw_fact_usd": null,
      "status": "unpaid",
      "flags": {
        "early": false,
        "initial": false,
        "holiday": false
      },
      "base_paid_usd": 0.0,
      "base_paid_uah": 0.0,
      "month_index": 76,
      "exclude_from_summary": false
    },
    {
      "id": 76,
      "title": "Кредит 03.2028",
      "due_label": "03.2028",
      "due_date": "2028-03-01",
      "payment_date": null,
      "period_year": 2028,
      "period_month": 3,
      "schedule_usd": 380.88,
      "fact_usd": null,
      "fact_uah": null,
      "rate": 43.27,
      "meters": null,
      "percent_increase": "",
      "raw_fact_uah": "",
      "raw_fact_usd": null,
      "status": "unpaid",
      "flags": {
        "early": false,
        "initial": false,
        "holiday": false
      },
      "base_paid_usd": 0.0,
      "base_paid_uah": 0.0,
      "month_index": 77,
      "exclude_from_summary": false
    },
    {
      "id": 77,
      "title": "Кредит 04.2028",
      "due_label": "04.2028",
      "due_date": "2028-04-01",
      "payment_date": null,
      "period_year": 2028,
      "period_month": 4,
      "schedule_usd": 379.76,
      "fact_usd": null,
      "fact_uah": null,
      "rate": 43.27,
      "meters": null,
      "percent_increase": "",
      "raw_fact_uah": "",
      "raw_fact_usd": null,
      "status": "unpaid",
      "flags": {
        "early": false,
        "initial": false,
        "holiday": false
      },
      "base_paid_usd": 0.0,
      "base_paid_uah": 0.0,
      "month_index": 78,
      "exclude_from_summary": false
    },
    {
      "id": 78,
      "title": "Кредит 05.2028",
      "due_label": "05.2028",
      "due_date": "2028-05-01",
      "payment_date": null,
      "period_year": 2028,
      "period_month": 5,
      "schedule_usd": 378.63,
      "fact_usd": null,
      "fact_uah": null,
      "rate": 43.27,
      "meters": null,
      "percent_increase": "",
      "raw_fact_uah": "",
      "raw_fact_usd": null,
      "status": "unpaid",
      "flags": {
        "early": false,
        "initial": false,
        "holiday": false
      },
      "base_paid_usd": 0.0,
      "base_paid_uah": 0.0,
      "month_index": 79,
      "exclude_from_summary": false
    },
    {
      "id": 79,
      "title": "Кредит 06.2028",
      "due_label": "06.2028",
      "due_date": "2028-06-01",
      "payment_date": null,
      "period_year": 2028,
      "period_month": 6,
      "schedule_usd": 377.51,
      "fact_usd": null,
      "fact_uah": null,
      "rate": 43.27,
      "meters": null,
      "percent_increase": "",
      "raw_fact_uah": "",
      "raw_fact_usd": null,
      "status": "unpaid",
      "flags": {
        "early": false,
        "initial": false,
        "holiday": false
      },
      "base_paid_usd": 0.0,
      "base_paid_uah": 0.0,
      "month_index": 80,
      "exclude_from_summary": false
    },
    {
      "id": 80,
      "title": "Кредит 07.2028",
      "due_label": "07.2028",
      "due_date": "2028-07-01",
      "payment_date": null,
      "period_year": 2028,
      "period_month": 7,
      "schedule_usd": 376.39,
      "fact_usd": null,
      "fact_uah": null,
      "rate": 43.27,
      "meters": null,
      "percent_increase": "",
      "raw_fact_uah": "",
      "raw_fact_usd": null,
      "status": "unpaid",
      "flags": {
        "early": false,
        "initial": false,
        "holiday": false
      },
      "base_paid_usd": 0.0,
      "base_paid_uah": 0.0,
      "month_index": 81,
      "exclude_from_summary": false
    },
    {
      "id": 81,
      "title": "Кредит 08.2028",
      "due_label": "08.2028",
      "due_date": "2028-08-01",
      "payment_date": null,
      "period_year": 2028,
      "period_month": 8,
      "schedule_usd": 375.27,
      "fact_usd": null,
      "fact_uah": null,
      "rate": 43.27,
      "meters": null,
      "percent_increase": "",
      "raw_fact_uah": "",
      "raw_fact_usd": null,
      "status": "unpaid",
      "flags": {
        "early": false,
        "initial": false,
        "holiday": false
      },
      "base_paid_usd": 0.0,
      "base_paid_uah": 0.0,
      "month_index": 82,
      "exclude_from_summary": false
    },
    {
      "id": 82,
      "title": "Кредит 09.2028",
      "due_label": "09.2028",
      "due_date": "2028-09-01",
      "payment_date": null,
      "period_year": 2028,
      "period_month": 9,
      "schedule_usd": 374.15,
      "fact_usd": null,
      "fact_uah": null,
      "rate": 43.27,
      "meters": null,
      "percent_increase": "",
      "raw_fact_uah": "",
      "raw_fact_usd": null,
      "status": "unpaid",
      "flags": {
        "early": false,
        "initial": false,
        "holiday": false
      },
      "base_paid_usd": 0.0,
      "base_paid_uah": 0.0,
      "month_index": 83,
      "exclude_from_summary": false
    },
    {
      "id": 83,
      "title": "Кредит 10.2028",
      "due_label": "10.2028",
      "due_date": "2028-10-01",
      "payment_date": null,
      "period_year": 2028,
      "period_month": 10,
      "schedule_usd": 373.02,
      "fact_usd": null,
      "fact_uah": null,
      "rate": 43.27,
      "meters": null,
      "percent_increase": "",
      "raw_fact_uah": "",
      "raw_fact_usd": null,
      "status": "unpaid",
      "flags": {
        "early": false,
        "initial": false,
        "holiday": false
      },
      "base_paid_usd": 0.0,
      "base_paid_uah": 0.0,
      "month_index": 84,
      "exclude_from_summary": false
    },
    {
      "id": 84,
      "title": "Кредит 11.2028",
      "due_label": "11.2028",
      "due_date": "2028-11-01",
      "payment_date": null,
      "period_year": 2028,
      "period_month": 11,
      "schedule_usd": 371.9,
      "fact_usd": null,
      "fact_uah": null,
      "rate": 43.27,
      "meters": null,
      "percent_increase": "",
      "raw_fact_uah": "",
      "raw_fact_usd": null,
      "status": "unpaid",
      "flags": {
        "early": false,
        "initial": false,
        "holiday": false
      },
      "base_paid_usd": 0.0,
      "base_paid_uah": 0.0,
      "month_index": 85,
      "exclude_from_summary": false
    },
    {
      "id": 85,
      "title": "Кредит 12.2028",
      "due_label": "12.2028",
      "due_date": "2028-12-01",
      "payment_date": null,
      "period_year": 2028,
      "period_month": 12,
      "schedule_usd": 370.78,
      "fact_usd": null,
      "fact_uah": null,
      "rate": 43.27,
      "meters": null,
      "percent_increase": "",
      "raw_fact_uah": "",
      "raw_fact_usd": null,
      "status": "unpaid",
      "flags": {
        "early": false,
        "initial": false,
        "holiday": false
      },
      "base_paid_usd": 0.0,
      "base_paid_uah": 0.0,
      "month_index": 86,
      "exclude_from_summary": false
    },
    {
      "id": 86,
      "title": "Кредит 01.2029",
      "due_label": "01.2029",
      "due_date": "2029-01-01",
      "payment_date": null,
      "period_year": 2029,
      "period_month": 1,
      "schedule_usd": 369.66,
      "fact_usd": null,
      "fact_uah": null,
      "rate": 43.27,
      "meters": null,
      "percent_increase": "",
      "raw_fact_uah": "",
      "raw_fact_usd": null,
      "status": "unpaid",
      "flags": {
        "early": false,
        "initial": false,
        "holiday": false
      },
      "base_paid_usd": 0.0,
      "base_paid_uah": 0.0,
      "month_index": 87,
      "exclude_from_summary": false
    },
    {
      "id": 87,
      "title": "Кредит 02.2029",
      "due_label": "02.2029",
      "due_date": "2029-02-01",
      "payment_date": null,
      "period_year": 2029,
      "period_month": 2,
      "schedule_usd": 368.54,
      "fact_usd": null,
      "fact_uah": null,
      "rate": 43.27,
      "meters": null,
      "percent_increase": "",
      "raw_fact_uah": "",
      "raw_fact_usd": null,
      "status": "unpaid",
      "flags": {
        "early": false,
        "initial": false,
        "holiday": false
      },
      "base_paid_usd": 0.0,
      "base_paid_uah": 0.0,
      "month_index": 88,
      "exclude_from_summary": false
    },
    {
      "id": 88,
      "title": "Кредит 03.2029",
      "due_label": "03.2029",
      "due_date": "2029-03-01",
      "payment_date": null,
      "period_year": 2029,
      "period_month": 3,
      "schedule_usd": 367.41,
      "fact_usd": null,
      "fact_uah": null,
      "rate": 43.27,
      "meters": null,
      "percent_increase": "",
      "raw_fact_uah": "",
      "raw_fact_usd": null,
      "status": "unpaid",
      "flags": {
        "early": false,
        "initial": false,
        "holiday": false
      },
      "base_paid_usd": 0.0,
      "base_paid_uah": 0.0,
      "month_index": 89,
      "exclude_from_summary": false
    },
    {
      "id": 89,
      "title": "Кредит 04.2029",
      "due_label": "04.2029",
      "due_date": "2029-04-01",
      "payment_date": null,
      "period_year": 2029,
      "period_month": 4,
      "schedule_usd": 366.29,
      "fact_usd": null,
      "fact_uah": null,
      "rate": 43.27,
      "meters": null,
      "percent_increase": "",
      "raw_fact_uah": "",
      "raw_fact_usd": null,
      "status": "unpaid",
      "flags": {
        "early": false,
        "initial": false,
        "holiday": false
      },
      "base_paid_usd": 0.0,
      "base_paid_uah": 0.0,
      "month_index": 90,
      "exclude_from_summary": false
    },
    {
      "id": 90,
      "title": "Кредит 05.2029",
      "due_label": "05.2029",
      "due_date": "2029-05-01",
      "payment_date": null,
      "period_year": 2029,
      "period_month": 5,
      "schedule_usd": 365.17,
      "fact_usd": null,
      "fact_uah": null,
      "rate": 43.27,
      "meters": null,
      "percent_increase": "",
      "raw_fact_uah": "",
      "raw_fact_usd": null,
      "status": "unpaid",
      "flags": {
        "early": false,
        "initial": false,
        "holiday": false
      },
      "base_paid_usd": 0.0,
      "base_paid_uah": 0.0,
      "month_index": 91,
      "exclude_from_summary": false
    },
    {
      "id": 91,
      "title": "Кредит 06.2029",
      "due_label": "06.2029",
      "due_date": "2029-06-01",
      "payment_date": null,
      "period_year": 2029,
      "period_month": 6,
      "schedule_usd": 364.05,
      "fact_usd": null,
      "fact_uah": null,
      "rate": 43.27,
      "meters": null,
      "percent_increase": "",
      "raw_fact_uah": "",
      "raw_fact_usd": null,
      "status": "unpaid",
      "flags": {
        "early": false,
        "initial": false,
        "holiday": false
      },
      "base_paid_usd": 0.0,
      "base_paid_uah": 0.0,
      "month_index": 92,
      "exclude_from_summary": false
    },
    {
      "id": 92,
      "title": "Кредит 07.2029",
      "due_label": "07.2029",
      "due_date": "2029-07-01",
      "payment_date": null,
      "period_year": 2029,
      "period_month": 7,
      "schedule_usd": 362.93,
      "fact_usd": null,
      "fact_uah": null,
      "rate": 43.27,
      "meters": null,
      "percent_increase": "",
      "raw_fact_uah": "",
      "raw_fact_usd": null,
      "status": "unpaid",
      "flags": {
        "early": false,
        "initial": false,
        "holiday": false
      },
      "base_paid_usd": 0.0,
      "base_paid_uah": 0.0,
      "month_index": 93,
      "exclude_from_summary": false
    },
    {
      "id": 93,
      "title": "Кредит 08.2029",
      "due_label": "08.2029",
      "due_date": "2029-08-01",
      "payment_date": null,
      "period_year": 2029,
      "period_month": 8,
      "schedule_usd": 361.8,
      "fact_usd": null,
      "fact_uah": null,
      "rate": 43.27,
      "meters": null,
      "percent_increase": "",
      "raw_fact_uah": "",
      "raw_fact_usd": null,
      "status": "unpaid",
      "flags": {
        "early": false,
        "initial": false,
        "holiday": false
      },
      "base_paid_usd": 0.0,
      "base_paid_uah": 0.0,
      "month_index": 94,
      "exclude_from_summary": false
    },
    {
      "id": 94,
      "title": "Кредит 09.2029",
      "due_label": "09.2029",
      "due_date": "2029-09-01",
      "payment_date": null,
      "period_year": 2029,
      "period_month": 9,
      "schedule_usd": 360.68,
      "fact_usd": null,
      "fact_uah": null,
      "rate": 43.27,
      "meters": null,
      "percent_increase": "",
      "raw_fact_uah": "",
      "raw_fact_usd": null,
      "status": "unpaid",
      "flags": {
        "early": false,
        "initial": false,
        "holiday": false
      },
      "base_paid_usd": 0.0,
      "base_paid_uah": 0.0,
      "month_index": 95,
      "exclude_from_summary": false
    },
    {
      "id": 95,
      "title": "Кредит 10.2029",
      "due_label": "10.2029",
      "due_date": "2029-10-01",
      "payment_date": null,
      "period_year": 2029,
      "period_month": 10,
      "schedule_usd": 359.56,
      "fact_usd": null,
      "fact_uah": null,
      "rate": 43.27,
      "meters": null,
      "percent_increase": "",
      "raw_fact_uah": "",
      "raw_fact_usd": null,
      "status": "unpaid",
      "flags": {
        "early": false,
        "initial": false,
