window.PAYMENTS_DATA = {
  "project_key": "respublika1",
  "project_name": "Республіка 1",
  "apartment": "Парфенюк Ірина Вадимівна, акт звірки + планові періоди 2025-2030",
  "source_pdf": "/Users/irynaparfeniuk/Downloads/Парфенюк_Ірина_Вадимівна_акт_звірки.pdf",
  "generated_at": "2026-02-21T15:28:49",
  "summary": {
    "total": {
      "schedule_usd": 85793.02,
      "fact_uah": 3183246.59,
      "fact_usd": 85793.02,
      "meters": 36.9
    },
    "paid": {
      "schedule_usd": 42896.37,
      "fact_uah": 1507064.09,
      "fact_usd": 42896.37,
      "meters": 18.45
    },
    "remaining": {
      "schedule_usd": 42896.65,
      "fact_uah": 1676182.5,
      "fact_usd": 42896.65,
      "meters": 18.45
    }
  },
  "payments": [
    {
      "invoice": 1,
      "title": "Рахунок #1 (частина 1)",
      "due_label": "31.12.2021",
      "due_date": "2021-12-30",
      "payment_date": "2021-12-30",
      "period_year": 2021,
      "period_month": 12,
      "schedule_usd": 8579.16,
      "fact_usd": 8579.16,
      "fact_uah": 233554.85,
      "rate": 27.2235,
      "meters": 2.028386,
      "percent_increase": "10,00%",
      "raw_fact_uah": "257 393,95",
      "raw_fact_usd": "9 432,04",
      "status": "paid",
      "flags": {
        "early": false,
        "initial": true
      },
      "base_paid_usd": 8579.16,
      "base_paid_uah": 233554.85,
      "source_due_date": "2021-12-31",
      "id": 0,
      "exclude_from_summary": false
    },
    {
      "invoice": 1,
      "title": "Рахунок #1 (частина 2)",
      "due_label": "31.12.2021",
      "due_date": "2022-01-17",
      "payment_date": "2022-01-17",
      "period_year": 2022,
      "period_month": 1,
      "schedule_usd": 852.88,
      "fact_usd": 852.88,
      "fact_uah": 23839.1,
      "rate": 27.9514,
      "meters": 2.028386,
      "percent_increase": "10,00%",
      "raw_fact_uah": "257 393,95",
      "raw_fact_usd": "9 432,04",
      "status": "paid",
      "flags": {
        "early": false,
        "initial": true
      },
      "base_paid_usd": 852.88,
      "base_paid_uah": 23839.1,
      "source_due_date": "2021-12-31",
      "id": 1,
      "exclude_from_summary": false
    },
    {
      "invoice": 2,
      "title": "Рахунок #2 (частина 1)",
      "due_label": "30.01.2022",
      "due_date": "2022-02-14",
      "payment_date": "2022-02-14",
      "period_year": 2022,
      "period_month": 2,
      "schedule_usd": 867.74,
      "fact_usd": 867.74,
      "fact_uah": 24326.86,
      "rate": 28.0346,
      "meters": 0.37109,
      "percent_increase": "1,00%",
      "raw_fact_uah": "54 522,33",
      "raw_fact_usd": "1 725,57",
      "status": "paid",
      "flags": {
        "early": false,
        "initial": false
      },
      "base_paid_usd": 867.74,
      "base_paid_uah": 24326.86,
      "source_due_date": "2022-01-30",
      "id": 2,
      "exclude_from_summary": false
    },
    {
      "invoice": 2,
      "title": "Рахунок #2 (частина 2)",
      "due_label": "30.01.2022",
      "due_date": "2022-06-28",
      "payment_date": "2022-06-28",
      "period_year": 2022,
      "period_month": 6,
      "schedule_usd": 857.83,
      "fact_usd": 857.83,
      "fact_uah": 30195.47,
      "rate": 35.2,
      "meters": 0.37109,
      "percent_increase": "1,00%",
      "raw_fact_uah": "54 522,33",
      "raw_fact_usd": "1 725,57",
      "status": "paid",
      "flags": {
        "early": false,
        "initial": false
      },
      "base_paid_usd": 857.83,
      "base_paid_uah": 30195.47,
      "source_due_date": "2022-01-30",
      "id": 3,
      "exclude_from_summary": false
    },
    {
      "invoice": 4,
      "title": "Рахунок #4 (оплата)",
      "due_label": "30.03.2022",
      "due_date": "2022-07-22",
      "payment_date": "2022-07-22",
      "period_year": 2022,
      "period_month": 7,
      "schedule_usd": 830.05,
      "fact_usd": 830.05,
      "fact_uah": 30711.73,
      "rate": 37.0,
      "meters": 0.357009,
      "percent_increase": "1,00%",
      "raw_fact_uah": "30 711,73",
      "raw_fact_usd": "830,05",
      "status": "paid",
      "flags": {
        "early": false,
        "initial": false
      },
      "base_paid_usd": 830.05,
      "base_paid_uah": 30711.73,
      "source_due_date": "2022-03-30",
      "id": 4,
      "exclude_from_summary": false
    },
    {
      "invoice": 5,
      "title": "Рахунок #5 (оплата)",
      "due_label": "29.04.2022",
      "due_date": "2023-07-30",
      "payment_date": "2023-07-30",
      "period_year": 2023,
      "period_month": 7,
      "schedule_usd": 997.28,
      "fact_usd": 997.28,
      "fact_uah": 36700.0,
      "rate": 36.8,
      "meters": 0.428939,
      "percent_increase": "1,00%",
      "raw_fact_uah": "36 700,00",
      "raw_fact_usd": "997,28",
      "status": "paid",
      "flags": {
        "early": false,
        "initial": false
      },
      "base_paid_usd": 997.28,
      "base_paid_uah": 36700.0,
      "source_due_date": "2022-04-29",
      "id": 5,
      "exclude_from_summary": false
    },
    {
      "invoice": 7,
      "title": "Рахунок #7 (оплата)",
      "due_label": "28.06.2022",
      "due_date": "2023-08-31",
      "payment_date": "2023-08-31",
      "period_year": 2023,
      "period_month": 8,
      "schedule_usd": 1006.67,
      "fact_usd": 1006.67,
      "fact_uah": 37750.0,
      "rate": 37.5,
      "meters": 0.432972,
      "percent_increase": "1,00%",
      "raw_fact_uah": "37 750,00",
      "raw_fact_usd": "1 006,67",
      "status": "paid",
      "flags": {
        "early": false,
        "initial": false
      },
      "base_paid_usd": 1006.67,
      "base_paid_uah": 37750.0,
      "source_due_date": "2022-06-28",
      "id": 6,
      "exclude_from_summary": false
    },
    {
      "invoice": 8,
      "title": "Рахунок #8 (оплата)",
      "due_label": "28.07.2022",
      "due_date": "2023-09-26",
      "payment_date": "2023-09-26",
      "period_year": 2023,
      "period_month": 9,
      "schedule_usd": 1013.3,
      "fact_usd": 1013.3,
      "fact_uah": 38100.0,
      "rate": 37.6,
      "meters": 0.435822,
      "percent_increase": "1,00%",
      "raw_fact_uah": "38 100,00",
      "raw_fact_usd": "1 013,30",
      "status": "paid",
      "flags": {
        "early": false,
        "initial": false
      },
      "base_paid_usd": 1013.3,
      "base_paid_uah": 38100.0,
      "source_due_date": "2022-07-28",
      "id": 7,
      "exclude_from_summary": false
    },
    {
      "invoice": 9,
      "title": "Рахунок #9 (оплата)",
      "due_label": "27.08.2022",
      "due_date": "2023-10-27",
      "payment_date": "2023-10-27",
      "period_year": 2023,
      "period_month": 10,
      "schedule_usd": 1000.0,
      "fact_usd": 1000.0,
      "fact_uah": 37500.0,
      "rate": 37.5,
      "meters": 0.430105,
      "percent_increase": "1,00%",
      "raw_fact_uah": "37 500,00",
      "raw_fact_usd": "1 000,00",
      "status": "paid",
      "flags": {
        "early": false,
        "initial": false
      },
      "base_paid_usd": 1000.0,
      "base_paid_uah": 37500.0,
      "source_due_date": "2022-08-27",
      "id": 8,
      "exclude_from_summary": false
    },
    {
      "invoice": 10,
      "title": "Рахунок #10 (частина 1)",
      "due_label": "26.09.2022",
      "due_date": "2023-11-22",
      "payment_date": "2023-11-22",
      "period_year": 2023,
      "period_month": 11,
      "schedule_usd": 14919.08,
      "fact_usd": 14919.08,
      "fact_uah": 554989.7,
      "rate": 37.2,
      "meters": 3.579178,
      "percent_increase": "1,00%",
      "raw_fact_uah": "620 850,78",
      "raw_fact_usd": "16 643,19",
      "status": "paid",
      "flags": {
        "early": false,
        "initial": false
      },
      "base_paid_usd": 14919.08,
      "base_paid_uah": 554989.7,
      "source_due_date": "2022-09-26",
      "id": 9,
      "exclude_from_summary": false
    },
    {
      "invoice": 10,
      "title": "Рахунок #10 (частина 2)",
      "due_label": "26.09.2022",
      "due_date": "2023-12-29",
      "payment_date": "2023-12-29",
      "period_year": 2023,
      "period_month": 12,
      "schedule_usd": 1724.11,
      "fact_usd": 1724.11,
      "fact_uah": 65861.08,
      "rate": 38.2,
      "meters": 3.579178,
      "percent_increase": "1,00%",
      "raw_fact_uah": "620 850,78",
      "raw_fact_usd": "16 643,19",
      "status": "paid",
      "flags": {
        "early": false,
        "initial": false
      },
      "base_paid_usd": 1724.11,
      "base_paid_uah": 65861.08,
      "source_due_date": "2022-09-26",
      "id": 10,
      "exclude_from_summary": false
    },
    {
      "invoice": 26,
      "title": "Рахунок #26",
      "due_label": "01.01.2024",
      "due_date": "2024-01-01",
      "payment_date": null,
      "period_year": 2024,
      "period_month": 1,
      "schedule_usd": 42896.65,
      "fact_usd": null,
      "fact_uah": null,
      "rate": 39.0749,
      "meters": 18.45,
      "percent_increase": "50,00%",
      "raw_fact_uah": "1 676 182,50",
      "raw_fact_usd": "42 896,65",
      "status": "unpaid",
      "flags": {
        "early": false,
        "initial": false
      },
      "base_paid_usd": 0.0,
      "base_paid_uah": 0.0,
      "source_due_date": "2024-01-01",
      "id": 11,
      "exclude_from_summary": false
    },
    {
      "invoice": 21,
      "title": "Рахунок #21 (оплата)",
      "due_label": "22.08.2023",
      "due_date": "2024-01-27",
      "payment_date": "2024-01-27",
      "period_year": 2024,
      "period_month": 1,
      "schedule_usd": 2583.63,
      "fact_usd": 2583.63,
      "fact_uah": 97532.06,
      "rate": 37.75,
      "meters": 1.111236,
      "percent_increase": "3,00%",
      "raw_fact_uah": "97 532,06",
      "raw_fact_usd": "2 583,63",
      "status": "paid",
      "flags": {
        "early": false,
        "initial": false
      },
      "base_paid_usd": 2583.63,
      "base_paid_uah": 97532.06,
      "source_due_date": "2023-08-22",
      "id": 12,
      "exclude_from_summary": false
    },
    {
      "invoice": 22,
      "title": "Рахунок #22 (оплата)",
      "due_label": "21.09.2023",
      "due_date": "2024-02-29",
      "payment_date": "2024-02-29",
      "period_year": 2024,
      "period_month": 2,
      "schedule_usd": 3140.73,
      "fact_usd": 3140.73,
      "fact_uah": 120000.0,
      "rate": 38.2077,
      "meters": 1.350849,
      "percent_increase": "3,00%",
      "raw_fact_uah": "120 000,00",
      "raw_fact_usd": "3 140,73",
      "status": "paid",
      "flags": {
        "early": false,
        "initial": false
      },
      "base_paid_usd": 3140.73,
      "base_paid_uah": 120000.0,
      "source_due_date": "2023-09-21",
      "id": 13,
      "exclude_from_summary": false
    },
    {
      "invoice": 24,
      "title": "Рахунок #24 (оплата)",
      "due_label": "20.11.2023",
      "due_date": "2024-03-14",
      "payment_date": "2024-03-14",
      "period_year": 2024,
      "period_month": 3,
      "schedule_usd": 3300.01,
      "fact_usd": 3300.01,
      "fact_uah": 128000.0,
      "rate": 38.7878,
      "meters": 1.419352,
      "percent_increase": "3,00%",
      "raw_fact_uah": "128 000,00",
      "raw_fact_usd": "3 300,01",
      "status": "paid",
      "flags": {
        "early": false,
        "initial": false
      },
      "base_paid_usd": 3300.01,
      "base_paid_uah": 128000.0,
      "source_due_date": "2023-11-20",
      "id": 14,
      "exclude_from_summary": false
    },
    {
      "invoice": 25,
      "title": "Рахунок #25 (оплата)",
      "due_label": "20.12.2023",
      "due_date": "2024-03-29",
      "payment_date": "2024-03-29",
      "period_year": 2024,
      "period_month": 3,
      "schedule_usd": 1223.9,
      "fact_usd": 1223.9,
      "fact_uah": 48003.24,
      "rate": 39.2214,
      "meters": 0.526409,
      "percent_increase": "3,00%",
      "raw_fact_uah": "48 003,24",
      "raw_fact_usd": "1 223,90",
      "status": "paid",
      "flags": {
        "early": false,
        "initial": false
      },
      "base_paid_usd": 1223.9,
      "base_paid_uah": 48003.24,
      "source_due_date": "2023-12-20",
      "id": 15,
      "exclude_from_summary": false
    },
    {
      "invoice": null,
      "title": "План: 01.06.2025",
      "due_label": "01.06.2025",
      "due_date": "2025-06-01",
      "payment_date": "2025-05-30",
      "period_year": 2025,
      "period_month": 6,
      "schedule_usd": 695.56,
      "fact_usd": 1391.12,
      "fact_uah": 57771.13,
      "rate": 41.5285,
      "meters": 59.83,
      "percent_increase": "0,00%",
      "raw_fact_uah": "57 771,13",
      "raw_fact_usd": "1 391,12",
      "status": "paid",
      "flags": {
        "early": false,
        "initial": false,
        "plan_only": true
      },
      "base_paid_usd": 1391.12,
      "base_paid_uah": 57771.13,
      "source_due_date": "2025-06-01",
      "exclude_from_summary": true,
      "id": 16
    },
    {
      "invoice": null,
      "title": "План: 01.07.2025",
      "due_label": "01.07.2025",
      "due_date": "2025-07-01",
      "payment_date": "2025-07-01",
      "period_year": 2025,
      "period_month": 7,
      "schedule_usd": 701.61,
      "fact_usd": 699.29,
      "fact_uah": 29215.67,
      "rate": 41.7788,
      "meters": 29.92,
      "percent_increase": "0,87%",
      "raw_fact_uah": "29 215,67",
      "raw_fact_usd": "699,29",
      "status": "paid",
      "flags": {
        "early": false,
        "initial": false,
        "plan_only": true
      },
      "base_paid_usd": 699.29,
      "base_paid_uah": 29215.67,
      "source_due_date": "2025-07-01",
      "exclude_from_summary": true,
      "id": 17
    },
    {
      "invoice": null,
      "title": "План: 01.08.2025",
      "due_label": "01.08.2025",
      "due_date": "2025-08-01",
      "payment_date": "2025-07-30",
      "period_year": 2025,
      "period_month": 8,
      "schedule_usd": 707.71,
      "fact_usd": 709.92,
      "fact_uah": 29666.76,
      "rate": 41.7886,
      "meters": 29.92,
      "percent_increase": "0,87%",
      "raw_fact_uah": "29 666,76",
      "raw_fact_usd": "709,92",
      "status": "paid",
      "flags": {
        "early": false,
        "initial": false,
        "plan_only": true
      },
      "base_paid_usd": 709.92,
      "base_paid_uah": 29666.76,
      "source_due_date": "2025-08-01",
      "exclude_from_summary": true,
      "id": 18
    },
    {
      "invoice": null,
      "title": "План: 01.09.2025",
      "due_label": "01.09.2025",
      "due_date": "2025-09-01",
      "payment_date": "2025-08-30",
      "period_year": 2025,
      "period_month": 9,
      "schedule_usd": 713.87,
      "fact_usd": 4285.79,
      "fact_uah": 176832.57,
      "rate": 41.2602,
      "meters": 179.5,
      "percent_increase": "0,87%",
      "raw_fact_uah": "176 832,57",
      "raw_fact_usd": "4 285,79",
      "status": "paid",
      "flags": {
        "early": false,
        "initial": false,
        "plan_only": true
      },
      "base_paid_usd": 4285.79,
      "base_paid_uah": 176832.57,
      "source_due_date": "2025-09-01",
      "exclude_from_summary": true,
      "id": 19
    },
    {
      "invoice": null,
      "title": "План: 01.10.2025",
      "due_label": "01.10.2025",
      "due_date": "2025-10-01",
      "payment_date": "2025-09-27",
      "period_year": 2025,
      "period_month": 10,
      "schedule_usd": 720.08,
      "fact_usd": 717.62,
      "fact_uah": 29776.85,
      "rate": 41.4939,
      "meters": 29.92,
      "percent_increase": "0,87%",
      "raw_fact_uah": "29 776,85",
      "raw_fact_usd": "717,62",
      "status": "paid",
      "flags": {
        "early": false,
        "initial": false,
        "plan_only": true
      },
      "base_paid_usd": 717.62,
      "base_paid_uah": 29776.85,
      "source_due_date": "2025-10-01",
      "exclude_from_summary": true,
      "id": 20
    },
    {
      "invoice": null,
      "title": "План: 01.11.2025",
      "due_label": "01.11.2025",
      "due_date": "2025-11-01",
      "payment_date": "2025-10-31",
      "period_year": 2025,
      "period_month": 11,
      "schedule_usd": 726.34,
      "fact_usd": 728.08,
      "fact_uah": 30557.41,
      "rate": 41.9701,
      "meters": 29.92,
      "percent_increase": "0,87%",
      "raw_fact_uah": "30 557,41",
      "raw_fact_usd": "728,08",
      "status": "paid",
      "flags": {
        "early": false,
        "initial": false,
        "plan_only": true
      },
      "base_paid_usd": 728.08,
      "base_paid_uah": 30557.41,
      "source_due_date": "2025-11-01",
      "exclude_from_summary": true,
      "id": 21
    },
    {
      "invoice": null,
      "title": "План: 01.12.2025",
      "due_label": "01.12.2025",
      "due_date": "2025-12-01",
      "payment_date": "2025-11-30",
      "period_year": 2025,
      "period_month": 12,
      "schedule_usd": 732.66,
      "fact_usd": 728.74,
      "fact_uah": 30747.68,
      "rate": 42.1928,
      "meters": 29.92,
      "percent_increase": "0,87%",
      "raw_fact_uah": "30 747,68",
      "raw_fact_usd": "728,74",
      "status": "paid",
      "flags": {
        "early": false,
        "initial": false,
        "plan_only": true
      },
      "base_paid_usd": 728.74,
      "base_paid_uah": 30747.68,
      "source_due_date": "2025-12-01",
      "exclude_from_summary": true,
      "id": 22
    },
    {
      "invoice": null,
      "title": "План: 01.01.2026",
      "due_label": "01.01.2026",
      "due_date": "2026-01-01",
      "payment_date": "2025-12-16",
      "period_year": 2026,
      "period_month": 1,
      "schedule_usd": 739.03,
      "fact_usd": 740.31,
      "fact_uah": 31274.32,
      "rate": 42.2451,
      "meters": 29.92,
      "percent_increase": "0,87%",
      "raw_fact_uah": "31 274,32",
      "raw_fact_usd": "740,31",
      "status": "paid",
      "flags": {
        "early": false,
        "initial": false,
        "plan_only": true
      },
      "base_paid_usd": 740.31,
      "base_paid_uah": 31274.32,
      "source_due_date": "2026-01-01",
      "exclude_from_summary": true,
      "id": 23
    },
    {
      "invoice": null,
      "title": "План: 01.02.2026",
      "due_label": "01.02.2026",
      "due_date": "2026-02-01",
      "payment_date": "2026-01-13",
      "period_year": 2026,
      "period_month": 2,
      "schedule_usd": 745.46,
      "fact_usd": 1463.04,
      "fact_uah": 63284.2,
      "rate": 43.2552,
      "meters": 59.84,
      "percent_increase": "0,87%",
      "raw_fact_uah": "63 284,20",
      "raw_fact_usd": "1 463,04",
      "status": "paid",
      "flags": {
        "early": false,
        "initial": false,
        "plan_only": true
      },
      "base_paid_usd": 1463.04,
      "base_paid_uah": 63284.2,
      "source_due_date": "2026-02-01",
      "exclude_from_summary": true,
      "id": 24
    },
    {
      "invoice": null,
      "title": "План: 01.03.2026",
      "due_label": "01.03.2026",
      "due_date": "2026-03-01",
      "payment_date": null,
      "period_year": 2026,
      "period_month": 3,
      "schedule_usd": 751.95,
      "fact_usd": 35.27,
      "fact_uah": 1508.46,
      "rate": 42.7689,
      "meters": 1.4,
      "percent_increase": "0,87%",
      "raw_fact_uah": "1 508,46",
      "raw_fact_usd": "35,27",
      "status": "partial",
      "flags": {
        "early": false,
        "initial": false,
        "plan_only": true
      },
      "base_paid_usd": 0.0,
      "base_paid_uah": 0.0,
      "source_due_date": "2026-03-01",
      "exclude_from_summary": true,
      "id": 25
    },
    {
      "invoice": null,
      "title": "План: 01.04.2026",
      "due_label": "01.04.2026",
      "due_date": "2026-04-01",
      "payment_date": null,
      "period_year": 2026,
      "period_month": 4,
      "schedule_usd": 758.49,
      "fact_usd": 758.49,
      "fact_uah": 32439.78,
      "rate": 42.7689,
      "meters": 29.92,
      "percent_increase": "0,87%",
      "raw_fact_uah": "32 439,78",
      "raw_fact_usd": "758,49",
      "status": "unpaid",
      "flags": {
        "early": false,
        "initial": false,
        "plan_only": true
      },
      "base_paid_usd": 0.0,
      "base_paid_uah": 0.0,
      "source_due_date": "2026-04-01",
      "exclude_from_summary": true,
      "id": 26
    },
    {
      "invoice": null,
      "title": "План: 01.05.2026",
      "due_label": "01.05.2026",
      "due_date": "2026-05-01",
      "payment_date": null,
      "period_year": 2026,
      "period_month": 5,
      "schedule_usd": 765.09,
      "fact_usd": 765.09,
      "fact_uah": 32722.06,
      "rate": 42.7689,
      "meters": 29.92,
      "percent_increase": "0,87%",
      "raw_fact_uah": "32 722,06",
      "raw_fact_usd": "765,09",
      "status": "unpaid",
      "flags": {
        "early": false,
        "initial": false,
        "plan_only": true
      },
      "base_paid_usd": 0.0,
      "base_paid_uah": 0.0,
      "source_due_date": "2026-05-01",
      "exclude_from_summary": true,
      "id": 27
    },
    {
      "invoice": null,
      "title": "План: 01.06.2026",
      "due_label": "01.06.2026",
      "due_date": "2026-06-01",
      "payment_date": null,
      "period_year": 2026,
      "period_month": 6,
      "schedule_usd": 771.75,
      "fact_usd": 771.75,
      "fact_uah": 33006.9,
      "rate": 42.7689,
      "meters": 29.92,
      "percent_increase": "0,87%",
      "raw_fact_uah": "33 006,90",
      "raw_fact_usd": "771,75",
      "status": "unpaid",
      "flags": {
        "early": false,
        "initial": false,
        "plan_only": true
      },
      "base_paid_usd": 0.0,
      "base_paid_uah": 0.0,
      "source_due_date": "2026-06-01",
      "exclude_from_summary": true,
      "id": 28
    },
    {
      "invoice": null,
      "title": "План: 01.07.2026",
      "due_label": "01.07.2026",
      "due_date": "2026-07-01",
      "payment_date": null,
      "period_year": 2026,
      "period_month": 7,
      "schedule_usd": 778.46,
      "fact_usd": 778.46,
      "fact_uah": 33293.88,
      "rate": 42.7689,
      "meters": 29.92,
      "percent_increase": "0,87%",
      "raw_fact_uah": "33 293,88",
      "raw_fact_usd": "778,46",
      "status": "unpaid",
      "flags": {
        "early": false,
        "initial": false,
        "plan_only": true
      },
      "base_paid_usd": 0.0,
      "base_paid_uah": 0.0,
      "source_due_date": "2026-07-01",
      "exclude_from_summary": true,
      "id": 29
    },
    {
      "invoice": null,
      "title": "План: 01.08.2026",
      "due_label": "01.08.2026",
      "due_date": "2026-08-01",
      "payment_date": null,
      "period_year": 2026,
      "period_month": 8,
      "schedule_usd": 785.23,
      "fact_usd": 785.23,
      "fact_uah": 33583.42,
      "rate": 42.7689,
      "meters": 29.92,
      "percent_increase": "0,87%",
      "raw_fact_uah": "33 583,42",
      "raw_fact_usd": "785,23",
      "status": "unpaid",
      "flags": {
        "early": false,
        "initial": false,
        "plan_only": true
      },
      "base_paid_usd": 0.0,
      "base_paid_uah": 0.0,
      "source_due_date": "2026-08-01",
      "exclude_from_summary": true,
      "id": 30
    },
    {
      "invoice": null,
      "title": "План: 01.09.2026",
      "due_label": "01.09.2026",
      "due_date": "2026-09-01",
      "payment_date": null,
      "period_year": 2026,
      "period_month": 9,
      "schedule_usd": 792.06,
      "fact_usd": 792.06,
      "fact_uah": 33875.53,
      "rate": 42.7689,
      "meters": 29.92,
      "percent_increase": "0,87%",
      "raw_fact_uah": "33 875,53",
      "raw_fact_usd": "792,06",
      "status": "unpaid",
      "flags": {
        "early": false,
        "initial": false,
        "plan_only": true
      },
      "base_paid_usd": 0.0,
      "base_paid_uah": 0.0,
      "source_due_date": "2026-09-01",
      "exclude_from_summary": true,
      "id": 31
    },
    {
      "invoice": null,
      "title": "План: 01.10.2026",
      "due_label": "01.10.2026",
      "due_date": "2026-10-01",
      "payment_date": null,
      "period_year": 2026,
      "period_month": 10,
      "schedule_usd": 798.95,
      "fact_usd": 798.95,
      "fact_uah": 34170.21,
      "rate": 42.7689,
      "meters": 29.92,
      "percent_increase": "0,87%",
      "raw_fact_uah": "34 170,21",
      "raw_fact_usd": "798,95",
      "status": "unpaid",
      "flags": {
        "early": false,
        "initial": false,
        "plan_only": true
      },
      "base_paid_usd": 0.0,
      "base_paid_uah": 0.0,
      "source_due_date": "2026-10-01",
      "exclude_from_summary": true,
      "id": 32
    },
    {
      "invoice": null,
      "title": "План: 01.11.2026",
      "due_label": "01.11.2026",
      "due_date": "2026-11-01",
      "payment_date": null,
      "period_year": 2026,
      "period_month": 11,
      "schedule_usd": 805.9,
      "fact_usd": 805.9,
      "fact_uah": 34467.46,
      "rate": 42.7689,
      "meters": 29.92,
      "percent_increase": "0,87%",
      "raw_fact_uah": "34 467,46",
      "raw_fact_usd": "805,90",
      "status": "unpaid",
      "flags": {
        "early": false,
        "initial": false,
        "plan_only": true
      },
      "base_paid_usd": 0.0,
      "base_paid_uah": 0.0,
      "source_due_date": "2026-11-01",
      "exclude_from_summary": true,
      "id": 33
    },
    {
      "invoice": null,
      "title": "План: 01.12.2026",
      "due_label": "01.12.2026",
      "due_date": "2026-12-01",
      "payment_date": null,
      "period_year": 2026,
      "period_month": 12,
      "schedule_usd": 812.91,
      "fact_usd": 812.91,
      "fact_uah": 34767.27,
      "rate": 42.7689,
      "meters": 29.92,
      "percent_increase": "0,87%",
      "raw_fact_uah": "34 767,27",
      "raw_fact_usd": "812,91",
      "status": "unpaid",
      "flags": {
        "early": false,
        "initial": false,
        "plan_only": true
      },
      "base_paid_usd": 0.0,
      "base_paid_uah": 0.0,
      "source_due_date": "2026-12-01",
      "exclude_from_summary": true,
      "id": 34
    },
    {
      "invoice": null,
      "title": "План: 01.01.2027",
      "due_label": "01.01.2027",
      "due_date": "2027-01-01",
      "payment_date": null,
      "period_year": 2027,
      "period_month": 1,
      "schedule_usd": 819.98,
      "fact_usd": 819.98,
      "fact_uah": 35069.64,
      "rate": 42.7689,
      "meters": 29.92,
      "percent_increase": "0,87%",
      "raw_fact_uah": "35 069,64",
      "raw_fact_usd": "819,98",
      "status": "unpaid",
      "flags": {
        "early": false,
        "initial": false,
        "plan_only": true
      },
      "base_paid_usd": 0.0,
      "base_paid_uah": 0.0,
      "source_due_date": "2027-01-01",
      "exclude_from_summary": true,
      "id": 35
    },
    {
      "invoice": null,
      "title": "План: 01.02.2027",
      "due_label": "01.02.2027",
      "due_date": "2027-02-01",
      "payment_date": null,
      "period_year": 2027,
      "period_month": 2,
      "schedule_usd": 827.11,
      "fact_usd": 827.11,
      "fact_uah": 35374.58,
      "rate": 42.7689,
      "meters": 29.92,
      "percent_increase": "0,87%",
      "raw_fact_uah": "35 374,58",
      "raw_fact_usd": "827,11",
      "status": "unpaid",
      "flags": {
        "early": false,
        "initial": false,
        "plan_only": true
      },
      "base_paid_usd": 0.0,
      "base_paid_uah": 0.0,
      "source_due_date": "2027-02-01",
      "exclude_from_summary": true,
      "id": 36
    },
    {
      "invoice": null,
      "title": "План: 01.03.2027",
      "due_label": "01.03.2027",
      "due_date": "2027-03-01",
      "payment_date": null,
      "period_year": 2027,
      "period_month": 3,
      "schedule_usd": 834.31,
      "fact_usd": 834.31,
      "fact_uah": 35682.52,
      "rate": 42.7689,
      "meters": 29.92,
      "percent_increase": "0,87%",
      "raw_fact_uah": "35 682,52",
      "raw_fact_usd": "834,31",
      "status": "unpaid",
      "flags": {
        "early": false,
        "initial": false,
        "plan_only": true
      },
      "base_paid_usd": 0.0,
      "base_paid_uah": 0.0,
      "source_due_date": "2027-03-01",
      "exclude_from_summary": true,
      "id": 37
    },
    {
      "invoice": null,
      "title": "План: 01.04.2027",
      "due_label": "01.04.2027",
      "due_date": "2027-04-01",
      "payment_date": null,
      "period_year": 2027,
      "period_month": 4,
      "schedule_usd": 841.57,
      "fact_usd": 841.57,
      "fact_uah": 35993.02,
      "rate": 42.7689,
      "meters": 29.92,
      "percent_increase": "0,87%",
      "raw_fact_uah": "35 993,02",
      "raw_fact_usd": "841,57",
      "status": "unpaid",
      "flags": {
        "early": false,
        "initial": false,
        "plan_only": true
      },
      "base_paid_usd": 0.0,
      "base_paid_uah": 0.0,
      "source_due_date": "2027-04-01",
      "exclude_from_summary": true,
      "id": 38
    },
    {
      "invoice": null,
      "title": "План: 01.05.2027",
      "due_label": "01.05.2027",
      "due_date": "2027-05-01",
      "payment_date": null,
      "period_year": 2027,
      "period_month": 5,
      "schedule_usd": 848.89,
      "fact_usd": 848.89,
      "fact_uah": 36306.09,
      "rate": 42.7689,
      "meters": 29.92,
      "percent_increase": "0,87%",
      "raw_fact_uah": "36 306,09",
      "raw_fact_usd": "848,89",
      "status": "unpaid",
      "flags": {
        "early": false,
        "initial": false,
        "plan_only": true
      },
      "base_paid_usd": 0.0,
      "base_paid_uah": 0.0,
      "source_due_date": "2027-05-01",
      "exclude_from_summary": true,
      "id": 39
    },
    {
      "invoice": null,
      "title": "План: 01.06.2027",
      "due_label": "01.06.2027",
      "due_date": "2027-06-01",
      "payment_date": null,
      "period_year": 2027,
      "period_month": 6,
      "schedule_usd": 856.28,
      "fact_usd": 856.28,
      "fact_uah": 36622.15,
      "rate": 42.7689,
      "meters": 29.92,
      "percent_increase": "0,87%",
      "raw_fact_uah": "36 622,15",
      "raw_fact_usd": "856,28",
      "status": "unpaid",
      "flags": {
        "early": false,
        "initial": false,
        "plan_only": true
      },
      "base_paid_usd": 0.0,
      "base_paid_uah": 0.0,
      "source_due_date": "2027-06-01",
      "exclude_from_summary": true,
      "id": 40
    },
    {
      "invoice": null,
      "title": "План: 01.07.2027",
      "due_label": "01.07.2027",
      "due_date": "2027-07-01",
      "payment_date": null,
      "period_year": 2027,
      "period_month": 7,
      "schedule_usd": 863.73,
      "fact_usd": 863.73,
      "fact_uah": 36940.78,
      "rate": 42.7689,
      "meters": 29.92,
      "percent_increase": "0,87%",
      "raw_fact_uah": "36 940,78",
      "raw_fact_usd": "863,73",
      "status": "unpaid",
      "flags": {
        "early": false,
        "initial": false,
        "plan_only": true
      },
      "base_paid_usd": 0.0,
      "base_paid_uah": 0.0,
      "source_due_date": "2027-07-01",
      "exclude_from_summary": true,
      "id": 41
    },
    {
      "invoice": null,
      "title": "План: 01.08.2027",
      "due_label": "01.08.2027",
      "due_date": "2027-08-01",
      "payment_date": null,
      "period_year": 2027,
      "period_month": 8,
      "schedule_usd": 871.24,
      "fact_usd": 871.24,
      "fact_uah": 37261.98,
      "rate": 42.7689,
      "meters": 29.92,
      "percent_increase": "0,87%",
      "raw_fact_uah": "37 261,98",
      "raw_fact_usd": "871,24",
      "status": "unpaid",
      "flags": {
        "early": false,
        "initial": false,
        "plan_only": true
      },
      "base_paid_usd": 0.0,
      "base_paid_uah": 0.0,
      "source_due_date": "2027-08-01",
      "exclude_from_summary": true,
      "id": 42
    },
    {
      "invoice": null,
      "title": "План: 01.09.2027",
      "due_label": "01.09.2027",
      "due_date": "2027-09-01",
      "payment_date": null,
      "period_year": 2027,
      "period_month": 9,
      "schedule_usd": 878.82,
      "fact_usd": 878.82,
      "fact_uah": 37586.16,
      "rate": 42.7689,
      "meters": 29.92,
      "percent_increase": "0,87%",
      "raw_fact_uah": "37 586,16",
      "raw_fact_usd": "878,82",
      "status": "unpaid",
      "flags": {
        "early": false,
        "initial": false,
        "plan_only": true
      },
      "base_paid_usd": 0.0,
      "base_paid_uah": 0.0,
      "source_due_date": "2027-09-01",
      "exclude_from_summary": true,
      "id": 43
    },
    {
      "invoice": null,
      "title": "План: 01.10.2027",
      "due_label": "01.10.2027",
      "due_date": "2027-10-01",
      "payment_date": null,
      "period_year": 2027,
      "period_month": 10,
      "schedule_usd": 886.47,
      "fact_usd": 886.47,
      "fact_uah": 37913.35,
      "rate": 42.7689,
      "meters": 29.92,
      "percent_increase": "0,87%",
      "raw_fact_uah": "37 913,35",
      "raw_fact_usd": "886,47",
      "status": "unpaid",
      "flags": {
        "early": false,
        "initial": false,
        "plan_only": true
      },
      "base_paid_usd": 0.0,
      "base_paid_uah": 0.0,
      "source_due_date": "2027-10-01",
      "exclude_from_summary": true,
      "id": 44
    },
    {
      "invoice": null,
      "title": "План: 01.11.2027",
      "due_label": "01.11.2027",
      "due_date": "2027-11-01",
      "payment_date": null,
      "period_year": 2027,
      "period_month": 11,
      "schedule_usd": 894.18,
      "fact_usd": 894.18,
      "fact_uah": 38243.1,
      "rate": 42.7689,
      "meters": 29.92,
      "percent_increase": "0,87%",
      "raw_fact_uah": "38 243,10",
      "raw_fact_usd": "894,18",
      "status": "unpaid",
      "flags": {
        "early": false,
        "initial": false,
        "plan_only": true
      },
      "base_paid_usd": 0.0,
      "base_paid_uah": 0.0,
      "source_due_date": "2027-11-01",
      "exclude_from_summary": true,
      "id": 45
    },
    {
      "invoice": null,
      "title": "План: 01.12.2027",
      "due_label": "01.12.2027",
      "due_date": "2027-12-01",
      "payment_date": null,
      "period_year": 2027,
      "period_month": 12,
      "schedule_usd": 901.96,
      "fact_usd": 901.96,
      "fact_uah": 38575.84,
      "rate": 42.7689,
      "meters": 29.92,
      "percent_increase": "0,87%",
      "raw_fact_uah": "38 575,84",
      "raw_fact_usd": "901,96",
      "status": "unpaid",
      "flags": {
        "early": false,
        "initial": false,
        "plan_only": true
      },
      "base_paid_usd": 0.0,
      "base_paid_uah": 0.0,
      "source_due_date": "2027-12-01",
      "exclude_from_summary": true,
      "id": 46
    },
    {
      "invoice": null,
      "title": "План: 01.01.2028",
      "due_label": "01.01.2028",
      "due_date": "2028-01-01",
      "payment_date": null,
      "period_year": 2028,
      "period_month": 1,
      "schedule_usd": 909.81,
      "fact_usd": 909.81,
      "fact_uah": 38911.57,
      "rate": 42.7689,
      "meters": 29.92,
      "percent_increase": "0,87%",
      "raw_fact_uah": "38 911,57",
      "raw_fact_usd": "909,81",
      "status": "unpaid",
      "flags": {
        "early": false,
        "initial": false,
        "plan_only": true
      },
      "base_paid_usd": 0.0,
      "base_paid_uah": 0.0,
      "source_due_date": "2028-01-01",
      "exclude_from_summary": true,
      "id": 47
    },
    {
      "invoice": null,
      "title": "План: 01.02.2028",
      "due_label": "01.02.2028",
      "due_date": "2028-02-01",
      "payment_date": null,
      "period_year": 2028,
      "period_month": 2,
      "schedule_usd": 917.73,
      "fact_usd": 917.73,
      "fact_uah": 39250.3,
      "rate": 42.7689,
      "meters": 29.92,
      "percent_increase": "0,87%",
      "raw_fact_uah": "39 250,30",
      "raw_fact_usd": "917,73",
      "status": "unpaid",
      "flags": {
        "early": false,
        "initial": false,
        "plan_only": true
      },
      "base_paid_usd": 0.0,
      "base_paid_uah": 0.0,
      "source_due_date": "2028-02-01",
      "exclude_from_summary": true,
      "id": 48
    },
    {
      "invoice": null,
      "title": "План: 01.03.2028",
      "due_label": "01.03.2028",
      "due_date": "2028-03-01",
      "payment_date": null,
      "period_year": 2028,
      "period_month": 3,
      "schedule_usd": 925.71,
      "fact_usd": 925.71,
      "fact_uah": 39591.6,
      "rate": 42.7689,
      "meters": 29.92,
      "percent_increase": "0,87%",
      "raw_fact_uah": "39 591,60",
      "raw_fact_usd": "925,71",
      "status": "unpaid",
      "flags": {
        "early": false,
        "initial": false,
        "plan_only": true
      },
      "base_paid_usd": 0.0,
      "base_paid_uah": 0.0,
      "source_due_date": "2028-03-01",
      "exclude_from_summary": true,
      "id": 49
    },
    {
      "invoice": null,
      "title": "План: 01.04.2028",
      "due_label": "01.04.2028",
      "due_date": "2028-04-01",
      "payment_date": null,
      "period_year": 2028,
      "period_month": 4,
      "schedule_usd": 933.76,
      "fact_usd": 933.76,
      "fact_uah": 39935.89,
      "rate": 42.7689,
      "meters": 29.92,
      "percent_increase": "0,87%",
      "raw_fact_uah": "39 935,89",
      "raw_fact_usd": "933,76",
      "status": "unpaid",
      "flags": {
        "early": false,
        "initial": false,
        "plan_only": true
      },
      "base_paid_usd": 0.0,
      "base_paid_uah": 0.0,
      "source_due_date": "2028-04-01",
      "exclude_from_summary": true,
      "id": 50
    },
    {
      "invoice": null,
      "title": "План: 01.05.2028",
      "due_label": "01.05.2028",
      "due_date": "2028-05-01",
      "payment_date": null,
      "period_year": 2028,
      "period_month": 5,
      "schedule_usd": 941.88,
      "fact_usd": 941.88,
      "fact_uah": 40283.17,
      "rate": 42.7689,
      "meters": 29.92,
      "percent_increase": "0,87%",
      "raw_fact_uah": "40 283,17",
      "raw_fact_usd": "941,88",
      "status": "unpaid",
      "flags": {
        "early": false,
        "initial": false,
        "plan_only": true
      },
      "base_paid_usd": 0.0,
      "base_paid_uah": 0.0,
      "source_due_date": "2028-05-01",
      "exclude_from_summary": true,
      "id": 51
    },
    {
      "invoice": null,
      "title": "План: 01.06.2028",
      "due_label": "01.06.2028",
      "due_date": "2028-06-01",
      "payment_date": null,
      "period_year": 2028,
      "period_month": 6,
      "schedule_usd": 950.07,
      "fact_usd": 950.07,
      "fact_uah": 40633.45,
      "rate": 42.7689,
      "meters": 29.92,
      "percent_increase": "0,87%",
      "raw_fact_uah": "40 633,45",
      "raw_fact_usd": "950,07",
      "status": "unpaid",
      "flags": {
        "early": false,
        "initial": false,
        "plan_only": true
      },
      "base_paid_usd": 0.0,
      "base_paid_uah": 0.0,
      "source_due_date": "2028-06-01",
      "exclude_from_summary": true,
      "id": 52
    },
    {
      "invoice": null,
      "title": "План: 01.07.2028",
      "due_label": "01.07.2028",
      "due_date": "2028-07-01",
      "payment_date": null,
      "period_year": 2028,
      "period_month": 7,
      "schedule_usd": 958.34,
      "fact_usd": 958.34,
      "fact_uah": 40987.15,
      "rate": 42.7689,
      "meters": 29.92,
      "percent_increase": "0,87%",
      "raw_fact_uah": "40 987,15",
      "raw_fact_usd": "958,34",
      "status": "unpaid",
      "flags": {
        "early": false,
        "initial": false,
        "plan_only": true
      },
      "base_paid_usd": 0.0,
      "base_paid_uah": 0.0,
      "source_due_date": "2028-07-01",
      "exclude_from_summary": true,
      "id": 53
    },
    {
      "invoice": null,
      "title": "План: 01.08.2028",
      "due_label": "01.08.2028",
      "due_date": "2028-08-01",
      "payment_date": null,
      "period_year": 2028,
      "period_month": 8,
      "schedule_usd": 966.68,
      "fact_usd": 966.68,
      "fact_uah": 41343.84,
      "rate": 42.7689,
      "meters": 29.92,
      "percent_increase": "0,87%",
      "raw_fact_uah": "41 343,84",
      "raw_fact_usd": "966,68",
      "status": "unpaid",
      "flags": {
        "early": false,
        "initial": false,
        "plan_only": true
      },
      "base_paid_usd": 0.0,
      "base_paid_uah": 0.0,
      "source_due_date": "2028-08-01",
      "exclude_from_summary": true,
      "id": 54
    },
    {
      "invoice": null,
      "title": "План: 01.09.2028",
      "due_label": "01.09.2028",
      "due_date": "2028-09-01",
      "payment_date": null,
      "period_year": 2028,
      "period_month": 9,
      "schedule_usd": 975.09,
      "fact_usd": 975.09,
      "fact_uah": 41703.53,
      "rate": 42.7689,
      "meters": 29.92,
      "percent_increase": "0,87%",
      "raw_fact_uah": "41 703,53",
      "raw_fact_usd": "975,09",
      "status": "unpaid",
      "flags": {
        "early": false,
        "initial": false,
        "plan_only": true
      },
      "base_paid_usd": 0.0,
      "base_paid_uah": 0.0,
      "source_due_date": "2028-09-01",
      "exclude_from_summary": true,
      "id": 55
    },
    {
      "invoice": null,
      "title": "План: 01.10.2028",
      "due_label": "01.10.2028",
      "due_date": "2028-10-01",
      "payment_date": null,
      "period_year": 2028,
      "period_month": 10,
      "schedule_usd": 983.57,
      "fact_usd": 983.57,
      "fact_uah": 42066.21,
      "rate": 42.7689,
      "meters": 29.92,
      "percent_increase": "0,87%",
      "raw_fact_uah": "42 066,21",
      "raw_fact_usd": "983,57",
      "status": "unpaid",
      "flags": {
        "early": false,
        "initial": false,
        "plan_only": true
      },
      "base_paid_usd": 0.0,
      "base_paid_uah": 0.0,
      "source_due_date": "2028-10-01",
      "exclude_from_summary": true,
      "id": 56
    },
    {
      "invoice": null,
      "title": "План: 01.11.2028",
      "due_label": "01.11.2028",
      "due_date": "2028-11-01",
      "payment_date": null,
      "period_year": 2028,
      "period_month": 11,
      "schedule_usd": 992.13,
      "fact_usd": 992.13,
      "fact_uah": 42432.31,
      "rate": 42.7689,
      "meters": 29.92,
      "percent_increase": "0,87%",
      "raw_fact_uah": "42 432,31",
      "raw_fact_usd": "992,13",
      "status": "unpaid",
      "flags": {
        "early": false,
        "initial": false,
        "plan_only": true
      },
      "base_paid_usd": 0.0,
      "base_paid_uah": 0.0,
      "source_due_date": "2028-11-01",
      "exclude_from_summary": true,
      "id": 57
    },
    {
      "invoice": null,
      "title": "План: 01.12.2028",
      "due_label": "01.12.2028",
      "due_date": "2028-12-01",
      "payment_date": null,
      "period_year": 2028,
      "period_month": 12,
      "schedule_usd": 1000.76,
      "fact_usd": 1000.76,
      "fact_uah": 42801.4,
      "rate": 42.7689,
      "meters": 29.92,
      "percent_increase": "0,87%",
      "raw_fact_uah": "42 801,40",
      "raw_fact_usd": "1 000,76",
      "status": "unpaid",
      "flags": {
        "early": false,
        "initial": false,
        "plan_only": true
      },
      "base_paid_usd": 0.0,
      "base_paid_uah": 0.0,
      "source_due_date": "2028-12-01",
      "exclude_from_summary": true,
      "id": 58
    },
    {
      "invoice": null,
      "title": "План: 01.01.2029",
      "due_label": "01.01.2029",
      "due_date": "2029-01-01",
      "payment_date": null,
      "period_year": 2029,
      "period_month": 1,
      "schedule_usd": 1009.47,
      "fact_usd": 1009.47,
      "fact_uah": 43173.92,
      "rate": 42.7689,
      "meters": 29.92,
      "percent_increase": "0,87%",
      "raw_fact_uah": "43 173,92",
      "raw_fact_usd": "1 009,47",
      "status": "unpaid",
      "flags": {
        "early": false,
        "initial": false,
        "plan_only": true
      },
      "base_paid_usd": 0.0,
      "base_paid_uah": 0.0,
      "source_due_date": "2029-01-01",
      "exclude_from_summary": true,
      "id": 59
    },
    {
      "invoice": null,
      "title": "План: 01.02.2029",
      "due_label": "01.02.2029",
      "due_date": "2029-02-01",
      "payment_date": null,
      "period_year": 2029,
      "period_month": 2,
      "schedule_usd": 1018.25,
      "fact_usd": 1018.25,
      "fact_uah": 43549.43,
      "rate": 42.7689,
      "meters": 29.92,
      "percent_increase": "0,87%",
      "raw_fact_uah": "43 549,43",
      "raw_fact_usd": "1 018,25",
      "status": "unpaid",
      "flags": {
        "early": false,
        "initial": false,
        "plan_only": true
      },
      "base_paid_usd": 0.0,
      "base_paid_uah": 0.0,
      "source_due_date": "2029-02-01",
      "exclude_from_summary": true,
      "id": 60
    },
    {
      "invoice": null,
      "title": "План: 01.03.2029",
      "due_label": "01.03.2029",
      "due_date": "2029-03-01",
      "payment_date": null,
      "period_year": 2029,
      "period_month": 3,
      "schedule_usd": 1027.11,
      "fact_usd": 1027.11,
      "fact_uah": 43928.36,
      "rate": 42.7689,
      "meters": 29.92,
      "percent_increase": "0,87%",
      "raw_fact_uah": "43 928,36",
      "raw_fact_usd": "1 027,11",
      "status": "unpaid",
      "flags": {
        "early": false,
        "initial": false,
        "plan_only": true
      },
      "base_paid_usd": 0.0,
      "base_paid_uah": 0.0,
      "source_due_date": "2029-03-01",
      "exclude_from_summary": true,
      "id": 61
    },
    {
      "invoice": null,
      "title": "План: 01.04.2029",
      "due_label": "01.04.2029",
      "due_date": "2029-04-01",
      "payment_date": null,
      "period_year": 2029,
      "period_month": 4,
      "schedule_usd": 1036.05,
      "fact_usd": 1036.05,
      "fact_uah": 44310.72,
      "rate": 42.7689,
      "meters": 29.92,
      "percent_increase": "0,87%",
      "raw_fact_uah": "44 310,72",
      "raw_fact_usd": "1 036,05",
      "status": "unpaid",
      "flags": {
        "early": false,
        "initial": false,
        "plan_only": true
      },
      "base_paid_usd": 0.0,
      "base_paid_uah": 0.0,
      "source_due_date": "2029-04-01",
      "exclude_from_summary": true,
      "id": 62
    },
    {
      "invoice": null,
      "title": "План: 01.05.2029",
      "due_label": "01.05.2029",
      "due_date": "2029-05-01",
      "payment_date": null,
      "period_year": 2029,
      "period_month": 5,
      "schedule_usd": 1045.06,
      "fact_usd": 1045.06,
      "fact_uah": 44696.07,
      "rate": 42.7689,
      "meters": 29.92,
      "percent_increase": "0,87%",
      "raw_fact_uah": "44 696,07",
      "raw_fact_usd": "1 045,06",
      "status": "unpaid",
      "flags": {
        "early": false,
        "initial": false,
        "plan_only": true
      },
      "base_paid_usd": 0.0,
      "base_paid_uah": 0.0,
      "source_due_date": "2029-05-01",
      "exclude_from_summary": true,
      "id": 63
    },
    {
      "invoice": null,
      "title": "План: 01.06.2029",
      "due_label": "01.06.2029",
      "due_date": "2029-06-01",
      "payment_date": null,
      "period_year": 2029,
      "period_month": 6,
      "schedule_usd": 1054.15,
      "fact_usd": 1054.15,
      "fact_uah": 45084.84,
      "rate": 42.7689,
      "meters": 29.92,
      "percent_increase": "0,87%",
      "raw_fact_uah": "45 084,84",
      "raw_fact_usd": "1 054,15",
      "status": "unpaid",
      "flags": {
        "early": false,
        "initial": false,
        "plan_only": true
      },
      "base_paid_usd": 0.0,
      "base_paid_uah": 0.0,
      "source_due_date": "2029-06-01",
      "exclude_from_summary": true,
      "id": 64
    },
    {
      "invoice": null,
      "title": "План: 01.07.2029",
      "due_label": "01.07.2029",
      "due_date": "2029-07-01",
      "payment_date": null,
      "period_year": 2029,
      "period_month": 7,
      "schedule_usd": 1063.32,
      "fact_usd": 1063.32,
      "fact_uah": 45477.03,
      "rate": 42.7689,
      "meters": 29.92,
      "percent_increase": "0,87%",
      "raw_fact_uah": "45 477,03",
      "raw_fact_usd": "1 063,32",
      "status": "unpaid",
      "flags": {
        "early": false,
        "initial": false,
        "plan_only": true
      },
      "base_paid_usd": 0.0,
      "base_paid_uah": 0.0,
      "source_due_date": "2029-07-01",
      "exclude_from_summary": true,
      "id": 65
    },
    {
      "invoice": null,
      "title": "План: 01.08.2029",
      "due_label": "01.08.2029",
      "due_date": "2029-08-01",
      "payment_date": null,
      "period_year": 2029,
      "period_month": 8,
      "schedule_usd": 1072.57,
      "fact_usd": 1072.57,
      "fact_uah": 45872.64,
      "rate": 42.7689,
      "meters": 29.92,
      "percent_increase": "0,87%",
      "raw_fact_uah": "45 872,64",
      "raw_fact_usd": "1 072,57",
      "status": "unpaid",
      "flags": {
        "early": false,
        "initial": false,
        "plan_only": true
      },
      "base_paid_usd": 0.0,
      "base_paid_uah": 0.0,
      "source_due_date": "2029-08-01",
      "exclude_from_summary": true,
      "id": 66
    },
    {
      "invoice": null,
      "title": "План: 01.09.2029",
      "due_label": "01.09.2029",
      "due_date": "2029-09-01",
      "payment_date": null,
      "period_year": 2029,
      "period_month": 9,
      "schedule_usd": 1081.9,
      "fact_usd": 1081.9,
      "fact_uah": 46271.67,
      "rate": 42.7689,
      "meters": 29.92,
      "percent_increase": "0,87%",
      "raw_fact_uah": "46 271,67",
      "raw_fact_usd": "1 081,90",
      "status": "unpaid",
      "flags": {
        "early": false,
        "initial": false,
        "plan_only": true
      },
      "base_paid_usd": 0.0,
      "base_paid_uah": 0.0,
      "source_due_date": "2029-09-01",
      "exclude_from_summary": true,
      "id": 67
    },
    {
      "invoice": null,
      "title": "План: 01.10.2029",
      "due_label": "01.10.2029",
      "due_date": "2029-10-01",
      "payment_date": null,
      "period_year": 2029,
      "period_month": 10,
      "schedule_usd": 1091.31,
      "fact_usd": 1091.31,
      "fact_uah": 46674.13,
      "rate": 42.7689,
      "meters": 29.92,
      "percent_increase": "0,87%",
      "raw_fact_uah": "46 674,13",
      "raw_fact_usd": "1 091,31",
      "status": "unpaid",
      "flags": {
        "early": false,
        "initial": false,
        "plan_only": true
      },
      "base_paid_usd": 0.0,
      "base_paid_uah": 0.0,
      "source_due_date": "2029-10-01",
      "exclude_from_summary": true,
      "id": 68
    },
    {
      "invoice": null,
      "title": "План: 01.11.2029",
      "due_label": "01.11.2029",
      "due_date": "2029-11-01",
      "payment_date": null,
      "period_year": 2029,
      "period_month": 11,
      "schedule_usd": 1100.8,
      "fact_usd": 1100.8,
      "fact_uah": 47080.01,
      "rate": 42.7689,
      "meters": 29.92,
      "percent_increase": "0,87%",
      "raw_fact_uah": "47 080,01",
      "raw_fact_usd": "1 100,80",
      "status": "unpaid",
      "flags": {
        "early": false,
        "initial": false,
        "plan_only": true
      },
      "base_paid_usd": 0.0,
      "base_paid_uah": 0.0,
      "source_due_date": "2029-11-01",
      "exclude_from_summary": true,
      "id": 69
    },
    {
      "invoice": null,
      "title": "План: 01.12.2029",
      "due_label": "01.12.2029",
      "due_date": "2029-12-01",
      "payment_date": null,
      "period_year": 2029,
      "period_month": 12,
      "schedule_usd": 1110.38,
      "fact_usd": null,
      "fact_uah": null,
      "rate": 41.2602,
      "meters": null,
      "percent_increase": "0,87%",
      "raw_fact_uah": "Достроково 30.08.2025",
      "raw_fact_usd": "Достроково 30.08.2025",
      "status": "early",
      "flags": {
        "early": true,
        "initial": false,
        "plan_only": true
      },
      "base_paid_usd": 0.0,
      "base_paid_uah": 0.0,
      "source_due_date": "2029-12-01",
      "exclude_from_summary": true,
      "id": 70
    },
    {
      "invoice": null,
      "title": "План: 01.01.2030",
      "due_label": "01.01.2030",
      "due_date": "2030-01-01",
      "payment_date": null,
      "period_year": 2030,
      "period_month": 1,
      "schedule_usd": 1120.04,
      "fact_usd": null,
      "fact_uah": null,
      "rate": 41.2602,
      "meters": null,
      "percent_increase": "0,87%",
      "raw_fact_uah": "Достроково 30.08.2025",
      "raw_fact_usd": "Достроково 30.08.2025",
      "status": "early",
      "flags": {
        "early": true,
        "initial": false,
        "plan_only": true
      },
      "base_paid_usd": 0.0,
      "base_paid_uah": 0.0,
      "source_due_date": "2030-01-01",
      "exclude_from_summary": true,
      "id": 71
    },
    {
      "invoice": null,
      "title": "План: 01.02.2030",
      "due_label": "01.02.2030",
      "due_date": "2030-02-01",
      "payment_date": null,
      "period_year": 2030,
      "period_month": 2,
      "schedule_usd": 1129.78,
      "fact_usd": null,
      "fact_uah": null,
      "rate": 41.2602,
      "meters": null,
      "percent_increase": "0,87%",
      "raw_fact_uah": "Достроково 30.08.2025",
      "raw_fact_usd": "Достроково 30.08.2025",
      "status": "early",
      "flags": {
        "early": true,
        "initial": false,
        "plan_only": true
      },
      "base_paid_usd": 0.0,
      "base_paid_uah": 0.0,
      "source_due_date": "2030-02-01",
      "exclude_from_summary": true,
      "id": 72
    },
    {
      "invoice": null,
      "title": "План: 01.03.2030",
      "due_label": "01.03.2030",
      "due_date": "2030-03-01",
      "payment_date": null,
      "period_year": 2030,
      "period_month": 3,
      "schedule_usd": 1139.61,
      "fact_usd": null,
      "fact_uah": null,
      "rate": 41.2602,
      "meters": null,
      "percent_increase": "0,87%",
      "raw_fact_uah": "Достроково 30.08.2025",
      "raw_fact_usd": "Достроково 30.08.2025",
      "status": "early",
      "flags": {
        "early": true,
        "initial": false,
        "plan_only": true
      },
      "base_paid_usd": 0.0,
      "base_paid_uah": 0.0,
      "source_due_date": "2030-03-01",
      "exclude_from_summary": true,
      "id": 73
    },
    {
      "invoice": null,
      "title": "План: 01.04.2030",
      "due_label": "01.04.2030",
      "due_date": "2030-04-01",
      "payment_date": null,
      "period_year": 2030,
      "period_month": 4,
      "schedule_usd": 1149.52,
      "fact_usd": null,
      "fact_uah": null,
      "rate": 41.2602,
      "meters": null,
      "percent_increase": "0,87%",
      "raw_fact_uah": "Достроково 30.08.2025",
      "raw_fact_usd": "Достроково 30.08.2025",
      "status": "early",
      "flags": {
        "early": true,
        "initial": false,
        "plan_only": true
      },
      "base_paid_usd": 0.0,
      "base_paid_uah": 0.0,
      "source_due_date": "2030-04-01",
      "exclude_from_summary": true,
      "id": 74
    },
    {
      "invoice": null,
      "title": "План: 01.05.2030",
      "due_label": "01.05.2030",
      "due_date": "2030-05-01",
      "payment_date": null,
      "period_year": 2030,
      "period_month": 5,
      "schedule_usd": 1159.52,
      "fact_usd": null,
      "fact_uah": null,
      "rate": 41.5285,
      "meters": null,
      "percent_increase": "0,87%",
      "raw_fact_uah": "Достроково 30.05.2025",
      "raw_fact_usd": "Достроково 30.05.2025",
      "status": "early",
      "flags": {
        "early": true,
        "initial": false,
        "plan_only": true
      },
      "base_paid_usd": 0.0,
      "base_paid_uah": 0.0,
      "source_due_date": "2030-05-01",
      "exclude_from_summary": true,
      "id": 75
    }
  ],
  "summary_basis": "summary excludes rows where exclude_from_summary=true"
};
