{
  "project_key": "respublika1",
  "project_name": "Республіка 1",
  "apartment": "OWNER-R1 (ANON): act + 30408-287 (2025+)",
  "source_pdf": "SRC-R1-ACT-RECONCILIATION.pdf",
  "source_pdf_future": "SRC-R1-30408-287-RECONCILIATION.pdf",
  "generated_at": "2026-02-21T18:12:30",
  "summary_basis": "summary excludes rows where exclude_from_summary=true",
  "summary": {
    "total": {
      "schedule_usd": 97388.39,
      "fact_uah": 3998899.71,
      "fact_usd": 97388.39,
      "meters": null
    },
    "paid": {
      "schedule_usd": 94844.45,
      "fact_uah": 3717654.1,
      "fact_usd": 94844.45,
      "meters": null
    },
    "remaining": {
      "schedule_usd": 2543.94,
      "fact_uah": 281245.61,
      "fact_usd": 2543.94,
      "meters": null
    }
  },
  "payments": [
    {
      "title": "Факт #1 (ч.1)",
      "due_label": "31.12.2021",
      "due_date": "2021-12-30",
      "payment_date": "2021-12-30",
      "period_year": 2021,
      "period_month": 12,
      "schedule_usd": 8579.16,
      "fact_usd": 8579.16,
      "fact_uah": 233554.85,
      "rate": 27.2235,
      "meters": 2.028386,
      "percent_increase": "10,00%",
      "raw_fact_uah": "257 393,95",
      "raw_fact_usd": "9 432,04",
      "status": "paid",
      "flags": {
        "early": false,
        "initial": true,
        "source": "act"
      },
      "base_paid_usd": 8579.16,
      "base_paid_uah": 233554.85,
      "exclude_from_summary": false,
      "month_index": 1,
      "id": 0
    },
    {
      "title": "Факт #1 (ч.2)",
      "due_label": "31.12.2021",
      "due_date": "2022-01-17",
      "payment_date": "2022-01-17",
      "period_year": 2022,
      "period_month": 1,
      "schedule_usd": 852.88,
      "fact_usd": 852.88,
      "fact_uah": 23839.1,
      "rate": 27.9514,
      "meters": 2.028386,
      "percent_increase": "10,00%",
      "raw_fact_uah": "257 393,95",
      "raw_fact_usd": "9 432,04",
      "status": "paid",
      "flags": {
        "early": false,
        "initial": true,
        "source": "act"
      },
      "base_paid_usd": 852.88,
      "base_paid_uah": 23839.1,
      "exclude_from_summary": false,
      "month_index": 2,
      "id": 1
    },
    {
      "title": "Факт #2 (ч.1)",
      "due_label": "30.01.2022",
      "due_date": "2022-02-14",
      "payment_date": "2022-02-14",
      "period_year": 2022,
      "period_month": 2,
      "schedule_usd": 867.74,
      "fact_usd": 867.74,
      "fact_uah": 24326.86,
      "rate": 28.0346,
      "meters": 0.37109,
      "percent_increase": "1,00%",
      "raw_fact_uah": "54 522,33",
      "raw_fact_usd": "1 725,57",
      "status": "paid",
      "flags": {
        "early": false,
        "initial": false,
        "source": "act"
      },
      "base_paid_usd": 867.74,
      "base_paid_uah": 24326.86,
      "exclude_from_summary": false,
      "month_index": 3,
      "id": 2
    },
    {
      "title": "Нульовий місяць 03.2022",
      "due_label": "01.03.2022",
      "due_date": "2022-03-01",
      "payment_date": null,
      "period_year": 2022,
      "period_month": 3,
      "schedule_usd": 0.0,
      "fact_usd": null,
      "fact_uah": null,
      "rate": null,
      "meters": null,
      "percent_increase": "0,00%",
      "raw_fact_uah": null,
      "raw_fact_usd": null,
      "status": "unpaid",
      "flags": {
        "early": false,
        "initial": false,
        "zero_month": true,
        "source": "auto"
      },
      "base_paid_usd": 0.0,
      "base_paid_uah": 0.0,
      "exclude_from_summary": true,
      "month_index": 4,
      "id": 3
    },
    {
      "title": "Нульовий місяць 04.2022",
      "due_label": "01.04.2022",
      "due_date": "2022-04-01",
      "payment_date": null,
      "period_year": 2022,
      "period_month": 4,
      "schedule_usd": 0.0,
      "fact_usd": null,
      "fact_uah": null,
      "rate": null,
      "meters": null,
      "percent_increase": "0,00%",
      "raw_fact_uah": null,
      "raw_fact_usd": null,
      "status": "unpaid",
      "flags": {
        "early": false,
        "initial": false,
        "zero_month": true,
        "source": "auto"
      },
      "base_paid_usd": 0.0,
      "base_paid_uah": 0.0,
      "exclude_from_summary": true,
      "month_index": 5,
      "id": 4
    },
    {
      "title": "Нульовий місяць 05.2022",
      "due_label": "01.05.2022",
      "due_date": "2022-05-01",
      "payment_date": null,
      "period_year": 2022,
      "period_month": 5,
      "schedule_usd": 0.0,
      "fact_usd": null,
      "fact_uah": null,
      "rate": null,
      "meters": null,
      "percent_increase": "0,00%",
      "raw_fact_uah": null,
      "raw_fact_usd": null,
      "status": "unpaid",
      "flags": {
        "early": false,
        "initial": false,
        "zero_month": true,
        "source": "auto"
      },
      "base_paid_usd": 0.0,
      "base_paid_uah": 0.0,
      "exclude_from_summary": true,
      "month_index": 6,
      "id": 5
    },
    {
      "title": "Факт #2 (ч.2)",
      "due_label": "30.01.2022",
      "due_date": "2022-06-28",
      "payment_date": "2022-06-28",
      "period_year": 2022,
      "period_month": 6,
      "schedule_usd": 857.83,
      "fact_usd": 857.83,
      "fact_uah": 30195.47,
      "rate": 35.2,
      "meters": 0.37109,
      "percent_increase": "1,00%",
      "raw_fact_uah": "54 522,33",
      "raw_fact_usd": "1 725,57",
      "status": "paid",
      "flags": {
        "early": false,
        "initial": false,
        "source": "act"
      },
      "base_paid_usd": 857.83,
      "base_paid_uah": 30195.47,
      "exclude_from_summary": false,
      "month_index": 7,
      "id": 6
    },
    {
      "title": "Факт #4",
      "due_label": "30.03.2022",
      "due_date": "2022-07-22",
      "payment_date": "2022-07-22",
      "period_year": 2022,
      "period_month": 7,
      "schedule_usd": 830.05,
      "fact_usd": 830.05,
      "fact_uah": 30711.73,
      "rate": 37.0,
      "meters": 0.357009,
      "percent_increase": "1,00%",
      "raw_fact_uah": "30 711,73",
      "raw_fact_usd": "830,05",
      "status": "paid",
      "flags": {
        "early": false,
        "initial": false,
        "source": "act"
      },
      "base_paid_usd": 830.05,
      "base_paid_uah": 30711.73,
      "exclude_from_summary": false,
      "month_index": 8,
      "id": 7
    },
    {
      "title": "Нульовий місяць 08.2022",
      "due_label": "01.08.2022",
      "due_date": "2022-08-01",
      "payment_date": null,
      "period_year": 2022,
      "period_month": 8,
      "schedule_usd": 0.0,
      "fact_usd": null,
      "fact_uah": null,
      "rate": null,
      "meters": null,
      "percent_increase": "0,00%",
      "raw_fact_uah": null,
      "raw_fact_usd": null,
      "status": "unpaid",
      "flags": {
        "early": false,
        "initial": false,
        "zero_month": true,
        "source": "auto"
      },
      "base_paid_usd": 0.0,
      "base_paid_uah": 0.0,
      "exclude_from_summary": true,
      "month_index": 9,
      "id": 8
    },
    {
      "title": "Нульовий місяць 09.2022",
      "due_label": "01.09.2022",
      "due_date": "2022-09-01",
      "payment_date": null,
      "period_year": 2022,
      "period_month": 9,
      "schedule_usd": 0.0,
      "fact_usd": null,
      "fact_uah": null,
      "rate": null,
      "meters": null,
      "percent_increase": "0,00%",
      "raw_fact_uah": null,
      "raw_fact_usd": null,
      "status": "unpaid",
      "flags": {
        "early": false,
        "initial": false,
        "zero_month": true,
        "source": "auto"
      },
      "base_paid_usd": 0.0,
      "base_paid_uah": 0.0,
      "exclude_from_summary": true,
      "month_index": 10,
      "id": 9
    },
    {
      "title": "Нульовий місяць 10.2022",
      "due_label": "01.10.2022",
      "due_date": "2022-10-01",
      "payment_date": null,
      "period_year": 2022,
      "period_month": 10,
      "schedule_usd": 0.0,
      "fact_usd": null,
      "fact_uah": null,
      "rate": null,
      "meters": null,
      "percent_increase": "0,00%",
      "raw_fact_uah": null,
      "raw_fact_usd": null,
      "status": "unpaid",
      "flags": {
        "early": false,
        "initial": false,
        "zero_month": true,
        "source": "auto"
      },
      "base_paid_usd": 0.0,
      "base_paid_uah": 0.0,
      "exclude_from_summary": true,
      "month_index": 11,
      "id": 10
    },
    {
      "title": "Нульовий місяць 11.2022",
      "due_label": "01.11.2022",
      "due_date": "2022-11-01",
      "payment_date": null,
      "period_year": 2022,
      "period_month": 11,
      "schedule_usd": 0.0,
      "fact_usd": null,
      "fact_uah": null,
      "rate": null,
      "meters": null,
      "percent_increase": "0,00%",
      "raw_fact_uah": null,
      "raw_fact_usd": null,
      "status": "unpaid",
      "flags": {
        "early": false,
        "initial": false,
        "zero_month": true,
        "source": "auto"
      },
      "base_paid_usd": 0.0,
      "base_paid_uah": 0.0,
      "exclude_from_summary": true,
      "month_index": 12,
      "id": 11
    },
    {
      "title": "Нульовий місяць 12.2022",
      "due_label": "01.12.2022",
      "due_date": "2022-12-01",
      "payment_date": null,
      "period_year": 2022,
      "period_month": 12,
      "schedule_usd": 0.0,
      "fact_usd": null,
      "fact_uah": null,
      "rate": null,
      "meters": null,
      "percent_increase": "0,00%",
      "raw_fact_uah": null,
      "raw_fact_usd": null,
      "status": "unpaid",
      "flags": {
        "early": false,
        "initial": false,
        "zero_month": true,
        "source": "auto"
      },
      "base_paid_usd": 0.0,
      "base_paid_uah": 0.0,
      "exclude_from_summary": true,
      "month_index": 13,
      "id": 12
    },
    {
      "title": "Нульовий місяць 01.2023",
      "due_label": "01.01.2023",
      "due_date": "2023-01-01",
      "payment_date": null,
      "period_year": 2023,
      "period_month": 1,
      "schedule_usd": 0.0,
      "fact_usd": null,
      "fact_uah": null,
      "rate": null,
      "meters": null,
      "percent_increase": "0,00%",
      "raw_fact_uah": null,
      "raw_fact_usd": null,
      "status": "unpaid",
      "flags": {
        "early": false,
        "initial": false,
        "zero_month": true,
        "source": "auto"
      },
      "base_paid_usd": 0.0,
      "base_paid_uah": 0.0,
      "exclude_from_summary": true,
      "month_index": 14,
      "id": 13
    },
    {
      "title": "Нульовий місяць 02.2023",
      "due_label": "01.02.2023",
      "due_date": "2023-02-01",
      "payment_date": null,
      "period_year": 2023,
      "period_month": 2,
      "schedule_usd": 0.0,
      "fact_usd": null,
      "fact_uah": null,
      "rate": null,
      "meters": null,
      "percent_increase": "0,00%",
      "raw_fact_uah": null,
      "raw_fact_usd": null,
      "status": "unpaid",
      "flags": {
        "early": false,
        "initial": false,
        "zero_month": true,
        "source": "auto"
      },
      "base_paid_usd": 0.0,
      "base_paid_uah": 0.0,
      "exclude_from_summary": true,
      "month_index": 15,
      "id": 14
    },
    {
      "title": "Нульовий місяць 03.2023",
      "due_label": "01.03.2023",
      "due_date": "2023-03-01",
      "payment_date": null,
      "period_year": 2023,
      "period_month": 3,
      "schedule_usd": 0.0,
      "fact_usd": null,
      "fact_uah": null,
      "rate": null,
      "meters": null,
      "percent_increase": "0,00%",
      "raw_fact_uah": null,
      "raw_fact_usd": null,
      "status": "unpaid",
      "flags": {
        "early": false,
        "initial": false,
        "zero_month": true,
        "source": "auto"
      },
      "base_paid_usd": 0.0,
      "base_paid_uah": 0.0,
      "exclude_from_summary": true,
      "month_index": 16,
      "id": 15
    },
    {
      "title": "Нульовий місяць 04.2023",
      "due_label": "01.04.2023",
      "due_date": "2023-04-01",
      "payment_date": null,
      "period_year": 2023,
      "period_month": 4,
      "schedule_usd": 0.0,
      "fact_usd": null,
      "fact_uah": null,
      "rate": null,
      "meters": null,
      "percent_increase": "0,00%",
      "raw_fact_uah": null,
      "raw_fact_usd": null,
      "status": "unpaid",
      "flags": {
        "early": false,
        "initial": false,
        "zero_month": true,
        "source": "auto"
      },
      "base_paid_usd": 0.0,
      "base_paid_uah": 0.0,
      "exclude_from_summary": true,
      "month_index": 17,
      "id": 16
    },
    {
      "title": "Нульовий місяць 05.2023",
      "due_label": "01.05.2023",
      "due_date": "2023-05-01",
      "payment_date": null,
      "period_year": 2023,
      "period_month": 5,
      "schedule_usd": 0.0,
      "fact_usd": null,
      "fact_uah": null,
      "rate": null,
      "meters": null,
      "percent_increase": "0,00%",
      "raw_fact_uah": null,
      "raw_fact_usd": null,
      "status": "unpaid",
      "flags": {
        "early": false,
        "initial": false,
        "zero_month": true,
        "source": "auto"
      },
      "base_paid_usd": 0.0,
      "base_paid_uah": 0.0,
      "exclude_from_summary": true,
      "month_index": 18,
      "id": 17
    },
    {
      "title": "Нульовий місяць 06.2023",
      "due_label": "01.06.2023",
      "due_date": "2023-06-01",
      "payment_date": null,
      "period_year": 2023,
      "period_month": 6,
      "schedule_usd": 0.0,
      "fact_usd": null,
      "fact_uah": null,
      "rate": null,
      "meters": null,
      "percent_increase": "0,00%",
      "raw_fact_uah": null,
      "raw_fact_usd": null,
      "status": "unpaid",
      "flags": {
        "early": false,
        "initial": false,
        "zero_month": true,
        "source": "auto"
      },
      "base_paid_usd": 0.0,
      "base_paid_uah": 0.0,
      "exclude_from_summary": true,
      "month_index": 19,
      "id": 18
    },
    {
      "title": "Факт #5",
      "due_label": "29.04.2022",
      "due_date": "2023-07-30",
      "payment_date": "2023-07-30",
      "period_year": 2023,
      "period_month": 7,
      "schedule_usd": 997.28,
      "fact_usd": 997.28,
      "fact_uah": 36700.0,
      "rate": 36.8,
      "meters": 0.428939,
      "percent_increase": "1,00%",
      "raw_fact_uah": "36 700,00",
      "raw_fact_usd": "997,28",
      "status": "paid",
      "flags": {
        "early": false,
        "initial": false,
        "source": "act"
      },
      "base_paid_usd": 997.28,
      "base_paid_uah": 36700.0,
      "exclude_from_summary": false,
      "month_index": 20,
      "id": 19
    },
    {
      "title": "Факт #7",
      "due_label": "28.06.2022",
      "due_date": "2023-08-31",
      "payment_date": "2023-08-31",
      "period_year": 2023,
      "period_month": 8,
      "schedule_usd": 1006.67,
      "fact_usd": 1006.67,
      "fact_uah": 37750.0,
      "rate": 37.5,
      "meters": 0.432972,
      "percent_increase": "1,00%",
      "raw_fact_uah": "37 750,00",
      "raw_fact_usd": "1 006,67",
      "status": "paid",
      "flags": {
        "early": false,
        "initial": false,
        "source": "act"
      },
      "base_paid_usd": 1006.67,
      "base_paid_uah": 37750.0,
      "exclude_from_summary": false,
      "month_index": 21,
      "id": 20
    },
    {
      "title": "Факт #8",
      "due_label": "28.07.2022",
      "due_date": "2023-09-26",
      "payment_date": "2023-09-26",
      "period_year": 2023,
      "period_month": 9,
      "schedule_usd": 1013.3,
      "fact_usd": 1013.3,
      "fact_uah": 38100.0,
      "rate": 37.6,
      "meters": 0.435822,
      "percent_increase": "1,00%",
      "raw_fact_uah": "38 100,00",
      "raw_fact_usd": "1 013,30",
      "status": "paid",
      "flags": {
        "early": false,
        "initial": false,
        "source": "act"
      },
      "base_paid_usd": 1013.3,
      "base_paid_uah": 38100.0,
      "exclude_from_summary": false,
      "month_index": 22,
      "id": 21
    },
    {
      "title": "Факт #9",
      "due_label": "27.08.2022",
      "due_date": "2023-10-27",
      "payment_date": "2023-10-27",
      "period_year": 2023,
      "period_month": 10,
      "schedule_usd": 1000.0,
      "fact_usd": 1000.0,
      "fact_uah": 37500.0,
      "rate": 37.5,
      "meters": 0.430105,
      "percent_increase": "1,00%",
      "raw_fact_uah": "37 500,00",
      "raw_fact_usd": "1 000,00",
      "status": "paid",
      "flags": {
        "early": false,
        "initial": false,
        "source": "act"
      },
      "base_paid_usd": 1000.0,
      "base_paid_uah": 37500.0,
      "exclude_from_summary": false,
      "month_index": 23,
      "id": 22
    },
    {
      "title": "Факт #10 (ч.1)",
      "due_label": "26.09.2022",
      "due_date": "2023-11-22",
      "payment_date": "2023-11-22",
      "period_year": 2023,
      "period_month": 11,
      "schedule_usd": 14919.08,
      "fact_usd": 14919.08,
      "fact_uah": 554989.7,
      "rate": 37.2,
      "meters": 3.579178,
      "percent_increase": "1,00%",
      "raw_fact_uah": "620 850,78",
      "raw_fact_usd": "16 643,19",
      "status": "paid",
      "flags": {
        "early": false,
        "initial": false,
        "source": "act"
      },
      "base_paid_usd": 14919.08,
      "base_paid_uah": 554989.7,
      "exclude_from_summary": false,
      "month_index": 24,
      "id": 23
    },
    {
      "title": "Факт #10 (ч.2)",
      "due_label": "26.09.2022",
      "due_date": "2023-12-29",
      "payment_date": "2023-12-29",
      "period_year": 2023,
      "period_month": 12,
      "schedule_usd": 1724.11,
      "fact_usd": 1724.11,
      "fact_uah": 65861.08,
      "rate": 38.2,
      "meters": 3.579178,
      "percent_increase": "1,00%",
      "raw_fact_uah": "620 850,78",
      "raw_fact_usd": "16 643,19",
      "status": "paid",
      "flags": {
        "early": false,
        "initial": false,
        "source": "act"
      },
      "base_paid_usd": 1724.11,
      "base_paid_uah": 65861.08,
      "exclude_from_summary": false,
      "month_index": 25,
      "id": 24
    },
    {
      "title": "Факт #21",
      "due_label": "22.08.2023",
      "due_date": "2024-01-27",
      "payment_date": "2024-01-27",
      "period_year": 2024,
      "period_month": 1,
      "schedule_usd": 2583.63,
      "fact_usd": 2583.63,
      "fact_uah": 97532.06,
      "rate": 37.75,
      "meters": 1.111236,
      "percent_increase": "3,00%",
      "raw_fact_uah": "97 532,06",
      "raw_fact_usd": "2 583,63",
      "status": "paid",
      "flags": {
        "early": false,
        "initial": false,
        "source": "act"
      },
      "base_paid_usd": 2583.63,
      "base_paid_uah": 97532.06,
      "exclude_from_summary": false,
      "month_index": 26,
      "id": 25
    },
    {
      "title": "Факт #22",
      "due_label": "21.09.2023",
      "due_date": "2024-02-29",
      "payment_date": "2024-02-29",
      "period_year": 2024,
      "period_month": 2,
      "schedule_usd": 3140.73,
      "fact_usd": 3140.73,
      "fact_uah": 120000.0,
      "rate": 38.2077,
      "meters": 1.350849,
      "percent_increase": "3,00%",
      "raw_fact_uah": "120 000,00",
      "raw_fact_usd": "3 140,73",
      "status": "paid",
      "flags": {
        "early": false,
        "initial": false,
        "source": "act"
      },
      "base_paid_usd": 3140.73,
      "base_paid_uah": 120000.0,
      "exclude_from_summary": false,
      "month_index": 27,
      "id": 26
    },
    {
      "title": "Факт #24",
      "due_label": "20.11.2023",
      "due_date": "2024-03-14",
      "payment_date": "2024-03-14",
      "period_year": 2024,
      "period_month": 3,
      "schedule_usd": 3300.01,
      "fact_usd": 3300.01,
      "fact_uah": 128000.0,
      "rate": 38.7878,
      "meters": 1.419352,
      "percent_increase": "3,00%",
      "raw_fact_uah": "128 000,00",
      "raw_fact_usd": "3 300,01",
      "status": "paid",
      "flags": {
        "early": false,
        "initial": false,
        "source": "act"
      },
      "base_paid_usd": 3300.01,
      "base_paid_uah": 128000.0,
      "exclude_from_summary": false,
      "month_index": 28,
      "id": 27
    },
    {
      "title": "Факт #25",
      "due_label": "20.12.2023",
      "due_date": "2024-03-29",
      "payment_date": "2024-03-29",
      "period_year": 2024,
      "period_month": 3,
      "schedule_usd": 1223.9,
      "fact_usd": 1223.9,
      "fact_uah": 48003.24,
      "rate": 39.2214,
      "meters": 0.526409,
      "percent_increase": "3,00%",
      "raw_fact_uah": "48 003,24",
      "raw_fact_usd": "1 223,90",
      "status": "paid",
      "flags": {
        "early": false,
        "initial": false,
        "source": "act"
      },
      "base_paid_usd": 1223.9,
      "base_paid_uah": 48003.24,
      "exclude_from_summary": false,
      "month_index": 28,
      "id": 28
    },
    {
      "title": "Нульовий місяць 04.2024",
      "due_label": "01.04.2024",
      "due_date": "2024-04-01",
      "payment_date": null,
      "period_year": 2024,
      "period_month": 4,
      "schedule_usd": 0.0,
      "fact_usd": null,
      "fact_uah": null,
      "rate": null,
      "meters": null,
      "percent_increase": "0,00%",
      "raw_fact_uah": null,
      "raw_fact_usd": null,
      "status": "unpaid",
      "flags": {
        "early": false,
        "initial": false,
        "zero_month": true,
        "source": "auto"
      },
      "base_paid_usd": 0.0,
      "base_paid_uah": 0.0,
      "exclude_from_summary": true,
      "month_index": 29,
      "id": 29
    },
    {
      "title": "Нульовий місяць 05.2024",
      "due_label": "01.05.2024",
      "due_date": "2024-05-01",
      "payment_date": null,
      "period_year": 2024,
      "period_month": 5,
      "schedule_usd": 0.0,
      "fact_usd": null,
      "fact_uah": null,
      "rate": null,
      "meters": null,
      "percent_increase": "0,00%",
      "raw_fact_uah": null,
      "raw_fact_usd": null,
      "status": "unpaid",
      "flags": {
        "early": false,
        "initial": false,
        "zero_month": true,
        "source": "auto"
      },
      "base_paid_usd": 0.0,
      "base_paid_uah": 0.0,
      "exclude_from_summary": true,
      "month_index": 30,
      "id": 30
    },
    {
      "title": "Нульовий місяць 06.2024",
      "due_label": "01.06.2024",
      "due_date": "2024-06-01",
      "payment_date": null,
      "period_year": 2024,
      "period_month": 6,
      "schedule_usd": 0.0,
      "fact_usd": null,
      "fact_uah": null,
      "rate": null,
      "meters": null,
      "percent_increase": "0,00%",
      "raw_fact_uah": null,
      "raw_fact_usd": null,
      "status": "unpaid",
      "flags": {
        "early": false,
        "initial": false,
        "zero_month": true,
        "source": "auto"
      },
      "base_paid_usd": 0.0,
      "base_paid_uah": 0.0,
      "exclude_from_summary": true,
      "month_index": 31,
      "id": 31
    },
    {
      "title": "Нульовий місяць 07.2024",
      "due_label": "01.07.2024",
      "due_date": "2024-07-01",
      "payment_date": null,
      "period_year": 2024,
      "period_month": 7,
      "schedule_usd": 0.0,
      "fact_usd": null,
      "fact_uah": null,
      "rate": null,
      "meters": null,
      "percent_increase": "0,00%",
      "raw_fact_uah": null,
      "raw_fact_usd": null,
      "status": "unpaid",
      "flags": {
        "early": false,
        "initial": false,
        "zero_month": true,
        "source": "auto"
      },
      "base_paid_usd": 0.0,
      "base_paid_uah": 0.0,
      "exclude_from_summary": true,
      "month_index": 32,
      "id": 32
    },
    {
      "title": "Нульовий місяць 08.2024",
      "due_label": "01.08.2024",
      "due_date": "2024-08-01",
      "payment_date": null,
      "period_year": 2024,
      "period_month": 8,
      "schedule_usd": 0.0,
      "fact_usd": null,
      "fact_uah": null,
      "rate": null,
      "meters": null,
      "percent_increase": "0,00%",
      "raw_fact_uah": null,
      "raw_fact_usd": null,
      "status": "unpaid",
      "flags": {
        "early": false,
        "initial": false,
        "zero_month": true,
        "source": "auto"
      },
      "base_paid_usd": 0.0,
      "base_paid_uah": 0.0,
      "exclude_from_summary": true,
      "month_index": 33,
      "id": 33
    },
    {
      "title": "Нульовий місяць 09.2024",
      "due_label": "01.09.2024",
      "due_date": "2024-09-01",
      "payment_date": null,
      "period_year": 2024,
      "period_month": 9,
      "schedule_usd": 0.0,
      "fact_usd": null,
      "fact_uah": null,
      "rate": null,
      "meters": null,
      "percent_increase": "0,00%",
      "raw_fact_uah": null,
      "raw_fact_usd": null,
      "status": "unpaid",
      "flags": {
        "early": false,
        "initial": false,
        "zero_month": true,
        "source": "auto"
      },
      "base_paid_usd": 0.0,
      "base_paid_uah": 0.0,
      "exclude_from_summary": true,
      "month_index": 34,
      "id": 34
    },
    {
      "title": "Нульовий місяць 10.2024",
      "due_label": "01.10.2024",
      "due_date": "2024-10-01",
      "payment_date": null,
      "period_year": 2024,
      "period_month": 10,
      "schedule_usd": 0.0,
      "fact_usd": null,
      "fact_uah": null,
      "rate": null,
      "meters": null,
      "percent_increase": "0,00%",
      "raw_fact_uah": null,
      "raw_fact_usd": null,
      "status": "unpaid",
      "flags": {
        "early": false,
        "initial": false,
        "zero_month": true,
        "source": "auto"
      },
      "base_paid_usd": 0.0,
      "base_paid_uah": 0.0,
      "exclude_from_summary": true,
      "month_index": 35,
      "id": 35
    },
    {
      "title": "Нульовий місяць 11.2024",
      "due_label": "01.11.2024",
      "due_date": "2024-11-01",
      "payment_date": null,
      "period_year": 2024,
      "period_month": 11,
      "schedule_usd": 0.0,
      "fact_usd": null,
      "fact_uah": null,
      "rate": null,
      "meters": null,
      "percent_increase": "0,00%",
      "raw_fact_uah": null,
      "raw_fact_usd": null,
      "status": "unpaid",
      "flags": {
        "early": false,
        "initial": false,
        "zero_month": true,
        "source": "auto"
      },
      "base_paid_usd": 0.0,
      "base_paid_uah": 0.0,
      "exclude_from_summary": true,
      "month_index": 36,
      "id": 36
    },
    {
      "title": "Нульовий місяць 12.2024",
      "due_label": "01.12.2024",
      "due_date": "2024-12-01",
      "payment_date": null,
      "period_year": 2024,
      "period_month": 12,
      "schedule_usd": 0.0,
      "fact_usd": null,
      "fact_uah": null,
      "rate": null,
      "meters": null,
      "percent_increase": "0,00%",
      "raw_fact_uah": null,
      "raw_fact_usd": null,
      "status": "unpaid",
      "flags": {
        "early": false,
        "initial": false,
        "zero_month": true,
        "source": "auto"
      },
      "base_paid_usd": 0.0,
      "base_paid_uah": 0.0,
      "exclude_from_summary": true,
      "month_index": 37,
      "id": 37
    },
    {
      "title": "Нульовий місяць 01.2025",
      "due_label": "01.01.2025",
      "due_date": "2025-01-01",
      "payment_date": null,
      "period_year": 2025,
      "period_month": 1,
      "schedule_usd": 0.0,
      "fact_usd": null,
      "fact_uah": null,
      "rate": null,
      "meters": null,
      "percent_increase": "0,00%",
      "raw_fact_uah": null,
      "raw_fact_usd": null,
      "status": "unpaid",
      "flags": {
        "early": false,
        "initial": false,
        "zero_month": true,
        "source": "auto"
      },
      "base_paid_usd": 0.0,
      "base_paid_uah": 0.0,
      "exclude_from_summary": true,
      "month_index": 38,
      "id": 38
    },
    {
      "title": "Нульовий місяць 02.2025",
      "due_label": "01.02.2025",
      "due_date": "2025-02-01",
      "payment_date": null,
      "period_year": 2025,
      "period_month": 2,
      "schedule_usd": 0.0,
      "fact_usd": null,
      "fact_uah": null,
      "rate": null,
      "meters": null,
      "percent_increase": "0,00%",
      "raw_fact_uah": null,
      "raw_fact_usd": null,
      "status": "unpaid",
      "flags": {
        "early": false,
        "initial": false,
        "zero_month": true,
        "source": "auto"
      },
      "base_paid_usd": 0.0,
      "base_paid_uah": 0.0,
      "exclude_from_summary": true,
      "month_index": 39,
      "id": 39
    },
    {
      "title": "Нульовий місяць 03.2025",
      "due_label": "01.03.2025",
      "due_date": "2025-03-01",
      "payment_date": null,
      "period_year": 2025,
      "period_month": 3,
      "schedule_usd": 0.0,
      "fact_usd": null,
      "fact_uah": null,
      "rate": null,
      "meters": null,
      "percent_increase": "0,00%",
      "raw_fact_uah": null,
      "raw_fact_usd": null,
      "status": "unpaid",
      "flags": {
        "early": false,
        "initial": false,
        "zero_month": true,
        "source": "auto"
      },
      "base_paid_usd": 0.0,
      "base_paid_uah": 0.0,
      "exclude_from_summary": true,
      "month_index": 40,
      "id": 40
    },
    {
      "title": "Нульовий місяць 04.2025",
      "due_label": "01.04.2025",
      "due_date": "2025-04-01",
      "payment_date": null,
      "period_year": 2025,
      "period_month": 4,
      "schedule_usd": 0.0,
      "fact_usd": null,
      "fact_uah": null,
      "rate": null,
      "meters": null,
      "percent_increase": "0,00%",
      "raw_fact_uah": null,
      "raw_fact_usd": null,
      "status": "unpaid",
      "flags": {
        "early": false,
        "initial": false,
        "zero_month": true,
        "source": "auto"
      },
      "base_paid_usd": 0.0,
      "base_paid_uah": 0.0,
      "exclude_from_summary": true,
      "month_index": 41,
      "id": 41
    },
    {
      "title": "Податки і нотаріус",
      "due_label": "01.04.2025",
      "due_date": "2025-04-01",
      "payment_date": "2025-04-01",
      "period_year": 2025,
      "period_month": 4,
      "schedule_usd": 1000.0,
      "fact_usd": 1000.0,
      "fact_uah": 41528.5,
      "rate": 41.5285,
      "meters": null,
      "percent_increase": null,
      "raw_fact_uah": null,
      "raw_fact_usd": null,
      "status": "paid",
      "flags": {
        "early": false,
        "initial": false,
        "source": "manual-category"
      },
      "base_paid_usd": 1000.0,
      "base_paid_uah": 41528.5,
      "exclude_from_summary": false,
      "category_key": "tax_notary",
      "category_name": "Податки і нотаріус",
      "id": "extra-tax-r1-2025-04"
    },
    {
      "title": "Нульовий місяць 05.2025",
      "due_label": "01.05.2025",
      "due_date": "2025-05-01",
      "payment_date": null,
      "period_year": 2025,
      "period_month": 5,
      "schedule_usd": 0.0,
      "fact_usd": null,
      "fact_uah": null,
      "rate": null,
      "meters": null,
      "percent_increase": "0,00%",
      "raw_fact_uah": null,
      "raw_fact_usd": null,
      "status": "unpaid",
      "flags": {
        "early": false,
        "initial": false,
        "zero_month": true,
        "source": "auto"
      },
      "base_paid_usd": 0.0,
      "base_paid_uah": 0.0,
      "exclude_from_summary": true,
      "month_index": 42,
      "id": 42
    },
    {
      "title": "План 01.06.2025",
      "due_label": "01.06.2025",
      "due_date": "2025-06-01",
      "payment_date": "2025-05-30",
      "period_year": 2025,
      "period_month": 6,
      "schedule_usd": 695.56,
      "fact_usd": 1391.12,
      "fact_uah": 57771.13,
      "rate": 41.5285,
      "meters": null,
      "percent_increase": "0,00%",
      "raw_fact_uah": "57 771,13",
      "raw_fact_usd": "1 391,12",
      "status": "paid",
      "flags": {
        "early": false,
        "initial": false,
        "source": "304"
      },
      "base_paid_usd": 1391.12,
      "base_paid_uah": 57771.13,
      "exclude_from_summary": false,
      "month_index": 43,
      "id": 43
    },
    {
      "title": "План 01.07.2025",
      "due_label": "01.07.2025",
      "due_date": "2025-07-01",
      "payment_date": "2025-07-01",
      "period_year": 2025,
      "period_month": 7,
      "schedule_usd": 701.61,
      "fact_usd": 699.29,
      "fact_uah": 29215.67,
      "rate": 41.7788,
      "meters": null,
      "percent_increase": "0,87%",
      "raw_fact_uah": "29 215,67",
      "raw_fact_usd": "699,29",
      "status": "paid",
      "flags": {
        "early": false,
        "initial": false,
        "source": "304"
      },
      "base_paid_usd": 699.29,
      "base_paid_uah": 29215.67,
      "exclude_from_summary": false,
      "month_index": 44,
      "id": 44
    },
    {
      "title": "План 01.08.2025",
      "due_label": "01.08.2025",
      "due_date": "2025-08-01",
      "payment_date": "2025-07-30",
      "period_year": 2025,
      "period_month": 8,
      "schedule_usd": 707.71,
      "fact_usd": 709.92,
      "fact_uah": 29666.76,
      "rate": 41.7886,
      "meters": null,
      "percent_increase": "0,87%",
      "raw_fact_uah": "29 666,76",
      "raw_fact_usd": "709,92",
      "status": "paid",
      "flags": {
        "early": false,
        "initial": false,
        "source": "304"
      },
      "base_paid_usd": 709.92,
      "base_paid_uah": 29666.76,
      "exclude_from_summary": false,
      "month_index": 45,
      "id": 45
    },
    {
      "title": "Доходи",
      "due_label": "01.08.2025",
      "due_date": "2025-08-01",
      "payment_date": "2025-08-01",
      "period_year": 2025,
      "period_month": 8,
      "schedule_usd": 717.9,
      "fact_usd": 717.9,
      "fact_uah": 30000.0,
      "rate": 41.7886,
      "meters": null,
      "percent_increase": null,
      "raw_fact_uah": null,
      "raw_fact_usd": null,
      "status": "paid",
      "flags": {
        "early": false,
        "initial": false,
        "source": "manual-category"
      },
      "base_paid_usd": 717.9,
      "base_paid_uah": 30000.0,
      "exclude_from_summary": false,
      "category_key": "income",
      "category_name": "Доходи",
      "id": "extra-income-r1-2025-08"
    },
    {
      "title": "Ремонт (додаткові витрати)",
      "due_label": "01.08.2025",
      "due_date": "2025-08-01",
      "payment_date": "2025-08-01",
      "period_year": 2025,
      "period_month": 8,
      "schedule_usd": 25000.0,
      "fact_usd": 25000.0,
      "fact_uah": 1044715.0,
      "rate": 41.7886,
      "meters": null,
      "percent_increase": null,
      "raw_fact_uah": null,
      "raw_fact_usd": null,
      "status": "paid",
      "flags": {
        "early": false,
        "initial": false,
        "source": "manual-category"
      },
      "base_paid_usd": 25000.0,
      "base_paid_uah": 1044715.0,
      "exclude_from_summary": false,
      "category_key": "repair",
      "category_name": "Ремонт",
      "id": "extra-repair-r1-2025-08-a"
    },
    {
      "title": "Ремонт (додаткові витрати)",
      "due_label": "01.08.2025",
      "due_date": "2025-08-01",
      "payment_date": "2025-08-01",
      "period_year": 2025,
      "period_month": 8,
      "schedule_usd": 10000.0,
      "fact_usd": 10000.0,
      "fact_uah": 417886.0,
      "rate": 41.7886,
      "meters": null,
      "percent_increase": null,
      "raw_fact_uah": null,
      "raw_fact_usd": null,
      "status": "paid",
      "flags": {
        "early": false,
        "initial": false,
        "source": "manual-category"
      },
      "base_paid_usd": 10000.0,
      "base_paid_uah": 417886.0,
      "exclude_from_summary": false,
      "category_key": "repair",
      "category_name": "Ремонт",
      "id": "extra-repair-r1-2025-08-b"
    },
    {
      "title": "План 01.09.2025",
      "due_label": "01.09.2025",
      "due_date": "2025-09-01",
      "payment_date": "2025-08-30",
      "period_year": 2025,
      "period_month": 9,
      "schedule_usd": 713.87,
      "fact_usd": 4285.79,
      "fact_uah": 176832.57,
      "rate": 41.2602,
      "meters": null,
      "percent_increase": "0,87%",
      "raw_fact_uah": "176 832,57",
      "raw_fact_usd": "4 285,79",
      "status": "paid",
      "flags": {
        "early": false,
        "initial": false,
        "source": "304"
      },
      "base_paid_usd": 4285.79,
      "base_paid_uah": 176832.57,
      "exclude_from_summary": false,
      "month_index": 46,
      "id": 46
    },
    {
      "title": "Доходи",
      "due_label": "01.09.2025",
      "due_date": "2025-09-01",
      "payment_date": "2025-09-01",
      "period_year": 2025,
      "period_month": 9,
      "schedule_usd": 727.09,
      "fact_usd": 727.09,
      "fact_uah": 30000.0,
      "rate": 41.2602,
      "meters": null,
      "percent_increase": null,
      "raw_fact_uah": null,
      "raw_fact_usd": null,
      "status": "paid",
      "flags": {
        "early": false,
        "initial": false,
        "source": "manual-category"
      },
      "base_paid_usd": 727.09,
      "base_paid_uah": 30000.0,
      "exclude_from_summary": false,
      "category_key": "income",
      "category_name": "Доходи",
      "id": "extra-income-r1-2025-09"
    },
    {
      "title": "План 01.10.2025",
      "due_label": "01.10.2025",
      "due_date": "2025-10-01",
      "payment_date": "2025-09-27",
      "period_year": 2025,
      "period_month": 10,
      "schedule_usd": 720.08,
      "fact_usd": 717.62,
      "fact_uah": 29776.85,
      "rate": 41.4939,
      "meters": null,
      "percent_increase": "0,87%",
      "raw_fact_uah": "29 776,85",
      "raw_fact_usd": "717,62",
      "status": "paid",
      "flags": {
        "early": false,
        "initial": false,
        "source": "304"
      },
      "base_paid_usd": 717.62,
      "base_paid_uah": 29776.85,
      "exclude_from_summary": false,
      "month_index": 47,
      "id": 47
    },
    {
      "title": "Доходи",
      "due_label": "01.10.2025",
      "due_date": "2025-10-01",
      "payment_date": "2025-10-01",
      "period_year": 2025,
      "period_month": 10,
      "schedule_usd": 723.0,
      "fact_usd": 723.0,
      "fact_uah": 30000.0,
      "rate": 41.4939,
      "meters": null,
      "percent_increase": null,
      "raw_fact_uah": null,
      "raw_fact_usd": null,
      "status": "paid",
      "flags": {
        "early": false,
        "initial": false,
        "source": "manual-category"
      },
      "base_paid_usd": 723.0,
      "base_paid_uah": 30000.0,
      "exclude_from_summary": false,
      "category_key": "income",
      "category_name": "Доходи",
      "id": "extra-income-r1-2025-10"
    },
    {
      "title": "План 01.11.2025",
      "due_label": "01.11.2025",
      "due_date": "2025-11-01",
      "payment_date": "2025-10-31",
      "period_year": 2025,
      "period_month": 11,
      "schedule_usd": 726.34,
      "fact_usd": 728.08,
      "fact_uah": 30557.41,
      "rate": 41.9701,
      "meters": null,
      "percent_increase": "0,87%",
      "raw_fact_uah": "30 557,41",
      "raw_fact_usd": "728,08",
      "status": "paid",
      "flags": {
        "early": false,
        "initial": false,
        "source": "304"
      },
      "base_paid_usd": 728.08,
      "base_paid_uah": 30557.41,
      "exclude_from_summary": false,
      "month_index": 48,
      "id": 48
    },
    {
      "title": "Доходи",
      "due_label": "01.11.2025",
      "due_date": "2025-11-01",
      "payment_date": "2025-11-01",
      "period_year": 2025,
      "period_month": 11,
      "schedule_usd": 714.79,
      "fact_usd": 714.79,
      "fact_uah": 30000.0,
      "rate": 41.9701,
      "meters": null,
      "percent_increase": null,
      "raw_fact_uah": null,
      "raw_fact_usd": null,
      "status": "paid",
      "flags": {
        "early": false,
        "initial": false,
        "source": "manual-category"
      },
      "base_paid_usd": 714.79,
      "base_paid_uah": 30000.0,
      "exclude_from_summary": false,
      "category_key": "income",
      "category_name": "Доходи",
      "id": "extra-income-r1-2025-11"
    },
    {
      "title": "План 01.12.2025",
      "due_label": "01.12.2025",
      "due_date": "2025-12-01",
      "payment_date": "2025-11-30",
      "period_year": 2025,
      "period_month": 12,
      "schedule_usd": 732.66,
      "fact_usd": 728.74,
      "fact_uah": 30747.68,
      "rate": 42.1928,
      "meters": null,
      "percent_increase": "0,87%",
      "raw_fact_uah": "30 747,68",
      "raw_fact_usd": "728,74",
      "status": "paid",
      "flags": {
        "early": false,
        "initial": false,
        "source": "304"
      },
      "base_paid_usd": 728.74,
      "base_paid_uah": 30747.68,
      "exclude_from_summary": false,
      "month_index": 49,
      "id": 49
    },
    {
      "title": "Доходи",
      "due_label": "01.12.2025",
      "due_date": "2025-12-01",
      "payment_date": "2025-12-01",
      "period_year": 2025,
      "period_month": 12,
      "schedule_usd": 711.02,
      "fact_usd": 711.02,
      "fact_uah": 30000.0,
      "rate": 42.1928,
      "meters": null,
      "percent_increase": null,
      "raw_fact_uah": null,
      "raw_fact_usd": null,
      "status": "paid",
      "flags": {
        "early": false,
        "initial": false,
        "source": "manual-category"
      },
      "base_paid_usd": 711.02,
      "base_paid_uah": 30000.0,
      "exclude_from_summary": false,
      "category_key": "income",
      "category_name": "Доходи",
      "id": "extra-income-r1-2025-12"
    },
    {
      "title": "План 01.01.2026",
      "due_label": "01.01.2026",
      "due_date": "2026-01-01",
      "payment_date": "2025-12-16",
      "period_year": 2026,
      "period_month": 1,
      "schedule_usd": 739.03,
      "fact_usd": 740.31,
      "fact_uah": 31274.32,
      "rate": 42.2451,
      "meters": null,
      "percent_increase": "0,87%",
      "raw_fact_uah": "31 274,32",
      "raw_fact_usd": "740,31",
      "status": "paid",
      "flags": {
        "early": false,
        "initial": false,
        "source": "304"
      },
      "base_paid_usd": 740.31,
      "base_paid_uah": 31274.32,
      "exclude_from_summary": false,
      "month_index": 50,
      "id": 50
    },
    {
      "title": "Доходи",
      "due_label": "01.01.2026",
      "due_date": "2026-01-01",
      "payment_date": "2026-01-01",
      "period_year": 2026,
      "period_month": 1,
      "schedule_usd": 710.14,
      "fact_usd": 710.14,
      "fact_uah": 30000.0,
      "rate": 42.2451,
      "meters": null,
      "percent_increase": null,
      "raw_fact_uah": null,
      "raw_fact_usd": null,
      "status": "paid",
      "flags": {
        "early": false,
        "initial": false,
        "source": "manual-category"
      },
      "base_paid_usd": 710.14,
      "base_paid_uah": 30000.0,
      "exclude_from_summary": false,
      "category_key": "income",
      "category_name": "Доходи",
      "id": "extra-income-r1-2026-01"
    },
    {
      "title": "План 01.02.2026",
      "due_label": "01.02.2026",
      "due_date": "2026-02-01",
      "payment_date": "2026-01-13",
      "period_year": 2026,
      "period_month": 2,
      "schedule_usd": 745.46,
      "fact_usd": 1463.04,
      "fact_uah": 63284.2,
      "rate": 43.2552,
      "meters": null,
      "percent_increase": "0,87%",
      "raw_fact_uah": "63 284,20",
      "raw_fact_usd": "1 463,04",
      "status": "paid",
      "flags": {
        "early": false,
        "initial": false,
        "source": "304"
      },
      "base_paid_usd": 1463.04,
      "base_paid_uah": 63284.2,
      "exclude_from_summary": false,
      "month_index": 51,
      "id": 51
    },
    {
      "title": "Доходи",
      "due_label": "01.02.2026",
      "due_date": "2026-02-01",
      "payment_date": "2026-02-01",
      "period_year": 2026,
      "period_month": 2,
      "schedule_usd": 693.56,
      "fact_usd": 693.56,
      "fact_uah": 30000.0,
      "rate": 43.2552,
      "meters": null,
      "percent_increase": null,
      "raw_fact_uah": null,
      "raw_fact_usd": null,
      "status": "paid",
      "flags": {
        "early": false,
        "initial": false,
        "source": "manual-category"
      },
      "base_paid_usd": 693.56,
      "base_paid_uah": 30000.0,
      "exclude_from_summary": false,
      "category_key": "income",
      "category_name": "Доходи",
      "id": "extra-income-r1-2026-02"
    },
    {
      "title": "План 01.03.2026",
      "due_label": "01.03.2026",
      "due_date": "2026-03-01",
      "payment_date": null,
      "period_year": 2026,
      "period_month": 3,
      "schedule_usd": 751.95,
      "fact_usd": 35.27,
      "fact_uah": 1508.46,
      "rate": 42.7689,
      "meters": null,
      "percent_increase": "0,87%",
      "raw_fact_uah": "1 508,46",
      "raw_fact_usd": "35,27",
      "status": "partial",
      "flags": {
        "early": false,
        "initial": false,
        "source": "304"
      },
      "base_paid_usd": 35.27,
      "base_paid_uah": 1508.46,
      "exclude_from_summary": false,
      "month_index": 52,
      "id": 52
    },
    {
      "title": "План 01.04.2026",
      "due_label": "01.04.2026",
      "due_date": "2026-04-01",
      "payment_date": null,
      "period_year": 2026,
      "period_month": 4,
      "schedule_usd": 758.49,
      "fact_usd": 758.49,
      "fact_uah": 32439.78,
      "rate": 42.7689,
      "meters": null,
      "percent_increase": "0,87%",
      "raw_fact_uah": "32 439,78",
      "raw_fact_usd": "758,49",
      "status": "partial",
      "flags": {
        "early": false,
        "initial": false,
        "source": "304"
      },
      "base_paid_usd": 758.49,
      "base_paid_uah": 32439.78,
      "exclude_from_summary": false,
      "month_index": 53,
      "id": 53
    },
    {
      "title": "План 01.05.2026",
      "due_label": "01.05.2026",
      "due_date": "2026-05-01",
      "payment_date": null,
      "period_year": 2026,
      "period_month": 5,
      "schedule_usd": 765.09,
      "fact_usd": 765.09,
      "fact_uah": 32722.06,
      "rate": 42.7689,
      "meters": null,
      "percent_increase": "0,87%",
      "raw_fact_uah": "32 722,06",
      "raw_fact_usd": "765,09",
      "status": "partial",
      "flags": {
        "early": false,
        "initial": false,
        "source": "304"
      },
      "base_paid_usd": 765.09,
      "base_paid_uah": 32722.06,
      "exclude_from_summary": false,
      "month_index": 54,
      "id": 54
    },
    {
      "title": "План 01.06.2026",
      "due_label": "01.06.2026",
      "due_date": "2026-06-01",
      "payment_date": null,
      "period_year": 2026,
      "period_month": 6,
      "schedule_usd": 771.75,
      "fact_usd": 771.75,
      "fact_uah": 33006.9,
      "rate": 42.7689,
      "meters": null,
      "percent_increase": "0,87%",
      "raw_fact_uah": "33 006,90",
      "raw_fact_usd": "771,75",
      "status": "partial",
      "flags": {
        "early": false,
        "initial": false,
        "source": "304"
      },
      "base_paid_usd": 771.75,
      "base_paid_uah": 33006.9,
      "exclude_from_summary": false,
      "month_index": 55,
      "id": 55
    },
    {
      "title": "План 01.07.2026",
      "due_label": "01.07.2026",
      "due_date": "2026-07-01",
      "payment_date": null,
      "period_year": 2026,
      "period_month": 7,
      "schedule_usd": 778.46,
      "fact_usd": 778.46,
      "fact_uah": 33293.88,
      "rate": 42.7689,
      "meters": null,
      "percent_increase": "0,87%",
      "raw_fact_uah": "33 293,88",
      "raw_fact_usd": "778,46",
      "status": "partial",
      "flags": {
        "early": false,
        "initial": false,
        "source": "304"
      },
      "base_paid_usd": 778.46,
      "base_paid_uah": 33293.88,
      "exclude_from_summary": false,
      "month_index": 56,
      "id": 56
    },
    {
      "title": "План 01.08.2026",
      "due_label": "01.08.2026",
      "due_date": "2026-08-01",
      "payment_date": null,
      "period_year": 2026,
      "period_month": 8,
      "schedule_usd": 785.23,
      "fact_usd": 785.23,
      "fact_uah": 33583.42,
      "rate": 42.7689,
      "meters": null,
      "percent_increase": "0,87%",
      "raw_fact_uah": "33 583,42",
      "raw_fact_usd": "785,23",
      "status": "partial",
      "flags": {
        "early": false,
        "initial": false,
        "source": "304"
      },
      "base_paid_usd": 785.23,
      "base_paid_uah": 33583.42,
      "exclude_from_summary": false,
      "month_index": 57,
      "id": 57
    },
    {
      "title": "План 01.09.2026",
      "due_label": "01.09.2026",
      "due_date": "2026-09-01",
      "payment_date": null,
      "period_year": 2026,
      "period_month": 9,
      "schedule_usd": 792.06,
      "fact_usd": 792.06,
      "fact_uah": 33875.53,
      "rate": 42.7689,
      "meters": null,
      "percent_increase": "0,87%",
      "raw_fact_uah": "33 875,53",
      "raw_fact_usd": "792,06",
      "status": "partial",
      "flags": {
        "early": false,
        "initial": false,
        "source": "304"
      },
      "base_paid_usd": 792.06,
      "base_paid_uah": 33875.53,
      "exclude_from_summary": false,
      "month_index": 58,
      "id": 58
    },
    {
      "title": "План 01.10.2026",
      "due_label": "01.10.2026",
      "due_date": "2026-10-01",
      "payment_date": null,
      "period_year": 2026,
      "period_month": 10,
      "schedule_usd": 798.95,
      "fact_usd": 798.95,
      "fact_uah": 34170.21,
      "rate": 42.7689,
      "meters": null,
      "percent_increase": "0,87%",
      "raw_fact_uah": "34 170,21",
      "raw_fact_usd": "798,95",
      "status": "partial",
      "flags": {
        "early": false,
        "initial": false,
        "source": "304"
      },
      "base_paid_usd": 798.95,
      "base_paid_uah": 34170.21,
      "exclude_from_summary": false,
      "month_index": 59,
      "id": 59
    },
    {
      "title": "План 01.11.2026",
      "due_label": "01.11.2026",
      "due_date": "2026-11-01",
      "payment_date": null,
      "period_year": 2026,
      "period_month": 11,
      "schedule_usd": 805.9,
      "fact_usd": 805.9,
      "fact_uah": 34467.46,
      "rate": 42.7689,
      "meters": null,
      "percent_increase": "0,87%",
      "raw_fact_uah": "34 467,46",
      "raw_fact_usd": "805,90",
      "status": "partial",
      "flags": {
        "early": false,
        "initial": false,
        "source": "304"
      },
      "base_paid_usd": 805.9,
      "base_paid_uah": 34467.46,
      "exclude_from_summary": false,
      "month_index": 60,
      "id": 60
    },
    {
      "title": "План 01.12.2026",
      "due_label": "01.12.2026",
      "due_date": "2026-12-01",
      "payment_date": null,
      "period_year": 2026,
      "period_month": 12,
      "schedule_usd": 812.91,
      "fact_usd": 812.91,
      "fact_uah": 34767.27,
      "rate": 42.7689,
      "meters": null,
      "percent_increase": "0,87%",
      "raw_fact_uah": "34 767,27",
      "raw_fact_usd": "812,91",
      "status": "partial",
      "flags": {
        "early": false,
        "initial": false,
        "source": "304"
      },
      "base_paid_usd": 812.91,
      "base_paid_uah": 34767.27,
      "exclude_from_summary": false,
      "month_index": 61,
      "id": 61
    },
    {
      "title": "План 01.01.2027",
      "due_label": "01.01.2027",
      "due_date": "2027-01-01",
      "payment_date": null,
      "period_year": 2027,
      "period_month": 1,
      "schedule_usd": 819.98,
      "fact_usd": 819.98,
      "fact_uah": 35069.64,
      "rate": 42.7689,
      "meters": null,
      "percent_increase": "0,87%",
      "raw_fact_uah": "35 069,64",
      "raw_fact_usd": "819,98",
      "status": "partial",
      "flags": {
        "early": false,
        "initial": false,
        "source": "304"
      },
      "base_paid_usd": 819.98,
      "base_paid_uah": 35069.64,
      "exclude_from_summary": false,
      "month_index": 62,
      "id": 62
    },
    {
      "title": "План 01.02.2027",
      "due_label": "01.02.2027",
      "due_date": "2027-02-01",
      "payment_date": null,
      "period_year": 2027,
      "period_month": 2,
      "schedule_usd": 827.11,
      "fact_usd": 827.11,
      "fact_uah": 35374.58,
      "rate": 42.7689,
      "meters": null,
      "percent_increase": "0,87%",
      "raw_fact_uah": "35 374,58",
      "raw_fact_usd": "827,11",
      "status": "partial",
      "flags": {
        "early": false,
        "initial": false,
        "source": "304"
      },
      "base_paid_usd": 827.11,
      "base_paid_uah": 35374.58,
      "exclude_from_summary": false,
      "month_index": 63,
      "id": 63
    },
    {
      "title": "План 01.03.2027",
      "due_label": "01.03.2027",
      "due_date": "2027-03-01",
      "payment_date": null,
      "period_year": 2027,
      "period_month": 3,
      "schedule_usd": 834.31,
      "fact_usd": 834.31,
      "fact_uah": 35682.52,
      "rate": 42.7689,
      "meters": null,
      "percent_increase": "0,87%",
      "raw_fact_uah": "35 682,52",
      "raw_fact_usd": "834,31",
      "status": "partial",
      "flags": {
        "early": false,
        "initial": false,
        "source": "304"
      },
      "base_paid_usd": 834.31,
      "base_paid_uah": 35682.52,
      "exclude_from_summary": false,
      "month_index": 64,
      "id": 64
    },
    {
      "title": "План 01.04.2027",
      "due_label": "01.04.2027",
      "due_date": "2027-04-01",
      "payment_date": null,
      "period_year": 2027,
      "period_month": 4,
      "schedule_usd": 841.57,
      "fact_usd": 841.57,
      "fact_uah": 35993.02,
      "rate": 42.7689,
      "meters": null,
      "percent_increase": "0,87%",
      "raw_fact_uah": "35 993,02",
      "raw_fact_usd": "841,57",
      "status": "partial",
      "flags": {
        "early": false,
        "initial": false,
        "source": "304"
      },
      "base_paid_usd": 841.57,
      "base_paid_uah": 35993.02,
      "exclude_from_summary": false,
      "month_index": 65,
      "id": 65
    },
    {
      "title": "План 01.05.2027",
      "due_label": "01.05.2027",
      "due_date": "2027-05-01",
      "payment_date": null,
      "period_year": 2027,
      "period_month": 5,
      "schedule_usd": 848.89,
      "fact_usd": 848.89,
      "fact_uah": 36306.09,
      "rate": 42.7689,
      "meters": null,
      "percent_increase": "0,87%",
      "raw_fact_uah": "36 306,09",
      "raw_fact_usd": "848,89",
      "status": "partial",
      "flags": {
        "early": false,
        "initial": false,
        "source": "304"
      },
      "base_paid_usd": 848.89,
      "base_paid_uah": 36306.09,
      "exclude_from_summary": false,
      "month_index": 66,
      "id": 66
    },
    {
      "title": "План 01.06.2027",
      "due_label": "01.06.2027",
      "due_date": "2027-06-01",
      "payment_date": null,
      "period_year": 2027,
      "period_month": 6,
      "schedule_usd": 856.28,
      "fact_usd": 856.28,
      "fact_uah": 36622.15,
      "rate": 42.7689,
      "meters": null,
      "percent_increase": "0,87%",
      "raw_fact_uah": "36 622,15",
      "raw_fact_usd": "856,28",
      "status": "partial",
      "flags": {
        "early": false,
        "initial": false,
        "source": "304"
      },
      "base_paid_usd": 856.28,
      "base_paid_uah": 36622.15,
      "exclude_from_summary": false,
      "month_index": 67,
      "id": 67
    },
    {
      "title": "План 01.07.2027",
      "due_label": "01.07.2027",
      "due_date": "2027-07-01",
      "payment_date": null,
      "period_year": 2027,
      "period_month": 7,
      "schedule_usd": 863.73,
      "fact_usd": 863.73,
      "fact_uah": 36940.78,
      "rate": 42.7689,
      "meters": null,
      "percent_increase": "0,87%",
      "raw_fact_uah": "36 940,78",
      "raw_fact_usd": "863,73",
      "status": "partial",
      "flags": {
        "early": false,
        "initial": false,
        "source": "304"
      },
      "base_paid_usd": 863.73,
      "base_paid_uah": 36940.78,
      "exclude_from_summary": false,
      "month_index": 68,
      "id": 68
    },
    {
      "title": "План 01.08.2027",
      "due_label": "01.08.2027",
      "due_date": "2027-08-01",
      "payment_date": null,
      "period_year": 2027,
      "period_month": 8,
      "schedule_usd": 871.24,
      "fact_usd": 871.24,
      "fact_uah": 37261.98,
      "rate": 42.7689,
      "meters": null,
      "percent_increase": "0,87%",
      "raw_fact_uah": "37 261,98",
      "raw_fact_usd": "871,24",
      "status": "partial",
      "flags": {
        "early": false,
        "initial": false,
        "source": "304"
      },
      "base_paid_usd": 871.24,
      "base_paid_uah": 37261.98,
      "exclude_from_summary": false,
      "month_index": 69,
      "id": 69
    },
    {
      "title": "План 01.09.2027",
      "due_label": "01.09.2027",
      "due_date": "2027-09-01",
      "payment_date": null,
      "period_year": 2027,
      "period_month": 9,
      "schedule_usd": 878.82,
      "fact_usd": 878.82,
      "fact_uah": 37586.16,
      "rate": 42.7689,
      "meters": null,
      "percent_increase": "0,87%",
      "raw_fact_uah": "37 586,16",
      "raw_fact_usd": "878,82",
      "status": "partial",
      "flags": {
        "early": false,
        "initial": false,
        "source": "304"
      },
      "base_paid_usd": 878.82,
      "base_paid_uah": 37586.16,
      "exclude_from_summary": false,
      "month_index": 70,
      "id": 70
    },
    {
      "title": "План 01.10.2027",
      "due_label": "01.10.2027",
      "due_date": "2027-10-01",
      "payment_date": null,
      "period_year": 2027,
      "period_month": 10,
      "schedule_usd": 886.47,
      "fact_usd": 886.47,
      "fact_uah": 37913.35,
      "rate": 42.7689,
      "meters": null,
      "percent_increase": "0,87%",
      "raw_fact_uah": "37 913,35",
      "raw_fact_usd": "886,47",
      "status": "partial",
      "flags": {
        "early": false,
        "initial": false,
        "source": "304"
      },
      "base_paid_usd": 886.47,
      "base_paid_uah": 37913.35,
      "exclude_from_summary": false,
      "month_index": 71,
      "id": 71
    },
    {
      "title": "План 01.11.2027",
      "due_label": "01.11.2027",
      "due_date": "2027-11-01",
      "payment_date": null,
      "period_year": 2027,
      "period_month": 11,
      "schedule_usd": 894.18,
      "fact_usd": 894.18,
      "fact_uah": 38243.1,
      "rate": 42.7689,
      "meters": null,
      "percent_increase": "0,87%",
      "raw_fact_uah": "38 243,10",
      "raw_fact_usd": "894,18",
      "status": "partial",
      "flags": {
        "early": false,
        "initial": false,
        "source": "304"
      },
      "base_paid_usd": 894.18,
      "base_paid_uah": 38243.1,
      "exclude_from_summary": false,
      "month_index": 72,
      "id": 72
    },
    {
      "title": "План 01.12.2027",
      "due_label": "01.12.2027",
      "due_date": "2027-12-01",
      "payment_date": null,
      "period_year": 2027,
      "period_month": 12,
      "schedule_usd": 901.96,
      "fact_usd": 901.96,
      "fact_uah": 38575.84,
      "rate": 42.7689,
      "meters": null,
      "percent_increase": "0,87%",
      "raw_fact_uah": "38 575,84",
      "raw_fact_usd": "901,96",
      "status": "partial",
      "flags": {
        "early": false,
        "initial": false,
        "source": "304"
      },
      "base_paid_usd": 901.96,
      "base_paid_uah": 38575.84,
      "exclude_from_summary": false,
      "month_index": 73,
      "id": 73
    },
    {
      "title": "План 01.01.2028",
      "due_label": "01.01.2028",
      "due_date": "2028-01-01",
      "payment_date": null,
      "period_year": 2028,
      "period_month": 1,
      "schedule_usd": 909.81,
      "fact_usd": 909.81,
      "fact_uah": 38911.57,
      "rate": 42.7689,
      "meters": null,
      "percent_increase": "0,87%",
      "raw_fact_uah": "38 911,57",
      "raw_fact_usd": "909,81",
      "status": "partial",
      "flags": {
        "early": false,
        "initial": false,
        "source": "304"
      },
      "base_paid_usd": 909.81,
      "base_paid_uah": 38911.57,
      "exclude_from_summary": false,
      "month_index": 74,
      "id": 74
    },
    {
      "title": "План 01.02.2028",
      "due_label": "01.02.2028",
      "due_date": "2028-02-01",
      "payment_date": null,
      "period_year": 2028,
      "period_month": 2,
      "schedule_usd": 917.73,
      "fact_usd": 917.73,
      "fact_uah": 39250.3,
      "rate": 42.7689,
      "meters": null,
      "percent_increase": "0,87%",
      "raw_fact_uah": "39 250,30",
      "raw_fact_usd": "917,73",
      "status": "partial",
      "flags": {
        "early": false,
        "initial": false,
        "source": "304"
      },
      "base_paid_usd": 917.73,
      "base_paid_uah": 39250.3,
      "exclude_from_summary": false,
      "month_index": 75,
      "id": 75
    },
    {
      "title": "План 01.03.2028",
      "due_label": "01.03.2028",
      "due_date": "2028-03-01",
      "payment_date": null,
      "period_year": 2028,
      "period_month": 3,
      "schedule_usd": 925.71,
      "fact_usd": 925.71,
      "fact_uah": 39591.6,
      "rate": 42.7689,
      "meters": null,
      "percent_increase": "0,87%",
      "raw_fact_uah": "39 591,60",
      "raw_fact_usd": "925,71",
      "status": "partial",
      "flags": {
        "early": false,
        "initial": false,
        "source": "304"
      },
      "base_paid_usd": 925.71,
      "base_paid_uah": 39591.6,
      "exclude_from_summary": false,
      "month_index": 76,
      "id": 76
    },
    {
      "title": "План 01.04.2028",
      "due_label": "01.04.2028",
      "due_date": "2028-04-01",
      "payment_date": null,
      "period_year": 2028,
      "period_month": 4,
      "schedule_usd": 933.76,
      "fact_usd": 933.76,
      "fact_uah": 39935.89,
      "rate": 42.7689,
      "meters": null,
      "percent_increase": "0,87%",
      "raw_fact_uah": "39 935,89",
      "raw_fact_usd": "933,76",
      "status": "partial",
      "flags": {
        "early": false,
        "initial": false,
        "source": "304"
      },
      "base_paid_usd": 933.76,
      "base_paid_uah": 39935.89,
      "exclude_from_summary": false,
      "month_index": 77,
      "id": 77
    },
    {
      "title": "План 01.05.2028",
      "due_label": "01.05.2028",
      "due_date": "2028-05-01",
      "payment_date": null,
      "period_year": 2028,
      "period_month": 5,
      "schedule_usd": 941.88,
      "fact_usd": 941.88,
      "fact_uah": 40283.17,
      "rate": 42.7689,
      "meters": null,
      "percent_increase": "0,87%",
      "raw_fact_uah": "40 283,17",
      "raw_fact_usd": "941,88",
      "status": "partial",
      "flags": {
        "early": false,
        "initial": false,
        "source": "304"
      },
      "base_paid_usd": 941.88,
      "base_paid_uah": 40283.17,
      "exclude_from_summary": false,
      "month_index": 78,
      "id": 78
    },
    {
      "title": "План 01.06.2028",
      "due_label": "01.06.2028",
      "due_date": "2028-06-01",
      "payment_date": null,
      "period_year": 2028,
      "period_month": 6,
      "schedule_usd": 950.07,
      "fact_usd": 950.07,
      "fact_uah": 40633.45,
      "rate": 42.7689,
      "meters": null,
      "percent_increase": "0,87%",
      "raw_fact_uah": "40 633,45",
      "raw_fact_usd": "950,07",
      "status": "partial",
      "flags": {
        "early": false,
        "initial": false,
        "source": "304"
      },
      "base_paid_usd": 950.07,
      "base_paid_uah": 40633.45,
      "exclude_from_summary": false,
      "month_index": 79,
      "id": 79
    },
    {
      "title": "План 01.07.2028",
      "due_label": "01.07.2028",
      "due_date": "2028-07-01",
      "payment_date": null,
      "period_year": 2028,
      "period_month": 7,
      "schedule_usd": 958.34,
      "fact_usd": 958.34,
      "fact_uah": 40987.15,
      "rate": 42.7689,
      "meters": null,
      "percent_increase": "0,87%",
      "raw_fact_uah": "40 987,15",
      "raw_fact_usd": "958,34",
      "status": "partial",
      "flags": {
        "early": false,
        "initial": false,
        "source": "304"
      },
      "base_paid_usd": 958.34,
      "base_paid_uah": 40987.15,
      "exclude_from_summary": false,
      "month_index": 80,
      "id": 80
    },
    {
      "title": "План 01.08.2028",
      "due_label": "01.08.2028",
      "due_date": "2028-08-01",
      "payment_date": null,
      "period_year": 2028,
      "period_month": 8,
      "schedule_usd": 966.68,
      "fact_usd": 966.68,
      "fact_uah": 41343.84,
      "rate": 42.7689,
      "meters": null,
      "percent_increase": "0,87%",
      "raw_fact_uah": "41 343,84",
      "raw_fact_usd": "966,68",
      "status": "partial",
      "flags": {
        "early": false,
        "initial": false,
        "source": "304"
      },
      "base_paid_usd": 966.68,
      "base_paid_uah": 41343.84,
      "exclude_from_summary": false,
      "month_index": 81,
      "id": 81
    },
    {
      "title": "План 01.09.2028",
      "due_label": "01.09.2028",
      "due_date": "2028-09-01",
      "payment_date": null,
      "period_year": 2028,
      "period_month": 9,
      "schedule_usd": 975.09,
      "fact_usd": 975.09,
      "fact_uah": 41703.53,
      "rate": 42.7689,
      "meters": null,
      "percent_increase": "0,87%",
      "raw_fact_uah": "41 703,53",
      "raw_fact_usd": "975,09",
      "status": "partial",
      "flags": {
        "early": false,
        "initial": false,
        "source": "304"
      },
      "base_paid_usd": 975.09,
      "base_paid_uah": 41703.53,
      "exclude_from_summary": false,
      "month_index": 82,
      "id": 82
    },
    {
      "title": "План 01.10.2028",
      "due_label": "01.10.2028",
      "due_date": "2028-10-01",
      "payment_date": null,
      "period_year": 2028,
      "period_month": 10,
      "schedule_usd": 983.57,
      "fact_usd": 983.57,
      "fact_uah": 42066.21,
      "rate": 42.7689,
      "meters": null,
      "percent_increase": "0,87%",
      "raw_fact_uah": "42 066,21",
      "raw_fact_usd": "983,57",
      "status": "partial",
      "flags": {
        "early": false,
        "initial": false,
        "source": "304"
      },
      "base_paid_usd": 983.57,
      "base_paid_uah": 42066.21,
      "exclude_from_summary": false,
      "month_index": 83,
      "id": 83
    },
    {
      "title": "План 01.11.2028",
      "due_label": "01.11.2028",
      "due_date": "2028-11-01",
      "payment_date": null,
      "period_year": 2028,
      "period_month": 11,
      "schedule_usd": 992.13,
      "fact_usd": 992.13,
      "fact_uah": 42432.31,
      "rate": 42.7689,
      "meters": null,
      "percent_increase": "0,87%",
      "raw_fact_uah": "42 432,31",
      "raw_fact_usd": "992,13",
      "status": "partial",
      "flags": {
        "early": false,
        "initial": false,
        "source": "304"
      },
      "base_paid_usd": 992.13,
      "base_paid_uah": 42432.31,
      "exclude_from_summary": false,
      "month_index": 84,
      "id": 84
    },
    {
      "title": "План 01.12.2028",
      "due_label": "01.12.2028",
      "due_date": "2028-12-01",
      "payment_date": null,
      "period_year": 2028,
      "period_month": 12,
      "schedule_usd": 1000.76,
      "fact_usd": 1000.76,
      "fact_uah": 42801.4,
      "rate": 42.7689,
      "meters": null,
      "percent_increase": "0,87%",
      "raw_fact_uah": "42 801,40",
      "raw_fact_usd": "1 000,76",
      "status": "partial",
      "flags": {
        "early": false,
        "initial": false,
        "source": "304"
      },
      "base_paid_usd": 1000.76,
      "base_paid_uah": 42801.4,
      "exclude_from_summary": false,
      "month_index": 85,
      "id": 85
    },
    {
      "title": "План 01.01.2029",
      "due_label": "01.01.2029",
      "due_date": "2029-01-01",
      "payment_date": null,
      "period_year": 2029,
      "period_month": 1,
      "schedule_usd": 1009.47,
      "fact_usd": 1009.47,
      "fact_uah": 43173.92,
      "rate": 42.7689,
      "meters": null,
      "percent_increase": "0,87%",
      "raw_fact_uah": "43 173,92",
      "raw_fact_usd": "1 009,47",
      "status": "partial",
      "flags": {
        "early": false,
        "initial": false,
        "source": "304"
      },
      "base_paid_usd": 1009.47,
      "base_paid_uah": 43173.92,
      "exclude_from_summary": false,
      "month_index": 86,
      "id": 86
    },
    {
      "title": "План 01.02.2029",
      "due_label": "01.02.2029",
      "due_date": "2029-02-01",
      "payment_date": null,
      "period_year": 2029,
      "period_month": 2,
      "schedule_usd": 1018.25,
      "fact_usd": 1018.25,
      "fact_uah": 43549.43,
      "rate": 42.7689,
      "meters": null,
      "percent_increase": "0,87%",
      "raw_fact_uah": "43 549,43",
      "raw_fact_usd": "1 018,25",
      "status": "partial",
      "flags": {
        "early": false,
        "initial": false,
        "source": "304"
      },
      "base_paid_usd": 1018.25,
      "base_paid_uah": 43549.43,
      "exclude_from_summary": false,
      "month_index": 87,
      "id": 87
    },
    {
      "title": "План 01.03.2029",
      "due_label": "01.03.2029",
      "due_date": "2029-03-01",
      "payment_date": null,
      "period_year": 2029,
      "period_month": 3,
      "schedule_usd": 1027.11,
      "fact_usd": 1027.11,
      "fact_uah": 43928.36,
      "rate": 42.7689,
      "meters": null,
      "percent_increase": "0,87%",
      "raw_fact_uah": "43 928,36",
      "raw_fact_usd": "1 027,11",
      "status": "partial",
      "flags": {
        "early": false,
        "initial": false,
        "source": "304"
      },
      "base_paid_usd": 1027.11,
      "base_paid_uah": 43928.36,
      "exclude_from_summary": false,
      "month_index": 88,
      "id": 88
    },
    {
      "title": "План 01.04.2029",
      "due_label": "01.04.2029",
      "due_date": "2029-04-01",
      "payment_date": null,
      "period_year": 2029,
      "period_month": 4,
      "schedule_usd": 1036.05,
      "fact_usd": 1036.05,
      "fact_uah": 44310.72,
      "rate": 42.7689,
      "meters": null,
      "percent_increase": "0,87%",
      "raw_fact_uah": "44 310,72",
      "raw_fact_usd": "1 036,05",
      "status": "partial",
      "flags": {
        "early": false,
        "initial": false,
        "source": "304"
      },
      "base_paid_usd": 1036.05,
      "base_paid_uah": 44310.72,
      "exclude_from_summary": false,
      "month_index": 89,
      "id": 89
    },
    {
      "title": "План 01.05.2029",
      "due_label": "01.05.2029",
      "due_date": "2029-05-01",
      "payment_date": null,
      "period_year": 2029,
      "period_month": 5,
      "schedule_usd": 1045.06,
      "fact_usd": 1045.06,
      "fact_uah": 44696.07,
      "rate": 42.7689,
      "meters": null,
      "percent_increase": "0,87%",
      "raw_fact_uah": "44 696,07",
      "raw_fact_usd": "1 045,06",
      "status": "partial",
      "flags": {
        "early": false,
        "initial": false,
        "source": "304"
      },
      "base_paid_usd": 1045.06,
      "base_paid_uah": 44696.07,
      "exclude_from_summary": false,
      "month_index": 90,
      "id": 90
    },
    {
      "title": "План 01.06.2029",
      "due_label": "01.06.2029",
      "due_date": "2029-06-01",
      "payment_date": null,
      "period_year": 2029,
      "period_month": 6,
      "schedule_usd": 1054.15,
      "fact_usd": 1054.15,
      "fact_uah": 45084.84,
      "rate": 42.7689,
      "meters": null,
      "percent_increase": "0,87%",
      "raw_fact_uah": "45 084,84",
      "raw_fact_usd": "1 054,15",
      "status": "partial",
      "flags": {
        "early": false,
        "initial": false,
        "source": "304"
      },
      "base_paid_usd": 1054.15,
      "base_paid_uah": 45084.84,
      "exclude_from_summary": false,
      "month_index": 91,
      "id": 91
    },
    {
      "title": "План 01.07.2029",
      "due_label": "01.07.2029",
      "due_date": "2029-07-01",
      "payment_date": null,
      "period_year": 2029,
      "period_month": 7,
      "schedule_usd": 1063.32,
      "fact_usd": 1063.32,
      "fact_uah": 45477.03,
      "rate": 42.7689,
      "meters": null,
      "percent_increase": "0,87%",
      "raw_fact_uah": "45 477,03",
      "raw_fact_usd": "1 063,32",
      "status": "partial",
      "flags": {
        "early": false,
        "initial": false,
        "source": "304"
      },
      "base_paid_usd": 1063.32,
      "base_paid_uah": 45477.03,
      "exclude_from_summary": false,
      "month_index": 92,
      "id": 92
    },
    {
      "title": "План 01.08.2029",
      "due_label": "01.08.2029",
      "due_date": "2029-08-01",
      "payment_date": null,
      "period_year": 2029,
      "period_month": 8,
      "schedule_usd": 1072.57,
      "fact_usd": 1072.57,
      "fact_uah": 45872.64,
      "rate": 42.7689,
      "meters": null,
      "percent_increase": "0,87%",
      "raw_fact_uah": "45 872,64",
      "raw_fact_usd": "1 072,57",
      "status": "partial",
      "flags": {
        "early": false,
        "initial": false,
        "source": "304"
      },
      "base_paid_usd": 1072.57,
      "base_paid_uah": 45872.64,
      "exclude_from_summary": false,
      "month_index": 93,
      "id": 93
    },
    {
      "title": "План 01.09.2029",
      "due_label": "01.09.2029",
      "due_date": "2029-09-01",
      "payment_date": null,
      "period_year": 2029,
      "period_month": 9,
      "schedule_usd": 1081.9,
      "fact_usd": 1081.9,
      "fact_uah": 46271.67,
      "rate": 42.7689,
      "meters": null,
      "percent_increase": "0,87%",
      "raw_fact_uah": "46 271,67",
      "raw_fact_usd": "1 081,90",
      "status": "partial",
      "flags": {
        "early": false,
        "initial": false,
        "source": "304"
      },
      "base_paid_usd": 1081.9,
      "base_paid_uah": 46271.67,
      "exclude_from_summary": false,
      "month_index": 94,
      "id": 94
    },
    {
      "title": "План 01.10.2029",
      "due_label": "01.10.2029",
      "due_date": "2029-10-01",
      "payment_date": null,
      "period_year": 2029,
      "period_month": 10,
      "schedule_usd": 1091.31,
      "fact_usd": 1091.31,
      "fact_uah": 46674.13,
      "rate": 42.7689,
      "meters": null,
      "percent_increase": "0,87%",
      "raw_fact_uah": "46 674,13",
      "raw_fact_usd": "1 091,31",
      "status": "partial",
      "flags": {
        "early": false,
        "initial": false,
        "source": "304"
      },
      "base_paid_usd": 1091.31,
      "base_paid_uah": 46674.13,
      "exclude_from_summary": false,
      "month_index": 95,
      "id": 95
    },
    {
      "title": "План 01.11.2029",
      "due_label": "01.11.2029",
      "due_date": "2029-11-01",
      "payment_date": null,
      "period_year": 2029,
      "period_month": 11,
      "schedule_usd": 1100.8,
      "fact_usd": 1100.8,
      "fact_uah": 47080.01,
      "rate": 42.7689,
      "meters": null,
      "percent_increase": "0,87%",
      "raw_fact_uah": "47 080,01",
      "raw_fact_usd": "1 100,80",
      "status": "partial",
      "flags": {
        "early": false,
        "initial": false,
        "source": "304"
      },
      "base_paid_usd": 1100.8,
      "base_paid_uah": 47080.01,
      "exclude_from_summary": false,
      "month_index": 96,
      "id": 96
    },
    {
      "title": "План 01.12.2029",
      "due_label": "01.12.2029",
      "due_date": "2029-12-01",
      "payment_date": null,
      "period_year": 2029,
      "period_month": 12,
      "schedule_usd": 1110.38,
      "fact_usd": null,
      "fact_uah": null,
      "rate": 41.2602,
      "meters": null,
      "percent_increase": "0,87%",
      "raw_fact_uah": "Достроково 30.08.2025",
      "raw_fact_usd": "Достроково 30.08.2025",
      "status": "early",
      "flags": {
        "early": true,
        "initial": false,
        "source": "304"
      },
      "base_paid_usd": 0.0,
      "base_paid_uah": 0.0,
      "exclude_from_summary": false,
      "month_index": 97,
      "id": 97
    },
    {
      "title": "План 01.01.2030",
      "due_label": "01.01.2030",
      "due_date": "2030-01-01",
      "payment_date": null,
      "period_year": 2030,
      "period_month": 1,
      "schedule_usd": 1120.04,
      "fact_usd": null,
      "fact_uah": null,
      "rate": 41.2602,
      "meters": null,
      "percent_increase": "0,87%",
      "raw_fact_uah": "Достроково 30.08.2025",
      "raw_fact_usd": "Достроково 30.08.2025",
      "status": "early",
      "flags": {
        "early": true,
        "initial": false,
        "source": "304"
      },
      "base_paid_usd": 0.0,
      "base_paid_uah": 0.0,
      "exclude_from_summary": false,
      "month_index": 98,
      "id": 98
    },
    {
      "title": "План 01.02.2030",
      "due_label": "01.02.2030",
      "due_date": "2030-02-01",
      "payment_date": null,
      "period_year": 2030,
      "period_month": 2,
      "schedule_usd": 1129.78,
      "fact_usd": null,
      "fact_uah": null,
      "rate": 41.2602,
      "meters": null,
      "percent_increase": "0,87%",
      "raw_fact_uah": "Достроково 30.08.2025",
      "raw_fact_usd": "Достроково 30.08.2025",
      "status": "early",
      "flags": {
        "early": true,
        "initial": false,
        "source": "304"
      },
      "base_paid_usd": 0.0,
      "base_paid_uah": 0.0,
      "exclude_from_summary": false,
      "month_index": 99,
      "id": 99
    },
    {
      "title": "План 01.03.2030",
      "due_label": "01.03.2030",
      "due_date": "2030-03-01",
      "payment_date": null,
      "period_year": 2030,
      "period_month": 3,
      "schedule_usd": 1139.61,
      "fact_usd": null,
      "fact_uah": null,
      "rate": 41.2602,
      "meters": null,
      "percent_increase": "0,87%",
      "raw_fact_uah": "Достроково 30.08.2025",
      "raw_fact_usd": "Достроково 30.08.2025",
      "status": "early",
      "flags": {
        "early": true,
        "initial": false,
        "source": "304"
      },
      "base_paid_usd": 0.0,
      "base_paid_uah": 0.0,
      "exclude_from_summary": false,
      "month_index": 100,
      "id": 100
    },
    {
      "title": "План 01.04.2030",
      "due_label": "01.04.2030",
      "due_date": "2030-04-01",
      "payment_date": null,
      "period_year": 2030,
      "period_month": 4,
      "schedule_usd": 1149.52,
      "fact_usd": null,
      "fact_uah": null,
      "rate": 41.2602,
      "meters": null,
      "percent_increase": "0,87%",
      "raw_fact_uah": "Достроково 30.08.2025",
      "raw_fact_usd": "Достроково 30.08.2025",
      "status": "early",
      "flags": {
        "early": true,
        "initial": false,
        "source": "304"
      },
      "base_paid_usd": 0.0,
      "base_paid_uah": 0.0,
      "exclude_from_summary": false,
      "month_index": 101,
      "id": 101
    },
    {
      "title": "План 01.05.2030",
      "due_label": "01.05.2030",
      "due_date": "2030-05-01",
      "payment_date": null,
      "period_year": 2030,
      "period_month": 5,
      "schedule_usd": 1159.52,
      "fact_usd": null,
      "fact_uah": null,
      "rate": 41.5285,
      "meters": null,
      "percent_increase": "0,87%",
      "raw_fact_uah": "Достроково 30.05.2025",
      "raw_fact_usd": "Достроково 30.05.2025",
      "status": "early",
      "flags": {
        "early": true,
        "initial": false,
        "source": "304"
      },
      "base_paid_usd": 0.0,
      "base_paid_uah": 0.0,
      "exclude_from_summary": false,
      "month_index": 102,
      "id": 102
    }
  ]
}
